{
  "address": "0xF00A3D9226F571B9B2B2D476CAF4E7C6878B48A2",
  "abi": [
    {
      "anonymous": false,
      "inputs": [
        {
          "indexed": true,
          "internalType": "address",
          "name": "owner",
          "type": "address"
        },
        {
          "indexed": true,
          "internalType": "address",
          "name": "spender",
          "type": "address"
        },
        {
          "indexed": false,
          "internalType": "uint256",
          "name": "value",
          "type": "uint256"
        }
      ],
      "name": "Approval",
      "type": "event"
    },
    {
      "anonymous": false,
      "inputs": [
        {
          "indexed": true,
          "internalType": "address",
          "name": "authorizer",
          "type": "address"
        },
        {
          "indexed": true,
          "internalType": "bytes32",
          "name": "nonce",
          "type": "bytes32"
        }
      ],
      "name": "AuthorizationCanceled",
      "type": "event"
    },
    {
      "anonymous": false,
      "inputs": [
        {
          "indexed": true,
          "internalType": "address",
          "name": "authorizer",
          "type": "address"
        },
        {
          "indexed": true,
          "internalType": "bytes32",
          "name": "nonce",
          "type": "bytes32"
        }
      ],
      "name": "AuthorizationUsed",
      "type": "event"
    },
    {
      "anonymous": false,
      "inputs": [
        {
          "indexed": true,
          "internalType": "address",
          "name": "burner",
          "type": "address"
        },
        {
          "indexed": false,
          "internalType": "uint256",
          "name": "amount",
          "type": "uint256"
        }
      ],
      "name": "Burn",
      "type": "event"
    },
    {
      "anonymous": false,
      "inputs": [
        {
          "indexed": true,
          "internalType": "address",
          "name": "newMasterMinter",
          "type": "address"
        }
      ],
      "name": "MasterMinterChanged",
      "type": "event"
    },
    {
      "anonymous": false,
      "inputs": [
        {
          "indexed": true,
          "internalType": "address",
          "name": "minter",
          "type": "address"
        },
        {
          "indexed": true,
          "internalType": "address",
          "name": "to",
          "type": "address"
        },
        {
          "indexed": false,
          "internalType": "uint256",
          "name": "amount",
          "type": "uint256"
        }
      ],
      "name": "Mint",
      "type": "event"
    },
    {
      "anonymous": false,
      "inputs": [
        {
          "indexed": true,
          "internalType": "address",
          "name": "minter",
          "type": "address"
        },
        {
          "indexed": false,
          "internalType": "uint256",
          "name": "minterAllowedAmount",
          "type": "uint256"
        }
      ],
      "name": "MinterConfigured",
      "type": "event"
    },
    {
      "anonymous": false,
      "inputs": [
        {
          "indexed": true,
          "internalType": "address",
          "name": "oldMinter",
          "type": "address"
        }
      ],
      "name": "MinterRemoved",
      "type": "event"
    },
    {
      "anonymous": false,
      "inputs": [
        {
          "indexed": false,
          "internalType": "address",
          "name": "previousOwner",
          "type": "address"
        },
        {
          "indexed": false,
          "internalType": "address",
          "name": "newOwner",
          "type": "address"
        }
      ],
      "name": "OwnershipTransferred",
      "type": "event"
    },
    {
      "anonymous": false,
      "inputs": [],
      "name": "Pause",
      "type": "event"
    },
    {
      "anonymous": false,
      "inputs": [
        {
          "indexed": true,
          "internalType": "address",
          "name": "newAddress",
          "type": "address"
        }
      ],
      "name": "PauserChanged",
      "type": "event"
    },
    {
      "anonymous": false,
      "inputs": [
        {
          "indexed": true,
          "internalType": "address",
          "name": "newRescuer",
          "type": "address"
        }
      ],
      "name": "RescuerChanged",
      "type": "event"
    },
    {
      "anonymous": false,
      "inputs": [
        {
          "indexed": true,
          "internalType": "address",
          "name": "from",
          "type": "address"
        },
        {
          "indexed": true,
          "internalType": "address",
          "name": "to",
          "type": "address"
        },
        {
          "indexed": false,
          "internalType": "uint256",
          "name": "value",
          "type": "uint256"
        }
      ],
      "name": "Transfer",
      "type": "event"
    },
    {
      "anonymous": false,
      "inputs": [],
      "name": "Unpause",
      "type": "event"
    },
    {
      "inputs": [],
      "name": "CANCEL_AUTHORIZATION_TYPEHASH",
      "outputs": [
        {
          "internalType": "bytes32",
          "name": "",
          "type": "bytes32"
        }
      ],
      "stateMutability": "view",
      "type": "function"
    },
    {
      "inputs": [],
      "name": "DOMAIN_SEPARATOR",
      "outputs": [
        {
          "internalType": "bytes32",
          "name": "",
          "type": "bytes32"
        }
      ],
      "stateMutability": "view",
      "type": "function"
    },
    {
      "inputs": [],
      "name": "PERMIT_TYPEHASH",
      "outputs": [
        {
          "internalType": "bytes32",
          "name": "",
          "type": "bytes32"
        }
      ],
      "stateMutability": "view",
      "type": "function"
    },
    {
      "inputs": [],
      "name": "RECEIVE_WITH_AUTHORIZATION_TYPEHASH",
      "outputs": [
        {
          "internalType": "bytes32",
          "name": "",
          "type": "bytes32"
        }
      ],
      "stateMutability": "view",
      "type": "function"
    },
    {
      "inputs": [],
      "name": "TRANSFER_WITH_AUTHORIZATION_TYPEHASH",
      "outputs": [
        {
          "internalType": "bytes32",
          "name": "",
          "type": "bytes32"
        }
      ],
      "stateMutability": "view",
      "type": "function"
    },
    {
      "inputs": [
        {
          "internalType": "address",
          "name": "owner",
          "type": "address"
        },
        {
          "internalType": "address",
          "name": "spender",
          "type": "address"
        }
      ],
      "name": "allowance",
      "outputs": [
        {
          "internalType": "uint256",
          "name": "",
          "type": "uint256"
        }
      ],
      "stateMutability": "view",
      "type": "function"
    },
    {
      "inputs": [
        {
          "internalType": "address",
          "name": "spender",
          "type": "address"
        },
        {
          "internalType": "uint256",
          "name": "value",
          "type": "uint256"
        }
      ],
      "name": "approve",
      "outputs": [
        {
          "internalType": "bool",
          "name": "",
          "type": "bool"
        }
      ],
      "stateMutability": "nonpayable",
      "type": "function"
    },
    {
      "inputs": [
        {
          "internalType": "address",
          "name": "authorizer",
          "type": "address"
        },
        {
          "internalType": "bytes32",
          "name": "nonce",
          "type": "bytes32"
        }
      ],
      "name": "authorizationState",
      "outputs": [
        {
          "internalType": "bool",
          "name": "",
          "type": "bool"
        }
      ],
      "stateMutability": "view",
      "type": "function"
    },
    {
      "inputs": [
        {
          "internalType": "address",
          "name": "account",
          "type": "address"
        }
      ],
      "name": "balanceOf",
      "outputs": [
        {
          "internalType": "uint256",
          "name": "",
          "type": "uint256"
        }
      ],
      "stateMutability": "view",
      "type": "function"
    },
    {
      "inputs": [
        {
          "internalType": "uint256",
          "name": "_amount",
          "type": "uint256"
        }
      ],
      "name": "burn",
      "outputs": [],
      "stateMutability": "nonpayable",
      "type": "function"
    },
    {
      "inputs": [
        {
          "internalType": "address",
          "name": "authorizer",
          "type": "address"
        },
        {
          "internalType": "bytes32",
          "name": "nonce",
          "type": "bytes32"
        },
        {
          "internalType": "uint8",
          "name": "v",
          "type": "uint8"
        },
        {
          "internalType": "bytes32",
          "name": "r",
          "type": "bytes32"
        },
        {
          "internalType": "bytes32",
          "name": "s",
          "type": "bytes32"
        }
      ],
      "name": "cancelAuthorization",
      "outputs": [],
      "stateMutability": "nonpayable",
      "type": "function"
    },
    {
      "inputs": [
        {
          "internalType": "address",
          "name": "minter",
          "type": "address"
        },
        {
          "internalType": "uint256",
          "name": "minterAllowedAmount",
          "type": "uint256"
        }
      ],
      "name": "configureMinter",
      "outputs": [
        {
          "internalType": "bool",
          "name": "",
          "type": "bool"
        }
      ],
      "stateMutability": "nonpayable",
      "type": "function"
    },
    {
      "inputs": [],
      "name": "currency",
      "outputs": [
        {
          "internalType": "string",
          "name": "",
          "type": "string"
        }
      ],
      "stateMutability": "view",
      "type": "function"
    },
    {
      "inputs": [],
      "name": "decimals",
      "outputs": [
        {
          "internalType": "uint8",
          "name": "",
          "type": "uint8"
        }
      ],
      "stateMutability": "view",
      "type": "function"
    },
    {
      "inputs": [
        {
          "internalType": "address",
          "name": "spender",
          "type": "address"
        },
        {
          "internalType": "uint256",
          "name": "decrement",
          "type": "uint256"
        }
      ],
      "name": "decreaseAllowance",
      "outputs": [
        {
          "internalType": "bool",
          "name": "",
          "type": "bool"
        }
      ],
      "stateMutability": "nonpayable",
      "type": "function"
    },
    {
      "inputs": [
        {
          "internalType": "address",
          "name": "spender",
          "type": "address"
        },
        {
          "internalType": "uint256",
          "name": "increment",
          "type": "uint256"
        }
      ],
      "name": "increaseAllowance",
      "outputs": [
        {
          "internalType": "bool",
          "name": "",
          "type": "bool"
        }
      ],
      "stateMutability": "nonpayable",
      "type": "function"
    },
    {
      "inputs": [
        {
          "internalType": "string",
          "name": "tokenName",
          "type": "string"
        },
        {
          "internalType": "string",
          "name": "tokenSymbol",
          "type": "string"
        },
        {
          "internalType": "string",
          "name": "tokenCurrency",
          "type": "string"
        },
        {
          "internalType": "uint8",
          "name": "tokenDecimals",
          "type": "uint8"
        },
        {
          "internalType": "address",
          "name": "newMasterMinter",
          "type": "address"
        },
        {
          "internalType": "address",
          "name": "newPauser",
          "type": "address"
        },
        {
          "internalType": "address",
          "name": "newBlacklister",
          "type": "address"
        },
        {
          "internalType": "address",
          "name": "newOwner",
          "type": "address"
        }
      ],
      "name": "initialize",
      "outputs": [],
      "stateMutability": "nonpayable",
      "type": "function"
    },
    {
      "inputs": [
        {
          "internalType": "string",
          "name": "newName",
          "type": "string"
        }
      ],
      "name": "initializeV2",
      "outputs": [],
      "stateMutability": "nonpayable",
      "type": "function"
    },
    {
      "inputs": [
        {
          "internalType": "address",
          "name": "lostAndFound",
          "type": "address"
        }
      ],
      "name": "initializeV2_1",
      "outputs": [],
      "stateMutability": "nonpayable",
      "type": "function"
    },
    {
      "inputs": [
        {
          "internalType": "address",
          "name": "account",
          "type": "address"
        }
      ],
      "name": "isMinter",
      "outputs": [
        {
          "internalType": "bool",
          "name": "",
          "type": "bool"
        }
      ],
      "stateMutability": "view",
      "type": "function"
    },
    {
      "inputs": [],
      "name": "masterMinter",
      "outputs": [
        {
          "internalType": "address",
          "name": "",
          "type": "address"
        }
      ],
      "stateMutability": "view",
      "type": "function"
    },
    {
      "inputs": [
        {
          "internalType": "address",
          "name": "_to",
          "type": "address"
        },
        {
          "internalType": "uint256",
          "name": "_amount",
          "type": "uint256"
        }
      ],
      "name": "mint",
      "outputs": [
        {
          "internalType": "bool",
          "name": "",
          "type": "bool"
        }
      ],
      "stateMutability": "nonpayable",
      "type": "function"
    },
    {
      "inputs": [
        {
          "internalType": "address",
          "name": "minter",
          "type": "address"
        }
      ],
      "name": "minterAllowance",
      "outputs": [
        {
          "internalType": "uint256",
          "name": "",
          "type": "uint256"
        }
      ],
      "stateMutability": "view",
      "type": "function"
    },
    {
      "inputs": [],
      "name": "name",
      "outputs": [
        {
          "internalType": "string",
          "name": "",
          "type": "string"
        }
      ],
      "stateMutability": "view",
      "type": "function"
    },
    {
      "inputs": [
        {
          "internalType": "address",
          "name": "owner",
          "type": "address"
        }
      ],
      "name": "nonces",
      "outputs": [
        {
          "internalType": "uint256",
          "name": "",
          "type": "uint256"
        }
      ],
      "stateMutability": "view",
      "type": "function"
    },
    {
      "inputs": [],
      "name": "owner",
      "outputs": [
        {
          "internalType": "address",
          "name": "",
          "type": "address"
        }
      ],
      "stateMutability": "view",
      "type": "function"
    },
    {
      "inputs": [],
      "name": "pause",
      "outputs": [],
      "stateMutability": "nonpayable",
      "type": "function"
    },
    {
      "inputs": [],
      "name": "paused",
      "outputs": [
        {
          "internalType": "bool",
          "name": "",
          "type": "bool"
        }
      ],
      "stateMutability": "view",
      "type": "function"
    },
    {
      "inputs": [],
      "name": "pauser",
      "outputs": [
        {
          "internalType": "address",
          "name": "",
          "type": "address"
        }
      ],
      "stateMutability": "view",
      "type": "function"
    },
    {
      "inputs": [
        {
          "internalType": "address",
          "name": "owner",
          "type": "address"
        },
        {
          "internalType": "address",
          "name": "spender",
          "type": "address"
        },
        {
          "internalType": "uint256",
          "name": "value",
          "type": "uint256"
        },
        {
          "internalType": "uint256",
          "name": "deadline",
          "type": "uint256"
        },
        {
          "internalType": "uint8",
          "name": "v",
          "type": "uint8"
        },
        {
          "internalType": "bytes32",
          "name": "r",
          "type": "bytes32"
        },
        {
          "internalType": "bytes32",
          "name": "s",
          "type": "bytes32"
        }
      ],
      "name": "permit",
      "outputs": [],
      "stateMutability": "nonpayable",
      "type": "function"
    },
    {
      "inputs": [
        {
          "internalType": "address",
          "name": "from",
          "type": "address"
        },
        {
          "internalType": "address",
          "name": "to",
          "type": "address"
        },
        {
          "internalType": "uint256",
          "name": "value",
          "type": "uint256"
        },
        {
          "internalType": "uint256",
          "name": "validAfter",
          "type": "uint256"
        },
        {
          "internalType": "uint256",
          "name": "validBefore",
          "type": "uint256"
        },
        {
          "internalType": "bytes32",
          "name": "nonce",
          "type": "bytes32"
        },
        {
          "internalType": "uint8",
          "name": "v",
          "type": "uint8"
        },
        {
          "internalType": "bytes32",
          "name": "r",
          "type": "bytes32"
        },
        {
          "internalType": "bytes32",
          "name": "s",
          "type": "bytes32"
        }
      ],
      "name": "receiveWithAuthorization",
      "outputs": [],
      "stateMutability": "nonpayable",
      "type": "function"
    },
    {
      "inputs": [
        {
          "internalType": "address",
          "name": "minter",
          "type": "address"
        }
      ],
      "name": "removeMinter",
      "outputs": [
        {
          "internalType": "bool",
          "name": "",
          "type": "bool"
        }
      ],
      "stateMutability": "nonpayable",
      "type": "function"
    },
    {
      "inputs": [
        {
          "internalType": "contract IERC20",
          "name": "tokenContract",
          "type": "address"
        },
        {
          "internalType": "address",
          "name": "to",
          "type": "address"
        },
        {
          "internalType": "uint256",
          "name": "amount",
          "type": "uint256"
        }
      ],
      "name": "rescueERC20",
      "outputs": [],
      "stateMutability": "nonpayable",
      "type": "function"
    },
    {
      "inputs": [],
      "name": "rescuer",
      "outputs": [
        {
          "internalType": "address",
          "name": "",
          "type": "address"
        }
      ],
      "stateMutability": "view",
      "type": "function"
    },
    {
      "inputs": [],
      "name": "symbol",
      "outputs": [
        {
          "internalType": "string",
          "name": "",
          "type": "string"
        }
      ],
      "stateMutability": "view",
      "type": "function"
    },
    {
      "inputs": [],
      "name": "totalSupply",
      "outputs": [
        {
          "internalType": "uint256",
          "name": "",
          "type": "uint256"
        }
      ],
      "stateMutability": "view",
      "type": "function"
    },
    {
      "inputs": [
        {
          "internalType": "address",
          "name": "to",
          "type": "address"
        },
        {
          "internalType": "uint256",
          "name": "value",
          "type": "uint256"
        }
      ],
      "name": "transfer",
      "outputs": [
        {
          "internalType": "bool",
          "name": "",
          "type": "bool"
        }
      ],
      "stateMutability": "nonpayable",
      "type": "function"
    },
    {
      "inputs": [
        {
          "internalType": "address",
          "name": "from",
          "type": "address"
        },
        {
          "internalType": "address",
          "name": "to",
          "type": "address"
        },
        {
          "internalType": "uint256",
          "name": "value",
          "type": "uint256"
        }
      ],
      "name": "transferFrom",
      "outputs": [
        {
          "internalType": "bool",
          "name": "",
          "type": "bool"
        }
      ],
      "stateMutability": "nonpayable",
      "type": "function"
    },
    {
      "inputs": [
        {
          "internalType": "address",
          "name": "newOwner",
          "type": "address"
        }
      ],
      "name": "transferOwnership",
      "outputs": [],
      "stateMutability": "nonpayable",
      "type": "function"
    },
    {
      "inputs": [
        {
          "internalType": "address",
          "name": "from",
          "type": "address"
        },
        {
          "internalType": "address",
          "name": "to",
          "type": "address"
        },
        {
          "internalType": "uint256",
          "name": "value",
          "type": "uint256"
        },
        {
          "internalType": "uint256",
          "name": "validAfter",
          "type": "uint256"
        },
        {
          "internalType": "uint256",
          "name": "validBefore",
          "type": "uint256"
        },
        {
          "internalType": "bytes32",
          "name": "nonce",
          "type": "bytes32"
        },
        {
          "internalType": "uint8",
          "name": "v",
          "type": "uint8"
        },
        {
          "internalType": "bytes32",
          "name": "r",
          "type": "bytes32"
        },
        {
          "internalType": "bytes32",
          "name": "s",
          "type": "bytes32"
        }
      ],
      "name": "transferWithAuthorization",
      "outputs": [],
      "stateMutability": "nonpayable",
      "type": "function"
    },
    {
      "inputs": [],
      "name": "unpause",
      "outputs": [],
      "stateMutability": "nonpayable",
      "type": "function"
    },
    {
      "inputs": [
        {
          "internalType": "address",
          "name": "_newMasterMinter",
          "type": "address"
        }
      ],
      "name": "updateMasterMinter",
      "outputs": [],
      "stateMutability": "nonpayable",
      "type": "function"
    },
    {
      "inputs": [
        {
          "internalType": "address",
          "name": "_newPauser",
          "type": "address"
        }
      ],
      "name": "updatePauser",
      "outputs": [],
      "stateMutability": "nonpayable",
      "type": "function"
    },
    {
      "inputs": [
        {
          "internalType": "address",
          "name": "newRescuer",
          "type": "address"
        }
      ],
      "name": "updateRescuer",
      "outputs": [],
      "stateMutability": "nonpayable",
      "type": "function"
    },
    {
      "inputs": [],
      "name": "version",
      "outputs": [
        {
          "internalType": "string",
          "name": "",
          "type": "string"
        }
      ],
      "stateMutability": "pure",
      "type": "function"
    }
  ],
  "transactionHash": "0x384a2da53a6b1c9907ea4a6faaf307dd4e7d4c736b945f01f0db0aace867c9b9",
  "receipt": {
    "to": null,
    "from": "0x9460b481366b7462af4f7991d430e5eB97FAAEB5",
    "contractAddress": "0xF00A3D9226F571B9B2B2D476CAF4E7C6878B48A2",
    "transactionIndex": 50,
    "gasUsed": "5041122",
    "logsBloom": "0x00000000000000000000000000000000000000000000000000000000000000000000000000000000000000000000000000000000000000000000000000000000000000000000000000000000000000000000000000000000000000000000000000000000000000000000000000000000000000000000000000000000000000000000000000000000000000000000000000000000000000000000000000000000000000000000000000000000000000000000000000000000000000000000000000000000000000000000000000000000000000000000000000000000000000000000000000000000000000000000000000000000000000000000000000000000",
    "blockHash": "0x9a6890db273a8a9142d4564e870a032a94037d4a15aa6ab0d3f2a627f4142fae",
    "transactionHash": "0x384a2da53a6b1c9907ea4a6faaf307dd4e7d4c736b945f01f0db0aace867c9b9",
    "logs": [],
    "blockNumber": 9202853,
    "cumulativeGasUsed": "23823029",
    "status": 1,
    "byzantium": true
  },
  "args": [],
  "numDeployments": 2,
  "solcInputHash": "05374334dd76bbed3b7ebd943be22288",
  "metadata": "{\"compiler\":{\"version\":\"0.6.12+commit.27d51765\"},\"language\":\"Solidity\",\"output\":{\"abi\":[{\"anonymous\":false,\"inputs\":[{\"indexed\":true,\"internalType\":\"address\",\"name\":\"owner\",\"type\":\"address\"},{\"indexed\":true,\"internalType\":\"address\",\"name\":\"spender\",\"type\":\"address\"},{\"indexed\":false,\"internalType\":\"uint256\",\"name\":\"value\",\"type\":\"uint256\"}],\"name\":\"Approval\",\"type\":\"event\"},{\"anonymous\":false,\"inputs\":[{\"indexed\":true,\"internalType\":\"address\",\"name\":\"authorizer\",\"type\":\"address\"},{\"indexed\":true,\"internalType\":\"bytes32\",\"name\":\"nonce\",\"type\":\"bytes32\"}],\"name\":\"AuthorizationCanceled\",\"type\":\"event\"},{\"anonymous\":false,\"inputs\":[{\"indexed\":true,\"internalType\":\"address\",\"name\":\"authorizer\",\"type\":\"address\"},{\"indexed\":true,\"internalType\":\"bytes32\",\"name\":\"nonce\",\"type\":\"bytes32\"}],\"name\":\"AuthorizationUsed\",\"type\":\"event\"},{\"anonymous\":false,\"inputs\":[{\"indexed\":true,\"internalType\":\"address\",\"name\":\"burner\",\"type\":\"address\"},{\"indexed\":false,\"internalType\":\"uint256\",\"name\":\"amount\",\"type\":\"uint256\"}],\"name\":\"Burn\",\"type\":\"event\"},{\"anonymous\":false,\"inputs\":[{\"indexed\":true,\"internalType\":\"address\",\"name\":\"newMasterMinter\",\"type\":\"address\"}],\"name\":\"MasterMinterChanged\",\"type\":\"event\"},{\"anonymous\":false,\"inputs\":[{\"indexed\":true,\"internalType\":\"address\",\"name\":\"minter\",\"type\":\"address\"},{\"indexed\":true,\"internalType\":\"address\",\"name\":\"to\",\"type\":\"address\"},{\"indexed\":false,\"internalType\":\"uint256\",\"name\":\"amount\",\"type\":\"uint256\"}],\"name\":\"Mint\",\"type\":\"event\"},{\"anonymous\":false,\"inputs\":[{\"indexed\":true,\"internalType\":\"address\",\"name\":\"minter\",\"type\":\"address\"},{\"indexed\":false,\"internalType\":\"uint256\",\"name\":\"minterAllowedAmount\",\"type\":\"uint256\"}],\"name\":\"MinterConfigured\",\"type\":\"event\"},{\"anonymous\":false,\"inputs\":[{\"indexed\":true,\"internalType\":\"address\",\"name\":\"oldMinter\",\"type\":\"address\"}],\"name\":\"MinterRemoved\",\"type\":\"event\"},{\"anonymous\":false,\"inputs\":[{\"indexed\":false,\"internalType\":\"address\",\"name\":\"previousOwner\",\"type\":\"address\"},{\"indexed\":false,\"internalType\":\"address\",\"name\":\"newOwner\",\"type\":\"address\"}],\"name\":\"OwnershipTransferred\",\"type\":\"event\"},{\"anonymous\":false,\"inputs\":[],\"name\":\"Pause\",\"type\":\"event\"},{\"anonymous\":false,\"inputs\":[{\"indexed\":true,\"internalType\":\"address\",\"name\":\"newAddress\",\"type\":\"address\"}],\"name\":\"PauserChanged\",\"type\":\"event\"},{\"anonymous\":false,\"inputs\":[{\"indexed\":true,\"internalType\":\"address\",\"name\":\"newRescuer\",\"type\":\"address\"}],\"name\":\"RescuerChanged\",\"type\":\"event\"},{\"anonymous\":false,\"inputs\":[{\"indexed\":true,\"internalType\":\"address\",\"name\":\"from\",\"type\":\"address\"},{\"indexed\":true,\"internalType\":\"address\",\"name\":\"to\",\"type\":\"address\"},{\"indexed\":false,\"internalType\":\"uint256\",\"name\":\"value\",\"type\":\"uint256\"}],\"name\":\"Transfer\",\"type\":\"event\"},{\"anonymous\":false,\"inputs\":[],\"name\":\"Unpause\",\"type\":\"event\"},{\"inputs\":[],\"name\":\"CANCEL_AUTHORIZATION_TYPEHASH\",\"outputs\":[{\"internalType\":\"bytes32\",\"name\":\"\",\"type\":\"bytes32\"}],\"stateMutability\":\"view\",\"type\":\"function\"},{\"inputs\":[],\"name\":\"DOMAIN_SEPARATOR\",\"outputs\":[{\"internalType\":\"bytes32\",\"name\":\"\",\"type\":\"bytes32\"}],\"stateMutability\":\"view\",\"type\":\"function\"},{\"inputs\":[],\"name\":\"PERMIT_TYPEHASH\",\"outputs\":[{\"internalType\":\"bytes32\",\"name\":\"\",\"type\":\"bytes32\"}],\"stateMutability\":\"view\",\"type\":\"function\"},{\"inputs\":[],\"name\":\"RECEIVE_WITH_AUTHORIZATION_TYPEHASH\",\"outputs\":[{\"internalType\":\"bytes32\",\"name\":\"\",\"type\":\"bytes32\"}],\"stateMutability\":\"view\",\"type\":\"function\"},{\"inputs\":[],\"name\":\"TRANSFER_WITH_AUTHORIZATION_TYPEHASH\",\"outputs\":[{\"internalType\":\"bytes32\",\"name\":\"\",\"type\":\"bytes32\"}],\"stateMutability\":\"view\",\"type\":\"function\"},{\"inputs\":[{\"internalType\":\"address\",\"name\":\"owner\",\"type\":\"address\"},{\"internalType\":\"address\",\"name\":\"spender\",\"type\":\"address\"}],\"name\":\"allowance\",\"outputs\":[{\"internalType\":\"uint256\",\"name\":\"\",\"type\":\"uint256\"}],\"stateMutability\":\"view\",\"type\":\"function\"},{\"inputs\":[{\"internalType\":\"address\",\"name\":\"spender\",\"type\":\"address\"},{\"internalType\":\"uint256\",\"name\":\"value\",\"type\":\"uint256\"}],\"name\":\"approve\",\"outputs\":[{\"internalType\":\"bool\",\"name\":\"\",\"type\":\"bool\"}],\"stateMutability\":\"nonpayable\",\"type\":\"function\"},{\"inputs\":[{\"internalType\":\"address\",\"name\":\"authorizer\",\"type\":\"address\"},{\"internalType\":\"bytes32\",\"name\":\"nonce\",\"type\":\"bytes32\"}],\"name\":\"authorizationState\",\"outputs\":[{\"internalType\":\"bool\",\"name\":\"\",\"type\":\"bool\"}],\"stateMutability\":\"view\",\"type\":\"function\"},{\"inputs\":[{\"internalType\":\"address\",\"name\":\"account\",\"type\":\"address\"}],\"name\":\"balanceOf\",\"outputs\":[{\"internalType\":\"uint256\",\"name\":\"\",\"type\":\"uint256\"}],\"stateMutability\":\"view\",\"type\":\"function\"},{\"inputs\":[{\"internalType\":\"uint256\",\"name\":\"_amount\",\"type\":\"uint256\"}],\"name\":\"burn\",\"outputs\":[],\"stateMutability\":\"nonpayable\",\"type\":\"function\"},{\"inputs\":[{\"internalType\":\"address\",\"name\":\"authorizer\",\"type\":\"address\"},{\"internalType\":\"bytes32\",\"name\":\"nonce\",\"type\":\"bytes32\"},{\"internalType\":\"uint8\",\"name\":\"v\",\"type\":\"uint8\"},{\"internalType\":\"bytes32\",\"name\":\"r\",\"type\":\"bytes32\"},{\"internalType\":\"bytes32\",\"name\":\"s\",\"type\":\"bytes32\"}],\"name\":\"cancelAuthorization\",\"outputs\":[],\"stateMutability\":\"nonpayable\",\"type\":\"function\"},{\"inputs\":[{\"internalType\":\"address\",\"name\":\"minter\",\"type\":\"address\"},{\"internalType\":\"uint256\",\"name\":\"minterAllowedAmount\",\"type\":\"uint256\"}],\"name\":\"configureMinter\",\"outputs\":[{\"internalType\":\"bool\",\"name\":\"\",\"type\":\"bool\"}],\"stateMutability\":\"nonpayable\",\"type\":\"function\"},{\"inputs\":[],\"name\":\"currency\",\"outputs\":[{\"internalType\":\"string\",\"name\":\"\",\"type\":\"string\"}],\"stateMutability\":\"view\",\"type\":\"function\"},{\"inputs\":[],\"name\":\"decimals\",\"outputs\":[{\"internalType\":\"uint8\",\"name\":\"\",\"type\":\"uint8\"}],\"stateMutability\":\"view\",\"type\":\"function\"},{\"inputs\":[{\"internalType\":\"address\",\"name\":\"spender\",\"type\":\"address\"},{\"internalType\":\"uint256\",\"name\":\"decrement\",\"type\":\"uint256\"}],\"name\":\"decreaseAllowance\",\"outputs\":[{\"internalType\":\"bool\",\"name\":\"\",\"type\":\"bool\"}],\"stateMutability\":\"nonpayable\",\"type\":\"function\"},{\"inputs\":[{\"internalType\":\"address\",\"name\":\"spender\",\"type\":\"address\"},{\"internalType\":\"uint256\",\"name\":\"increment\",\"type\":\"uint256\"}],\"name\":\"increaseAllowance\",\"outputs\":[{\"internalType\":\"bool\",\"name\":\"\",\"type\":\"bool\"}],\"stateMutability\":\"nonpayable\",\"type\":\"function\"},{\"inputs\":[{\"internalType\":\"string\",\"name\":\"tokenName\",\"type\":\"string\"},{\"internalType\":\"string\",\"name\":\"tokenSymbol\",\"type\":\"string\"},{\"internalType\":\"string\",\"name\":\"tokenCurrency\",\"type\":\"string\"},{\"internalType\":\"uint8\",\"name\":\"tokenDecimals\",\"type\":\"uint8\"},{\"internalType\":\"address\",\"name\":\"newMasterMinter\",\"type\":\"address\"},{\"internalType\":\"address\",\"name\":\"newPauser\",\"type\":\"address\"},{\"internalType\":\"address\",\"name\":\"newBlacklister\",\"type\":\"address\"},{\"internalType\":\"address\",\"name\":\"newOwner\",\"type\":\"address\"}],\"name\":\"initialize\",\"outputs\":[],\"stateMutability\":\"nonpayable\",\"type\":\"function\"},{\"inputs\":[{\"internalType\":\"string\",\"name\":\"newName\",\"type\":\"string\"}],\"name\":\"initializeV2\",\"outputs\":[],\"stateMutability\":\"nonpayable\",\"type\":\"function\"},{\"inputs\":[{\"internalType\":\"address\",\"name\":\"lostAndFound\",\"type\":\"address\"}],\"name\":\"initializeV2_1\",\"outputs\":[],\"stateMutability\":\"nonpayable\",\"type\":\"function\"},{\"inputs\":[{\"internalType\":\"address\",\"name\":\"account\",\"type\":\"address\"}],\"name\":\"isMinter\",\"outputs\":[{\"internalType\":\"bool\",\"name\":\"\",\"type\":\"bool\"}],\"stateMutability\":\"view\",\"type\":\"function\"},{\"inputs\":[],\"name\":\"masterMinter\",\"outputs\":[{\"internalType\":\"address\",\"name\":\"\",\"type\":\"address\"}],\"stateMutability\":\"view\",\"type\":\"function\"},{\"inputs\":[{\"internalType\":\"address\",\"name\":\"_to\",\"type\":\"address\"},{\"internalType\":\"uint256\",\"name\":\"_amount\",\"type\":\"uint256\"}],\"name\":\"mint\",\"outputs\":[{\"internalType\":\"bool\",\"name\":\"\",\"type\":\"bool\"}],\"stateMutability\":\"nonpayable\",\"type\":\"function\"},{\"inputs\":[{\"internalType\":\"address\",\"name\":\"minter\",\"type\":\"address\"}],\"name\":\"minterAllowance\",\"outputs\":[{\"internalType\":\"uint256\",\"name\":\"\",\"type\":\"uint256\"}],\"stateMutability\":\"view\",\"type\":\"function\"},{\"inputs\":[],\"name\":\"name\",\"outputs\":[{\"internalType\":\"string\",\"name\":\"\",\"type\":\"string\"}],\"stateMutability\":\"view\",\"type\":\"function\"},{\"inputs\":[{\"internalType\":\"address\",\"name\":\"owner\",\"type\":\"address\"}],\"name\":\"nonces\",\"outputs\":[{\"internalType\":\"uint256\",\"name\":\"\",\"type\":\"uint256\"}],\"stateMutability\":\"view\",\"type\":\"function\"},{\"inputs\":[],\"name\":\"owner\",\"outputs\":[{\"internalType\":\"address\",\"name\":\"\",\"type\":\"address\"}],\"stateMutability\":\"view\",\"type\":\"function\"},{\"inputs\":[],\"name\":\"pause\",\"outputs\":[],\"stateMutability\":\"nonpayable\",\"type\":\"function\"},{\"inputs\":[],\"name\":\"paused\",\"outputs\":[{\"internalType\":\"bool\",\"name\":\"\",\"type\":\"bool\"}],\"stateMutability\":\"view\",\"type\":\"function\"},{\"inputs\":[],\"name\":\"pauser\",\"outputs\":[{\"internalType\":\"address\",\"name\":\"\",\"type\":\"address\"}],\"stateMutability\":\"view\",\"type\":\"function\"},{\"inputs\":[{\"internalType\":\"address\",\"name\":\"owner\",\"type\":\"address\"},{\"internalType\":\"address\",\"name\":\"spender\",\"type\":\"address\"},{\"internalType\":\"uint256\",\"name\":\"value\",\"type\":\"uint256\"},{\"internalType\":\"uint256\",\"name\":\"deadline\",\"type\":\"uint256\"},{\"internalType\":\"uint8\",\"name\":\"v\",\"type\":\"uint8\"},{\"internalType\":\"bytes32\",\"name\":\"r\",\"type\":\"bytes32\"},{\"internalType\":\"bytes32\",\"name\":\"s\",\"type\":\"bytes32\"}],\"name\":\"permit\",\"outputs\":[],\"stateMutability\":\"nonpayable\",\"type\":\"function\"},{\"inputs\":[{\"internalType\":\"address\",\"name\":\"from\",\"type\":\"address\"},{\"internalType\":\"address\",\"name\":\"to\",\"type\":\"address\"},{\"internalType\":\"uint256\",\"name\":\"value\",\"type\":\"uint256\"},{\"internalType\":\"uint256\",\"name\":\"validAfter\",\"type\":\"uint256\"},{\"internalType\":\"uint256\",\"name\":\"validBefore\",\"type\":\"uint256\"},{\"internalType\":\"bytes32\",\"name\":\"nonce\",\"type\":\"bytes32\"},{\"internalType\":\"uint8\",\"name\":\"v\",\"type\":\"uint8\"},{\"internalType\":\"bytes32\",\"name\":\"r\",\"type\":\"bytes32\"},{\"internalType\":\"bytes32\",\"name\":\"s\",\"type\":\"bytes32\"}],\"name\":\"receiveWithAuthorization\",\"outputs\":[],\"stateMutability\":\"nonpayable\",\"type\":\"function\"},{\"inputs\":[{\"internalType\":\"address\",\"name\":\"minter\",\"type\":\"address\"}],\"name\":\"removeMinter\",\"outputs\":[{\"internalType\":\"bool\",\"name\":\"\",\"type\":\"bool\"}],\"stateMutability\":\"nonpayable\",\"type\":\"function\"},{\"inputs\":[{\"internalType\":\"contract IERC20\",\"name\":\"tokenContract\",\"type\":\"address\"},{\"internalType\":\"address\",\"name\":\"to\",\"type\":\"address\"},{\"internalType\":\"uint256\",\"name\":\"amount\",\"type\":\"uint256\"}],\"name\":\"rescueERC20\",\"outputs\":[],\"stateMutability\":\"nonpayable\",\"type\":\"function\"},{\"inputs\":[],\"name\":\"rescuer\",\"outputs\":[{\"internalType\":\"address\",\"name\":\"\",\"type\":\"address\"}],\"stateMutability\":\"view\",\"type\":\"function\"},{\"inputs\":[],\"name\":\"symbol\",\"outputs\":[{\"internalType\":\"string\",\"name\":\"\",\"type\":\"string\"}],\"stateMutability\":\"view\",\"type\":\"function\"},{\"inputs\":[],\"name\":\"totalSupply\",\"outputs\":[{\"internalType\":\"uint256\",\"name\":\"\",\"type\":\"uint256\"}],\"stateMutability\":\"view\",\"type\":\"function\"},{\"inputs\":[{\"internalType\":\"address\",\"name\":\"to\",\"type\":\"address\"},{\"internalType\":\"uint256\",\"name\":\"value\",\"type\":\"uint256\"}],\"name\":\"transfer\",\"outputs\":[{\"internalType\":\"bool\",\"name\":\"\",\"type\":\"bool\"}],\"stateMutability\":\"nonpayable\",\"type\":\"function\"},{\"inputs\":[{\"internalType\":\"address\",\"name\":\"from\",\"type\":\"address\"},{\"internalType\":\"address\",\"name\":\"to\",\"type\":\"address\"},{\"internalType\":\"uint256\",\"name\":\"value\",\"type\":\"uint256\"}],\"name\":\"transferFrom\",\"outputs\":[{\"internalType\":\"bool\",\"name\":\"\",\"type\":\"bool\"}],\"stateMutability\":\"nonpayable\",\"type\":\"function\"},{\"inputs\":[{\"internalType\":\"address\",\"name\":\"newOwner\",\"type\":\"address\"}],\"name\":\"transferOwnership\",\"outputs\":[],\"stateMutability\":\"nonpayable\",\"type\":\"function\"},{\"inputs\":[{\"internalType\":\"address\",\"name\":\"from\",\"type\":\"address\"},{\"internalType\":\"address\",\"name\":\"to\",\"type\":\"address\"},{\"internalType\":\"uint256\",\"name\":\"value\",\"type\":\"uint256\"},{\"internalType\":\"uint256\",\"name\":\"validAfter\",\"type\":\"uint256\"},{\"internalType\":\"uint256\",\"name\":\"validBefore\",\"type\":\"uint256\"},{\"internalType\":\"bytes32\",\"name\":\"nonce\",\"type\":\"bytes32\"},{\"internalType\":\"uint8\",\"name\":\"v\",\"type\":\"uint8\"},{\"internalType\":\"bytes32\",\"name\":\"r\",\"type\":\"bytes32\"},{\"internalType\":\"bytes32\",\"name\":\"s\",\"type\":\"bytes32\"}],\"name\":\"transferWithAuthorization\",\"outputs\":[],\"stateMutability\":\"nonpayable\",\"type\":\"function\"},{\"inputs\":[],\"name\":\"unpause\",\"outputs\":[],\"stateMutability\":\"nonpayable\",\"type\":\"function\"},{\"inputs\":[{\"internalType\":\"address\",\"name\":\"_newMasterMinter\",\"type\":\"address\"}],\"name\":\"updateMasterMinter\",\"outputs\":[],\"stateMutability\":\"nonpayable\",\"type\":\"function\"},{\"inputs\":[{\"internalType\":\"address\",\"name\":\"_newPauser\",\"type\":\"address\"}],\"name\":\"updatePauser\",\"outputs\":[],\"stateMutability\":\"nonpayable\",\"type\":\"function\"},{\"inputs\":[{\"internalType\":\"address\",\"name\":\"newRescuer\",\"type\":\"address\"}],\"name\":\"updateRescuer\",\"outputs\":[],\"stateMutability\":\"nonpayable\",\"type\":\"function\"},{\"inputs\":[],\"name\":\"version\",\"outputs\":[{\"internalType\":\"string\",\"name\":\"\",\"type\":\"string\"}],\"stateMutability\":\"pure\",\"type\":\"function\"}],\"devdoc\":{\"kind\":\"dev\",\"methods\":{\"allowance(address,address)\":{\"params\":{\"owner\":\"Token owner's address\",\"spender\":\"Spender's address\"},\"returns\":{\"_0\":\"Allowance amount\"}},\"approve(address,uint256)\":{\"params\":{\"spender\":\"Spender's address\",\"value\":\"Allowance amount\"},\"returns\":{\"_0\":\"True if successful\"}},\"authorizationState(address,bytes32)\":{\"details\":\"Nonces are randomly generated 32-byte data unique to the authorizer's address\",\"params\":{\"authorizer\":\"Authorizer's address\",\"nonce\":\"Nonce of the authorization\"},\"returns\":{\"_0\":\"True if the nonce is used\"}},\"balanceOf(address)\":{\"details\":\"Get token balance of an account\",\"params\":{\"account\":\"address The account\"}},\"burn(uint256)\":{\"details\":\"allows a minter to burn some of its own tokens Validates that caller is a minter and that sender is not blacklisted amount is less than or equal to the minter's account balance\",\"params\":{\"_amount\":\"uint256 the amount of tokens to be burned\"}},\"cancelAuthorization(address,bytes32,uint8,bytes32,bytes32)\":{\"details\":\"Works only if the authorization is not yet used.\",\"params\":{\"authorizer\":\"Authorizer's address\",\"nonce\":\"Nonce of the authorization\",\"r\":\"r of the signature\",\"s\":\"s of the signature\",\"v\":\"v of the signature\"}},\"configureMinter(address,uint256)\":{\"details\":\"Function to add/update a new minter\",\"params\":{\"minter\":\"The address of the minter\",\"minterAllowedAmount\":\"The minting amount allowed for the minter\"},\"returns\":{\"_0\":\"True if the operation was successful.\"}},\"decreaseAllowance(address,uint256)\":{\"params\":{\"decrement\":\"Amount of decrease in allowance\",\"spender\":\"Spender's address\"},\"returns\":{\"_0\":\"True if successful\"}},\"increaseAllowance(address,uint256)\":{\"params\":{\"increment\":\"Amount of increase in allowance\",\"spender\":\"Spender's address\"},\"returns\":{\"_0\":\"True if successful\"}},\"initializeV2(string)\":{\"params\":{\"newName\":\"New token name\"}},\"initializeV2_1(address)\":{\"params\":{\"lostAndFound\":\"The address to which the locked funds are sent\"}},\"isMinter(address)\":{\"details\":\"Checks if account is a minter\",\"params\":{\"account\":\"The address to check\"}},\"mint(address,uint256)\":{\"details\":\"Function to mint tokens\",\"params\":{\"_amount\":\"The amount of tokens to mint. Must be less than or equal to the minterAllowance of the caller.\",\"_to\":\"The address that will receive the minted tokens.\"},\"returns\":{\"_0\":\"A boolean that indicates if the operation was successful.\"}},\"minterAllowance(address)\":{\"details\":\"Get minter allowance for an account\",\"params\":{\"minter\":\"The address of the minter\"}},\"nonces(address)\":{\"params\":{\"owner\":\"Token owner's address (Authorizer)\"},\"returns\":{\"_0\":\"Next nonce\"}},\"owner()\":{\"details\":\"Tells the address of the owner\",\"returns\":{\"_0\":\"the address of the owner\"}},\"pause()\":{\"details\":\"called by the owner to pause, triggers stopped state\"},\"permit(address,address,uint256,uint256,uint8,bytes32,bytes32)\":{\"params\":{\"deadline\":\"Expiration time, seconds since the epoch\",\"owner\":\"Token owner's address (Authorizer)\",\"r\":\"r of the signature\",\"s\":\"s of the signature\",\"spender\":\"Spender's address\",\"v\":\"v of the signature\",\"value\":\"Amount of allowance\"}},\"receiveWithAuthorization(address,address,uint256,uint256,uint256,bytes32,uint8,bytes32,bytes32)\":{\"details\":\"This has an additional check to ensure that the payee's address matches the caller of this function to prevent front-running attacks.\",\"params\":{\"from\":\"Payer's address (Authorizer)\",\"nonce\":\"Unique nonce\",\"r\":\"r of the signature\",\"s\":\"s of the signature\",\"to\":\"Payee's address\",\"v\":\"v of the signature\",\"validAfter\":\"The time after which this is valid (unix time)\",\"validBefore\":\"The time before which this is valid (unix time)\",\"value\":\"Amount to be transferred\"}},\"removeMinter(address)\":{\"details\":\"Function to remove a minter\",\"params\":{\"minter\":\"The address of the minter to remove\"},\"returns\":{\"_0\":\"True if the operation was successful.\"}},\"rescueERC20(address,address,uint256)\":{\"params\":{\"amount\":\"Amount to withdraw\",\"to\":\"Recipient address\",\"tokenContract\":\"ERC20 token contract address\"}},\"rescuer()\":{\"returns\":{\"_0\":\"Rescuer's address\"}},\"totalSupply()\":{\"details\":\"Get totalSupply of token\"},\"transfer(address,uint256)\":{\"params\":{\"to\":\"Payee's address\",\"value\":\"Transfer amount\"},\"returns\":{\"_0\":\"True if successful\"}},\"transferFrom(address,address,uint256)\":{\"params\":{\"from\":\"Payer's address\",\"to\":\"Payee's address\",\"value\":\"Transfer amount\"},\"returns\":{\"_0\":\"True if successful\"}},\"transferOwnership(address)\":{\"details\":\"Allows the current owner to transfer control of the contract to a newOwner.\",\"params\":{\"newOwner\":\"The address to transfer ownership to.\"}},\"transferWithAuthorization(address,address,uint256,uint256,uint256,bytes32,uint8,bytes32,bytes32)\":{\"params\":{\"from\":\"Payer's address (Authorizer)\",\"nonce\":\"Unique nonce\",\"r\":\"r of the signature\",\"s\":\"s of the signature\",\"to\":\"Payee's address\",\"v\":\"v of the signature\",\"validAfter\":\"The time after which this is valid (unix time)\",\"validBefore\":\"The time before which this is valid (unix time)\",\"value\":\"Amount to be transferred\"}},\"unpause()\":{\"details\":\"called by the owner to unpause, returns to normal state\"},\"updatePauser(address)\":{\"details\":\"update the pauser role\"},\"updateRescuer(address)\":{\"params\":{\"newRescuer\":\"New rescuer's address\"}},\"version()\":{\"returns\":{\"_0\":\"Version string\"}}},\"title\":\"FiatToken V2.1\",\"version\":1},\"userdoc\":{\"kind\":\"user\",\"methods\":{\"allowance(address,address)\":{\"notice\":\"Amount of remaining tokens spender is allowed to transfer on behalf of the token owner\"},\"approve(address,uint256)\":{\"notice\":\"Set spender's allowance over the caller's tokens to be a given value.\"},\"authorizationState(address,bytes32)\":{\"notice\":\"Returns the state of an authorization\"},\"cancelAuthorization(address,bytes32,uint8,bytes32,bytes32)\":{\"notice\":\"Attempt to cancel an authorization\"},\"decreaseAllowance(address,uint256)\":{\"notice\":\"Decrease the allowance by a given decrement\"},\"increaseAllowance(address,uint256)\":{\"notice\":\"Increase the allowance by a given increment\"},\"initializeV2(string)\":{\"notice\":\"Initialize v2\"},\"initializeV2_1(address)\":{\"notice\":\"Initialize v2.1\"},\"nonces(address)\":{\"notice\":\"Nonces for permit\"},\"permit(address,address,uint256,uint256,uint8,bytes32,bytes32)\":{\"notice\":\"Update allowance with a signed permit\"},\"receiveWithAuthorization(address,address,uint256,uint256,uint256,bytes32,uint8,bytes32,bytes32)\":{\"notice\":\"Receive a transfer with a signed authorization from the payer\"},\"rescueERC20(address,address,uint256)\":{\"notice\":\"Rescue ERC20 tokens locked up in this contract.\"},\"rescuer()\":{\"notice\":\"Returns current rescuer\"},\"transfer(address,uint256)\":{\"notice\":\"Transfer tokens from the caller\"},\"transferFrom(address,address,uint256)\":{\"notice\":\"Transfer tokens by spending allowance\"},\"transferWithAuthorization(address,address,uint256,uint256,uint256,bytes32,uint8,bytes32,bytes32)\":{\"notice\":\"Execute a transfer with a signed authorization\"},\"updateRescuer(address)\":{\"notice\":\"Assign the rescuer role to a given address.\"},\"version()\":{\"notice\":\"Version string for the EIP712 domain separator\"}},\"notice\":\"ERC20 Token backed by fiat reserves, version 2.1\",\"version\":1}},\"settings\":{\"compilationTarget\":{\"contracts/test/USDC_ETH.sol\":\"FiatTokenV2_1\"},\"evmVersion\":\"istanbul\",\"libraries\":{},\"metadata\":{\"bytecodeHash\":\"ipfs\",\"useLiteralContent\":true},\"optimizer\":{\"enabled\":false,\"runs\":200},\"remappings\":[]},\"sources\":{\"contracts/test/USDC_ETH.sol\":{\"content\":\"/**\\n *Submitted for verification at Etherscan.io on 2021-04-17\\n */\\n\\n// File: @openzeppelin/contracts/math/SafeMath.sol\\n\\n// SPDX-License-Identifier: MIT\\n\\npragma solidity ^0.6.0;\\n\\n/**\\n * @dev Wrappers over Solidity's arithmetic operations with added overflow\\n * checks.\\n *\\n * Arithmetic operations in Solidity wrap on overflow. This can easily result\\n * in bugs, because programmers usually assume that an overflow raises an\\n * error, which is the standard behavior in high level programming languages.\\n * `SafeMath` restores this intuition by reverting the transaction when an\\n * operation overflows.\\n *\\n * Using this library instead of the unchecked operations eliminates an entire\\n * class of bugs, so it's recommended to use it always.\\n */\\nlibrary SafeMath {\\n    /**\\n     * @dev Returns the addition of two unsigned integers, reverting on\\n     * overflow.\\n     *\\n     * Counterpart to Solidity's `+` operator.\\n     *\\n     * Requirements:\\n     *\\n     * - Addition cannot overflow.\\n     */\\n    function add(uint256 a, uint256 b) internal pure returns (uint256) {\\n        uint256 c = a + b;\\n        require(c >= a, \\\"SafeMath: addition overflow\\\");\\n\\n        return c;\\n    }\\n\\n    /**\\n     * @dev Returns the subtraction of two unsigned integers, reverting on\\n     * overflow (when the result is negative).\\n     *\\n     * Counterpart to Solidity's `-` operator.\\n     *\\n     * Requirements:\\n     *\\n     * - Subtraction cannot overflow.\\n     */\\n    function sub(uint256 a, uint256 b) internal pure returns (uint256) {\\n        return sub(a, b, \\\"SafeMath: subtraction overflow\\\");\\n    }\\n\\n    /**\\n     * @dev Returns the subtraction of two unsigned integers, reverting with custom message on\\n     * overflow (when the result is negative).\\n     *\\n     * Counterpart to Solidity's `-` operator.\\n     *\\n     * Requirements:\\n     *\\n     * - Subtraction cannot overflow.\\n     */\\n    function sub(\\n        uint256 a,\\n        uint256 b,\\n        string memory errorMessage\\n    ) internal pure returns (uint256) {\\n        require(b <= a, errorMessage);\\n        uint256 c = a - b;\\n\\n        return c;\\n    }\\n\\n    /**\\n     * @dev Returns the multiplication of two unsigned integers, reverting on\\n     * overflow.\\n     *\\n     * Counterpart to Solidity's `*` operator.\\n     *\\n     * Requirements:\\n     *\\n     * - Multiplication cannot overflow.\\n     */\\n    function mul(uint256 a, uint256 b) internal pure returns (uint256) {\\n        // Gas optimization: this is cheaper than requiring 'a' not being zero, but the\\n        // benefit is lost if 'b' is also tested.\\n        // See: https://github.com/OpenZeppelin/openzeppelin-contracts/pull/522\\n        if (a == 0) {\\n            return 0;\\n        }\\n\\n        uint256 c = a * b;\\n        require(c / a == b, \\\"SafeMath: multiplication overflow\\\");\\n\\n        return c;\\n    }\\n\\n    /**\\n     * @dev Returns the integer division of two unsigned integers. Reverts on\\n     * division by zero. The result is rounded towards zero.\\n     *\\n     * Counterpart to Solidity's `/` operator. Note: this function uses a\\n     * `revert` opcode (which leaves remaining gas untouched) while Solidity\\n     * uses an invalid opcode to revert (consuming all remaining gas).\\n     *\\n     * Requirements:\\n     *\\n     * - The divisor cannot be zero.\\n     */\\n    function div(uint256 a, uint256 b) internal pure returns (uint256) {\\n        return div(a, b, \\\"SafeMath: division by zero\\\");\\n    }\\n\\n    /**\\n     * @dev Returns the integer division of two unsigned integers. Reverts with custom message on\\n     * division by zero. The result is rounded towards zero.\\n     *\\n     * Counterpart to Solidity's `/` operator. Note: this function uses a\\n     * `revert` opcode (which leaves remaining gas untouched) while Solidity\\n     * uses an invalid opcode to revert (consuming all remaining gas).\\n     *\\n     * Requirements:\\n     *\\n     * - The divisor cannot be zero.\\n     */\\n    function div(\\n        uint256 a,\\n        uint256 b,\\n        string memory errorMessage\\n    ) internal pure returns (uint256) {\\n        require(b > 0, errorMessage);\\n        uint256 c = a / b;\\n        // assert(a == b * c + a % b); // There is no case in which this doesn't hold\\n\\n        return c;\\n    }\\n\\n    /**\\n     * @dev Returns the remainder of dividing two unsigned integers. (unsigned integer modulo),\\n     * Reverts when dividing by zero.\\n     *\\n     * Counterpart to Solidity's `%` operator. This function uses a `revert`\\n     * opcode (which leaves remaining gas untouched) while Solidity uses an\\n     * invalid opcode to revert (consuming all remaining gas).\\n     *\\n     * Requirements:\\n     *\\n     * - The divisor cannot be zero.\\n     */\\n    function mod(uint256 a, uint256 b) internal pure returns (uint256) {\\n        return mod(a, b, \\\"SafeMath: modulo by zero\\\");\\n    }\\n\\n    /**\\n     * @dev Returns the remainder of dividing two unsigned integers. (unsigned integer modulo),\\n     * Reverts with custom message when dividing by zero.\\n     *\\n     * Counterpart to Solidity's `%` operator. This function uses a `revert`\\n     * opcode (which leaves remaining gas untouched) while Solidity uses an\\n     * invalid opcode to revert (consuming all remaining gas).\\n     *\\n     * Requirements:\\n     *\\n     * - The divisor cannot be zero.\\n     */\\n    function mod(\\n        uint256 a,\\n        uint256 b,\\n        string memory errorMessage\\n    ) internal pure returns (uint256) {\\n        require(b != 0, errorMessage);\\n        return a % b;\\n    }\\n}\\n\\n// File: @openzeppelin/contracts/token/ERC20/IERC20.sol\\n\\npragma solidity ^0.6.0;\\n\\n/**\\n * @dev Interface of the ERC20 standard as defined in the EIP.\\n */\\ninterface IERC20 {\\n    /**\\n     * @dev Returns the amount of tokens in existence.\\n     */\\n    function totalSupply() external view returns (uint256);\\n\\n    /**\\n     * @dev Returns the amount of tokens owned by `account`.\\n     */\\n    function balanceOf(address account) external view returns (uint256);\\n\\n    /**\\n     * @dev Moves `amount` tokens from the caller's account to `recipient`.\\n     *\\n     * Returns a boolean value indicating whether the operation succeeded.\\n     *\\n     * Emits a {Transfer} event.\\n     */\\n    function transfer(\\n        address recipient,\\n        uint256 amount\\n    ) external returns (bool);\\n\\n    /**\\n     * @dev Returns the remaining number of tokens that `spender` will be\\n     * allowed to spend on behalf of `owner` through {transferFrom}. This is\\n     * zero by default.\\n     *\\n     * This value changes when {approve} or {transferFrom} are called.\\n     */\\n    function allowance(\\n        address owner,\\n        address spender\\n    ) external view returns (uint256);\\n\\n    /**\\n     * @dev Sets `amount` as the allowance of `spender` over the caller's tokens.\\n     *\\n     * Returns a boolean value indicating whether the operation succeeded.\\n     *\\n     * IMPORTANT: Beware that changing an allowance with this method brings the risk\\n     * that someone may use both the old and the new allowance by unfortunate\\n     * transaction ordering. One possible solution to mitigate this race\\n     * condition is to first reduce the spender's allowance to 0 and set the\\n     * desired value afterwards:\\n     * https://github.com/ethereum/EIPs/issues/20#issuecomment-263524729\\n     *\\n     * Emits an {Approval} event.\\n     */\\n    function approve(address spender, uint256 amount) external returns (bool);\\n\\n    /**\\n     * @dev Moves `amount` tokens from `sender` to `recipient` using the\\n     * allowance mechanism. `amount` is then deducted from the caller's\\n     * allowance.\\n     *\\n     * Returns a boolean value indicating whether the operation succeeded.\\n     *\\n     * Emits a {Transfer} event.\\n     */\\n    function transferFrom(\\n        address sender,\\n        address recipient,\\n        uint256 amount\\n    ) external returns (bool);\\n\\n    /**\\n     * @dev Emitted when `value` tokens are moved from one account (`from`) to\\n     * another (`to`).\\n     *\\n     * Note that `value` may be zero.\\n     */\\n    event Transfer(address indexed from, address indexed to, uint256 value);\\n\\n    /**\\n     * @dev Emitted when the allowance of a `spender` for an `owner` is set by\\n     * a call to {approve}. `value` is the new allowance.\\n     */\\n    event Approval(\\n        address indexed owner,\\n        address indexed spender,\\n        uint256 value\\n    );\\n}\\n\\n// File: contracts/v1/AbstractFiatTokenV1.sol\\n\\n/**\\n * Copyright (c) 2018-2020 CENTRE SECZ\\n *\\n * Permission is hereby granted, free of charge, to any person obtaining a copy\\n * of this software and associated documentation files (the \\\"Software\\\"), to deal\\n * in the Software without restriction, including without limitation the rights\\n * to use, copy, modify, merge, publish, distribute, sublicense, and/or sell\\n * copies of the Software, and to permit persons to whom the Software is\\n * furnished to do so, subject to the following conditions:\\n *\\n * The above copyright notice and this permission notice shall be included in\\n * copies or substantial portions of the Software.\\n *\\n * THE SOFTWARE IS PROVIDED \\\"AS IS\\\", WITHOUT WARRANTY OF ANY KIND, EXPRESS OR\\n * IMPLIED, INCLUDING BUT NOT LIMITED TO THE WARRANTIES OF MERCHANTABILITY,\\n * FITNESS FOR A PARTICULAR PURPOSE AND NONINFRINGEMENT. IN NO EVENT SHALL THE\\n * AUTHORS OR COPYRIGHT HOLDERS BE LIABLE FOR ANY CLAIM, DAMAGES OR OTHER\\n * LIABILITY, WHETHER IN AN ACTION OF CONTRACT, TORT OR OTHERWISE, ARISING FROM,\\n * OUT OF OR IN CONNECTION WITH THE SOFTWARE OR THE USE OR OTHER DEALINGS IN THE\\n * SOFTWARE.\\n */\\n\\npragma solidity 0.6.12;\\n\\nabstract contract AbstractFiatTokenV1 is IERC20 {\\n    function _approve(\\n        address owner,\\n        address spender,\\n        uint256 value\\n    ) internal virtual;\\n\\n    function _transfer(\\n        address from,\\n        address to,\\n        uint256 value\\n    ) internal virtual;\\n}\\n\\n// File: contracts/v1/Ownable.sol\\n\\n/**\\n * Copyright (c) 2018 zOS Global Limited.\\n * Copyright (c) 2018-2020 CENTRE SECZ\\n *\\n * Permission is hereby granted, free of charge, to any person obtaining a copy\\n * of this software and associated documentation files (the \\\"Software\\\"), to deal\\n * in the Software without restriction, including without limitation the rights\\n * to use, copy, modify, merge, publish, distribute, sublicense, and/or sell\\n * copies of the Software, and to permit persons to whom the Software is\\n * furnished to do so, subject to the following conditions:\\n *\\n * The above copyright notice and this permission notice shall be included in\\n * copies or substantial portions of the Software.\\n *\\n * THE SOFTWARE IS PROVIDED \\\"AS IS\\\", WITHOUT WARRANTY OF ANY KIND, EXPRESS OR\\n * IMPLIED, INCLUDING BUT NOT LIMITED TO THE WARRANTIES OF MERCHANTABILITY,\\n * FITNESS FOR A PARTICULAR PURPOSE AND NONINFRINGEMENT. IN NO EVENT SHALL THE\\n * AUTHORS OR COPYRIGHT HOLDERS BE LIABLE FOR ANY CLAIM, DAMAGES OR OTHER\\n * LIABILITY, WHETHER IN AN ACTION OF CONTRACT, TORT OR OTHERWISE, ARISING FROM,\\n * OUT OF OR IN CONNECTION WITH THE SOFTWARE OR THE USE OR OTHER DEALINGS IN THE\\n * SOFTWARE.\\n */\\npragma solidity 0.6.12;\\n\\n/**\\n * @notice The Ownable contract has an owner address, and provides basic\\n * authorization control functions\\n * @dev Forked from https://github.com/OpenZeppelin/openzeppelin-labs/blob/3887ab77b8adafba4a26ace002f3a684c1a3388b/upgradeability_ownership/contracts/ownership/Ownable.sol\\n * Modifications:\\n * 1. Consolidate OwnableStorage into this contract (7/13/18)\\n * 2. Reformat, conform to Solidity 0.6 syntax, and add error messages (5/13/20)\\n * 3. Make public functions external (5/27/20)\\n */\\ncontract Ownable {\\n    // Owner of the contract\\n    address private _owner;\\n\\n    /**\\n     * @dev Event to show ownership has been transferred\\n     * @param previousOwner representing the address of the previous owner\\n     * @param newOwner representing the address of the new owner\\n     */\\n    event OwnershipTransferred(address previousOwner, address newOwner);\\n\\n    /**\\n     * @dev The constructor sets the original owner of the contract to the sender account.\\n     */\\n    constructor() public {\\n        setOwner(msg.sender);\\n    }\\n\\n    /**\\n     * @dev Tells the address of the owner\\n     * @return the address of the owner\\n     */\\n    function owner() external view returns (address) {\\n        return _owner;\\n    }\\n\\n    /**\\n     * @dev Sets a new owner address\\n     */\\n    function setOwner(address newOwner) internal {\\n        _owner = newOwner;\\n    }\\n\\n    /**\\n     * @dev Throws if called by any account other than the owner.\\n     */\\n    modifier onlyOwner() {\\n        require(msg.sender == _owner, \\\"Ownable: caller is not the owner\\\");\\n        _;\\n    }\\n\\n    /**\\n     * @dev Allows the current owner to transfer control of the contract to a newOwner.\\n     * @param newOwner The address to transfer ownership to.\\n     */\\n    function transferOwnership(address newOwner) external onlyOwner {\\n        require(\\n            newOwner != address(0),\\n            \\\"Ownable: new owner is the zero address\\\"\\n        );\\n        emit OwnershipTransferred(_owner, newOwner);\\n        setOwner(newOwner);\\n    }\\n}\\n\\n// File: contracts/v1/Pausable.sol\\n\\n/**\\n * Copyright (c) 2016 Smart Contract Solutions, Inc.\\n * Copyright (c) 2018-2020 CENTRE SECZ0\\n *\\n * Permission is hereby granted, free of charge, to any person obtaining a copy\\n * of this software and associated documentation files (the \\\"Software\\\"), to deal\\n * in the Software without restriction, including without limitation the rights\\n * to use, copy, modify, merge, publish, distribute, sublicense, and/or sell\\n * copies of the Software, and to permit persons to whom the Software is\\n * furnished to do so, subject to the following conditions:\\n *\\n * The above copyright notice and this permission notice shall be included in\\n * copies or substantial portions of the Software.\\n *\\n * THE SOFTWARE IS PROVIDED \\\"AS IS\\\", WITHOUT WARRANTY OF ANY KIND, EXPRESS OR\\n * IMPLIED, INCLUDING BUT NOT LIMITED TO THE WARRANTIES OF MERCHANTABILITY,\\n * FITNESS FOR A PARTICULAR PURPOSE AND NONINFRINGEMENT. IN NO EVENT SHALL THE\\n * AUTHORS OR COPYRIGHT HOLDERS BE LIABLE FOR ANY CLAIM, DAMAGES OR OTHER\\n * LIABILITY, WHETHER IN AN ACTION OF CONTRACT, TORT OR OTHERWISE, ARISING FROM,\\n * OUT OF OR IN CONNECTION WITH THE SOFTWARE OR THE USE OR OTHER DEALINGS IN THE\\n * SOFTWARE.\\n */\\n\\npragma solidity 0.6.12;\\n\\n/**\\n * @notice Base contract which allows children to implement an emergency stop\\n * mechanism\\n * @dev Forked from https://github.com/OpenZeppelin/openzeppelin-contracts/blob/feb665136c0dae9912e08397c1a21c4af3651ef3/contracts/lifecycle/Pausable.sol\\n * Modifications:\\n * 1. Added pauser role, switched pause/unpause to be onlyPauser (6/14/2018)\\n * 2. Removed whenNotPause/whenPaused from pause/unpause (6/14/2018)\\n * 3. Removed whenPaused (6/14/2018)\\n * 4. Switches ownable library to use ZeppelinOS (7/12/18)\\n * 5. Remove constructor (7/13/18)\\n * 6. Reformat, conform to Solidity 0.6 syntax and add error messages (5/13/20)\\n * 7. Make public functions external (5/27/20)\\n */\\ncontract Pausable is Ownable {\\n    event Pause();\\n    event Unpause();\\n    event PauserChanged(address indexed newAddress);\\n\\n    address public pauser;\\n    bool public paused = false;\\n\\n    /**\\n     * @dev Modifier to make a function callable only when the contract is not paused.\\n     */\\n    modifier whenNotPaused() {\\n        require(!paused, \\\"Pausable: paused\\\");\\n        _;\\n    }\\n\\n    /**\\n     * @dev throws if called by any account other than the pauser\\n     */\\n    modifier onlyPauser() {\\n        require(msg.sender == pauser, \\\"Pausable: caller is not the pauser\\\");\\n        _;\\n    }\\n\\n    /**\\n     * @dev called by the owner to pause, triggers stopped state\\n     */\\n    function pause() external onlyPauser {\\n        paused = true;\\n        emit Pause();\\n    }\\n\\n    /**\\n     * @dev called by the owner to unpause, returns to normal state\\n     */\\n    function unpause() external onlyPauser {\\n        paused = false;\\n        emit Unpause();\\n    }\\n\\n    /**\\n     * @dev update the pauser role\\n     */\\n    function updatePauser(address _newPauser) external onlyOwner {\\n        require(\\n            _newPauser != address(0),\\n            \\\"Pausable: new pauser is the zero address\\\"\\n        );\\n        pauser = _newPauser;\\n        emit PauserChanged(pauser);\\n    }\\n}\\n\\n// File: contracts/v1/Blacklistable.sol\\n\\n/**\\n * Copyright (c) 2018-2020 CENTRE SECZ\\n *\\n * Permission is hereby granted, free of charge, to any person obtaining a copy\\n * of this software and associated documentation files (the \\\"Software\\\"), to deal\\n * in the Software without restriction, including without limitation the rights\\n * to use, copy, modify, merge, publish, distribute, sublicense, and/or sell\\n * copies of the Software, and to permit persons to whom the Software is\\n * furnished to do so, subject to the following conditions:\\n *\\n * The above copyright notice and this permission notice shall be included in\\n * copies or substantial portions of the Software.\\n *\\n * THE SOFTWARE IS PROVIDED \\\"AS IS\\\", WITHOUT WARRANTY OF ANY KIND, EXPRESS OR\\n * IMPLIED, INCLUDING BUT NOT LIMITED TO THE WARRANTIES OF MERCHANTABILITY,\\n * FITNESS FOR A PARTICULAR PURPOSE AND NONINFRINGEMENT. IN NO EVENT SHALL THE\\n * AUTHORS OR COPYRIGHT HOLDERS BE LIABLE FOR ANY CLAIM, DAMAGES OR OTHER\\n * LIABILITY, WHETHER IN AN ACTION OF CONTRACT, TORT OR OTHERWISE, ARISING FROM,\\n * OUT OF OR IN CONNECTION WITH THE SOFTWARE OR THE USE OR OTHER DEALINGS IN THE\\n * SOFTWARE.\\n */\\n\\npragma solidity 0.6.12;\\n\\n/**\\n * @title Blacklistable Token\\n * @dev Allows accounts to be blacklisted by a \\\"blacklister\\\" role\\n */\\n// contract Blacklistable is Ownable {\\n//     address public blacklister;\\n//     mapping(address => bool) internal blacklisted;\\n\\n//     event Blacklisted(address indexed _account);\\n//     event UnBlacklisted(address indexed _account);\\n//     event BlacklisterChanged(address indexed newBlacklister);\\n\\n//     /**\\n//      * @dev Throws if called by any account other than the blacklister\\n//      */\\n//     modifier onlyBlacklister() {\\n//         require(\\n//             msg.sender == blacklister,\\n//             \\\"Blacklistable: caller is not the blacklister\\\"\\n//         );\\n//         _;\\n//     }\\n\\n//     /**\\n//      * @dev Throws if argument account is blacklisted\\n//      * @param _account The address to check\\n//      */\\n//     modifier notBlacklisted(address _account) {\\n//         require(\\n//             !blacklisted[_account],\\n//             \\\"Blacklistable: account is blacklisted\\\"\\n//         );\\n//         _;\\n//     }\\n\\n//     /**\\n//      * @dev Checks if account is blacklisted\\n//      * @param _account The address to check\\n//      */\\n//     function isBlacklisted(address _account) external view returns (bool) {\\n//         return blacklisted[_account];\\n//     }\\n\\n//     /**\\n//      * @dev Adds account to blacklist\\n//      * @param _account The address to blacklist\\n//      */\\n//     function blacklist(address _account) external onlyBlacklister {\\n//         blacklisted[_account] = true;\\n//         emit Blacklisted(_account);\\n//     }\\n\\n//     /**\\n//      * @dev Removes account from blacklist\\n//      * @param _account The address to remove from the blacklist\\n//      */\\n//     function unBlacklist(address _account) external onlyBlacklister {\\n//         blacklisted[_account] = false;\\n//         emit UnBlacklisted(_account);\\n//     }\\n\\n//     function updateBlacklister(address _newBlacklister) external onlyOwner {\\n//         require(\\n//             _newBlacklister != address(0),\\n//             \\\"Blacklistable: new blacklister is the zero address\\\"\\n//         );\\n//         blacklister = _newBlacklister;\\n//         emit BlacklisterChanged(blacklister);\\n//     }\\n// }\\n\\n// File: contracts/v1/FiatTokenV1.sol\\n\\n/**\\n *\\n * Copyright (c) 2018-2020 CENTRE SECZ\\n *\\n * Permission is hereby granted, free of charge, to any person obtaining a copy\\n * of this software and associated documentation files (the \\\"Software\\\"), to deal\\n * in the Software without restriction, including without limitation the rights\\n * to use, copy, modify, merge, publish, distribute, sublicense, and/or sell\\n * copies of the Software, and to permit persons to whom the Software is\\n * furnished to do so, subject to the following conditions:\\n *\\n * The above copyright notice and this permission notice shall be included in\\n * copies or substantial portions of the Software.\\n *\\n * THE SOFTWARE IS PROVIDED \\\"AS IS\\\", WITHOUT WARRANTY OF ANY KIND, EXPRESS OR\\n * IMPLIED, INCLUDING BUT NOT LIMITED TO THE WARRANTIES OF MERCHANTABILITY,\\n * FITNESS FOR A PARTICULAR PURPOSE AND NONINFRINGEMENT. IN NO EVENT SHALL THE\\n * AUTHORS OR COPYRIGHT HOLDERS BE LIABLE FOR ANY CLAIM, DAMAGES OR OTHER\\n * LIABILITY, WHETHER IN AN ACTION OF CONTRACT, TORT OR OTHERWISE, ARISING FROM,\\n * OUT OF OR IN CONNECTION WITH THE SOFTWARE OR THE USE OR OTHER DEALINGS IN THE\\n * SOFTWARE.\\n */\\n\\npragma solidity 0.6.12;\\n\\n/**\\n * @title FiatToken\\n * @dev ERC20 Token backed by fiat reserves\\n */\\ncontract FiatTokenV1 is\\n    AbstractFiatTokenV1,\\n    Ownable,\\n    Pausable\\n    // , Blacklistable\\n{\\n    using SafeMath for uint256;\\n\\n    string public name;\\n    string public symbol;\\n    uint8 public decimals;\\n    string public currency;\\n    address public masterMinter;\\n    bool internal initialized;\\n\\n    mapping(address => uint256) internal balances;\\n    mapping(address => mapping(address => uint256)) internal allowed;\\n    uint256 internal totalSupply_ = 0;\\n    mapping(address => bool) internal minters;\\n    mapping(address => uint256) internal minterAllowed;\\n\\n    event Mint(address indexed minter, address indexed to, uint256 amount);\\n    event Burn(address indexed burner, uint256 amount);\\n    event MinterConfigured(address indexed minter, uint256 minterAllowedAmount);\\n    event MinterRemoved(address indexed oldMinter);\\n    event MasterMinterChanged(address indexed newMasterMinter);\\n\\n    function initialize(\\n        string memory tokenName,\\n        string memory tokenSymbol,\\n        string memory tokenCurrency,\\n        uint8 tokenDecimals,\\n        address newMasterMinter,\\n        address newPauser,\\n        address newBlacklister,\\n        address newOwner\\n    ) public {\\n        require(!initialized, \\\"FiatToken: contract is already initialized\\\");\\n        require(\\n            newMasterMinter != address(0),\\n            \\\"FiatToken: new masterMinter is the zero address\\\"\\n        );\\n        require(\\n            newPauser != address(0),\\n            \\\"FiatToken: new pauser is the zero address\\\"\\n        );\\n        require(\\n            newBlacklister != address(0),\\n            \\\"FiatToken: new blacklister is the zero address\\\"\\n        );\\n        require(\\n            newOwner != address(0),\\n            \\\"FiatToken: new owner is the zero address\\\"\\n        );\\n\\n        name = tokenName;\\n        symbol = tokenSymbol;\\n        currency = tokenCurrency;\\n        decimals = tokenDecimals;\\n        masterMinter = newMasterMinter;\\n        pauser = newPauser;\\n        // blacklister = newBlacklister;\\n        setOwner(newOwner);\\n        initialized = true;\\n    }\\n\\n    /**\\n     * @dev Throws if called by any account other than a minter\\n     */\\n    modifier onlyMinters() {\\n        require(minters[msg.sender], \\\"FiatToken: caller is not a minter\\\");\\n        _;\\n    }\\n\\n    /**\\n     * @dev Function to mint tokens\\n     * @param _to The address that will receive the minted tokens.\\n     * @param _amount The amount of tokens to mint. Must be less than or equal\\n     * to the minterAllowance of the caller.\\n     * @return A boolean that indicates if the operation was successful.\\n     */\\n    function mint(\\n        address _to,\\n        uint256 _amount\\n    )\\n        external\\n        whenNotPaused\\n        onlyMinters\\n        returns (\\n            // notBlacklisted(msg.sender)\\n            // notBlacklisted(_to)\\n            bool\\n        )\\n    {\\n        require(_to != address(0), \\\"FiatToken: mint to the zero address\\\");\\n        require(_amount > 0, \\\"FiatToken: mint amount not greater than 0\\\");\\n\\n        uint256 mintingAllowedAmount = minterAllowed[msg.sender];\\n        require(\\n            _amount <= mintingAllowedAmount,\\n            \\\"FiatToken: mint amount exceeds minterAllowance\\\"\\n        );\\n\\n        totalSupply_ = totalSupply_.add(_amount);\\n        balances[_to] = balances[_to].add(_amount);\\n        minterAllowed[msg.sender] = mintingAllowedAmount.sub(_amount);\\n        emit Mint(msg.sender, _to, _amount);\\n        emit Transfer(address(0), _to, _amount);\\n        return true;\\n    }\\n\\n    /**\\n     * @dev Throws if called by any account other than the masterMinter\\n     */\\n    modifier onlyMasterMinter() {\\n        require(\\n            msg.sender == masterMinter,\\n            \\\"FiatToken: caller is not the masterMinter\\\"\\n        );\\n        _;\\n    }\\n\\n    /**\\n     * @dev Get minter allowance for an account\\n     * @param minter The address of the minter\\n     */\\n    function minterAllowance(address minter) external view returns (uint256) {\\n        return minterAllowed[minter];\\n    }\\n\\n    /**\\n     * @dev Checks if account is a minter\\n     * @param account The address to check\\n     */\\n    function isMinter(address account) external view returns (bool) {\\n        return minters[account];\\n    }\\n\\n    /**\\n     * @notice Amount of remaining tokens spender is allowed to transfer on\\n     * behalf of the token owner\\n     * @param owner     Token owner's address\\n     * @param spender   Spender's address\\n     * @return Allowance amount\\n     */\\n    function allowance(\\n        address owner,\\n        address spender\\n    ) external view override returns (uint256) {\\n        return allowed[owner][spender];\\n    }\\n\\n    /**\\n     * @dev Get totalSupply of token\\n     */\\n    function totalSupply() external view override returns (uint256) {\\n        return totalSupply_;\\n    }\\n\\n    /**\\n     * @dev Get token balance of an account\\n     * @param account address The account\\n     */\\n    function balanceOf(\\n        address account\\n    ) external view override returns (uint256) {\\n        return balances[account];\\n    }\\n\\n    /**\\n     * @notice Set spender's allowance over the caller's tokens to be a given\\n     * value.\\n     * @param spender   Spender's address\\n     * @param value     Allowance amount\\n     * @return True if successful\\n     */\\n    function approve(\\n        address spender,\\n        uint256 value\\n    )\\n        external\\n        override\\n        whenNotPaused\\n        returns (\\n            // notBlacklisted(msg.sender)\\n            // notBlacklisted(spender)\\n            bool\\n        )\\n    {\\n        _approve(msg.sender, spender, value);\\n        return true;\\n    }\\n\\n    /**\\n     * @dev Internal function to set allowance\\n     * @param owner     Token owner's address\\n     * @param spender   Spender's address\\n     * @param value     Allowance amount\\n     */\\n    function _approve(\\n        address owner,\\n        address spender,\\n        uint256 value\\n    ) internal override {\\n        require(owner != address(0), \\\"ERC20: approve from the zero address\\\");\\n        require(spender != address(0), \\\"ERC20: approve to the zero address\\\");\\n        allowed[owner][spender] = value;\\n        emit Approval(owner, spender, value);\\n    }\\n\\n    /**\\n     * @notice Transfer tokens by spending allowance\\n     * @param from  Payer's address\\n     * @param to    Payee's address\\n     * @param value Transfer amount\\n     * @return True if successful\\n     */\\n    function transferFrom(\\n        address from,\\n        address to,\\n        uint256 value\\n    )\\n        external\\n        override\\n        whenNotPaused\\n        returns (\\n            // notBlacklisted(msg.sender)\\n            // notBlacklisted(from)\\n            // notBlacklisted(to)\\n            bool\\n        )\\n    {\\n        require(\\n            value <= allowed[from][msg.sender],\\n            \\\"ERC20: transfer amount exceeds allowance\\\"\\n        );\\n        _transfer(from, to, value);\\n        allowed[from][msg.sender] = allowed[from][msg.sender].sub(value);\\n        return true;\\n    }\\n\\n    /**\\n     * @notice Transfer tokens from the caller\\n     * @param to    Payee's address\\n     * @param value Transfer amount\\n     * @return True if successful\\n     */\\n    function transfer(\\n        address to,\\n        uint256 value\\n    )\\n        external\\n        override\\n        whenNotPaused\\n        returns (\\n            // notBlacklisted(msg.sender)\\n            // notBlacklisted(to)\\n            bool\\n        )\\n    {\\n        _transfer(msg.sender, to, value);\\n        return true;\\n    }\\n\\n    /**\\n     * @notice Internal function to process transfers\\n     * @param from  Payer's address\\n     * @param to    Payee's address\\n     * @param value Transfer amount\\n     */\\n    function _transfer(\\n        address from,\\n        address to,\\n        uint256 value\\n    ) internal override {\\n        require(from != address(0), \\\"ERC20: transfer from the zero address\\\");\\n        require(to != address(0), \\\"ERC20: transfer to the zero address\\\");\\n        require(\\n            value <= balances[from],\\n            \\\"ERC20: transfer amount exceeds balance\\\"\\n        );\\n\\n        balances[from] = balances[from].sub(value);\\n        balances[to] = balances[to].add(value);\\n        emit Transfer(from, to, value);\\n    }\\n\\n    /**\\n     * @dev Function to add/update a new minter\\n     * @param minter The address of the minter\\n     * @param minterAllowedAmount The minting amount allowed for the minter\\n     * @return True if the operation was successful.\\n     */\\n    function configureMinter(\\n        address minter,\\n        uint256 minterAllowedAmount\\n    ) external whenNotPaused onlyMasterMinter returns (bool) {\\n        minters[minter] = true;\\n        minterAllowed[minter] = minterAllowedAmount;\\n        emit MinterConfigured(minter, minterAllowedAmount);\\n        return true;\\n    }\\n\\n    /**\\n     * @dev Function to remove a minter\\n     * @param minter The address of the minter to remove\\n     * @return True if the operation was successful.\\n     */\\n    function removeMinter(\\n        address minter\\n    ) external onlyMasterMinter returns (bool) {\\n        minters[minter] = false;\\n        minterAllowed[minter] = 0;\\n        emit MinterRemoved(minter);\\n        return true;\\n    }\\n\\n    /**\\n     * @dev allows a minter to burn some of its own tokens\\n     * Validates that caller is a minter and that sender is not blacklisted\\n     * amount is less than or equal to the minter's account balance\\n     * @param _amount uint256 the amount of tokens to be burned\\n     */\\n    function burn(\\n        uint256 _amount\\n    )\\n        external\\n        whenNotPaused\\n        onlyMinters // notBlacklisted(msg.sender)\\n    {\\n        uint256 balance = balances[msg.sender];\\n        require(_amount > 0, \\\"FiatToken: burn amount not greater than 0\\\");\\n        require(balance >= _amount, \\\"FiatToken: burn amount exceeds balance\\\");\\n\\n        totalSupply_ = totalSupply_.sub(_amount);\\n        balances[msg.sender] = balance.sub(_amount);\\n        emit Burn(msg.sender, _amount);\\n        emit Transfer(msg.sender, address(0), _amount);\\n    }\\n\\n    function updateMasterMinter(address _newMasterMinter) external onlyOwner {\\n        require(\\n            _newMasterMinter != address(0),\\n            \\\"FiatToken: new masterMinter is the zero address\\\"\\n        );\\n        masterMinter = _newMasterMinter;\\n        emit MasterMinterChanged(masterMinter);\\n    }\\n}\\n\\n// File: @openzeppelin/contracts/utils/Address.sol\\n\\npragma solidity ^0.6.2;\\n\\n/**\\n * @dev Collection of functions related to the address type\\n */\\nlibrary Address {\\n    /**\\n     * @dev Returns true if `account` is a contract.\\n     *\\n     * [IMPORTANT]\\n     * ====\\n     * It is unsafe to assume that an address for which this function returns\\n     * false is an externally-owned account (EOA) and not a contract.\\n     *\\n     * Among others, `isContract` will return false for the following\\n     * types of addresses:\\n     *\\n     *  - an externally-owned account\\n     *  - a contract in construction\\n     *  - an address where a contract will be created\\n     *  - an address where a contract lived, but was destroyed\\n     * ====\\n     */\\n    function isContract(address account) internal view returns (bool) {\\n        // According to EIP-1052, 0x0 is the value returned for not-yet created accounts\\n        // and 0xc5d2460186f7233c927e7db2dcc703c0e500b653ca82273b7bfad8045d85a470 is returned\\n        // for accounts without code, i.e. `keccak256('')`\\n        bytes32 codehash;\\n\\n        bytes32 accountHash = 0xc5d2460186f7233c927e7db2dcc703c0e500b653ca82273b7bfad8045d85a470;\\n        // solhint-disable-next-line no-inline-assembly\\n        assembly {\\n            codehash := extcodehash(account)\\n        }\\n        return (codehash != accountHash && codehash != 0x0);\\n    }\\n\\n    /**\\n     * @dev Replacement for Solidity's `transfer`: sends `amount` wei to\\n     * `recipient`, forwarding all available gas and reverting on errors.\\n     *\\n     * https://eips.ethereum.org/EIPS/eip-1884[EIP1884] increases the gas cost\\n     * of certain opcodes, possibly making contracts go over the 2300 gas limit\\n     * imposed by `transfer`, making them unable to receive funds via\\n     * `transfer`. {sendValue} removes this limitation.\\n     *\\n     * https://diligence.consensys.net/posts/2019/09/stop-using-soliditys-transfer-now/[Learn more].\\n     *\\n     * IMPORTANT: because control is transferred to `recipient`, care must be\\n     * taken to not create reentrancy vulnerabilities. Consider using\\n     * {ReentrancyGuard} or the\\n     * https://solidity.readthedocs.io/en/v0.5.11/security-considerations.html#use-the-checks-effects-interactions-pattern[checks-effects-interactions pattern].\\n     */\\n    function sendValue(address payable recipient, uint256 amount) internal {\\n        require(\\n            address(this).balance >= amount,\\n            \\\"Address: insufficient balance\\\"\\n        );\\n\\n        // solhint-disable-next-line avoid-low-level-calls, avoid-call-value\\n        (bool success, ) = recipient.call{value: amount}(\\\"\\\");\\n        require(\\n            success,\\n            \\\"Address: unable to send value, recipient may have reverted\\\"\\n        );\\n    }\\n\\n    /**\\n     * @dev Performs a Solidity function call using a low level `call`. A\\n     * plain`call` is an unsafe replacement for a function call: use this\\n     * function instead.\\n     *\\n     * If `target` reverts with a revert reason, it is bubbled up by this\\n     * function (like regular Solidity function calls).\\n     *\\n     * Returns the raw returned data. To convert to the expected return value,\\n     * use https://solidity.readthedocs.io/en/latest/units-and-global-variables.html?highlight=abi.decode#abi-encoding-and-decoding-functions[`abi.decode`].\\n     *\\n     * Requirements:\\n     *\\n     * - `target` must be a contract.\\n     * - calling `target` with `data` must not revert.\\n     *\\n     * _Available since v3.1._\\n     */\\n    function functionCall(\\n        address target,\\n        bytes memory data\\n    ) internal returns (bytes memory) {\\n        return functionCall(target, data, \\\"Address: low-level call failed\\\");\\n    }\\n\\n    /**\\n     * @dev Same as {xref-Address-functionCall-address-bytes-}[`functionCall`], but with\\n     * `errorMessage` as a fallback revert reason when `target` reverts.\\n     *\\n     * _Available since v3.1._\\n     */\\n    function functionCall(\\n        address target,\\n        bytes memory data,\\n        string memory errorMessage\\n    ) internal returns (bytes memory) {\\n        return _functionCallWithValue(target, data, 0, errorMessage);\\n    }\\n\\n    /**\\n     * @dev Same as {xref-Address-functionCall-address-bytes-}[`functionCall`],\\n     * but also transferring `value` wei to `target`.\\n     *\\n     * Requirements:\\n     *\\n     * - the calling contract must have an ETH balance of at least `value`.\\n     * - the called Solidity function must be `payable`.\\n     *\\n     * _Available since v3.1._\\n     */\\n    function functionCallWithValue(\\n        address target,\\n        bytes memory data,\\n        uint256 value\\n    ) internal returns (bytes memory) {\\n        return\\n            functionCallWithValue(\\n                target,\\n                data,\\n                value,\\n                \\\"Address: low-level call with value failed\\\"\\n            );\\n    }\\n\\n    /**\\n     * @dev Same as {xref-Address-functionCallWithValue-address-bytes-uint256-}[`functionCallWithValue`], but\\n     * with `errorMessage` as a fallback revert reason when `target` reverts.\\n     *\\n     * _Available since v3.1._\\n     */\\n    function functionCallWithValue(\\n        address target,\\n        bytes memory data,\\n        uint256 value,\\n        string memory errorMessage\\n    ) internal returns (bytes memory) {\\n        require(\\n            address(this).balance >= value,\\n            \\\"Address: insufficient balance for call\\\"\\n        );\\n        return _functionCallWithValue(target, data, value, errorMessage);\\n    }\\n\\n    function _functionCallWithValue(\\n        address target,\\n        bytes memory data,\\n        uint256 weiValue,\\n        string memory errorMessage\\n    ) private returns (bytes memory) {\\n        require(isContract(target), \\\"Address: call to non-contract\\\");\\n\\n        // solhint-disable-next-line avoid-low-level-calls\\n        (bool success, bytes memory returndata) = target.call{value: weiValue}(\\n            data\\n        );\\n        if (success) {\\n            return returndata;\\n        } else {\\n            // Look for revert reason and bubble it up if present\\n            if (returndata.length > 0) {\\n                // The easiest way to bubble the revert reason is using memory via assembly\\n\\n                // solhint-disable-next-line no-inline-assembly\\n                assembly {\\n                    let returndata_size := mload(returndata)\\n                    revert(add(32, returndata), returndata_size)\\n                }\\n            } else {\\n                revert(errorMessage);\\n            }\\n        }\\n    }\\n}\\n\\n// File: @openzeppelin/contracts/token/ERC20/SafeERC20.sol\\n\\npragma solidity ^0.6.0;\\n\\n/**\\n * @title SafeERC20\\n * @dev Wrappers around ERC20 operations that throw on failure (when the token\\n * contract returns false). Tokens that return no value (and instead revert or\\n * throw on failure) are also supported, non-reverting calls are assumed to be\\n * successful.\\n * To use this library you can add a `using SafeERC20 for IERC20;` statement to your contract,\\n * which allows you to call the safe operations as `token.safeTransfer(...)`, etc.\\n */\\nlibrary SafeERC20 {\\n    using SafeMath for uint256;\\n    using Address for address;\\n\\n    function safeTransfer(IERC20 token, address to, uint256 value) internal {\\n        _callOptionalReturn(\\n            token,\\n            abi.encodeWithSelector(token.transfer.selector, to, value)\\n        );\\n    }\\n\\n    function safeTransferFrom(\\n        IERC20 token,\\n        address from,\\n        address to,\\n        uint256 value\\n    ) internal {\\n        _callOptionalReturn(\\n            token,\\n            abi.encodeWithSelector(token.transferFrom.selector, from, to, value)\\n        );\\n    }\\n\\n    /**\\n     * @dev Deprecated. This function has issues similar to the ones found in\\n     * {IERC20-approve}, and its usage is discouraged.\\n     *\\n     * Whenever possible, use {safeIncreaseAllowance} and\\n     * {safeDecreaseAllowance} instead.\\n     */\\n    function safeApprove(\\n        IERC20 token,\\n        address spender,\\n        uint256 value\\n    ) internal {\\n        // safeApprove should only be called when setting an initial allowance,\\n        // or when resetting it to zero. To increase and decrease it, use\\n        // 'safeIncreaseAllowance' and 'safeDecreaseAllowance'\\n        // solhint-disable-next-line max-line-length\\n        require(\\n            (value == 0) || (token.allowance(address(this), spender) == 0),\\n            \\\"SafeERC20: approve from non-zero to non-zero allowance\\\"\\n        );\\n        _callOptionalReturn(\\n            token,\\n            abi.encodeWithSelector(token.approve.selector, spender, value)\\n        );\\n    }\\n\\n    function safeIncreaseAllowance(\\n        IERC20 token,\\n        address spender,\\n        uint256 value\\n    ) internal {\\n        uint256 newAllowance = token.allowance(address(this), spender).add(\\n            value\\n        );\\n        _callOptionalReturn(\\n            token,\\n            abi.encodeWithSelector(\\n                token.approve.selector,\\n                spender,\\n                newAllowance\\n            )\\n        );\\n    }\\n\\n    function safeDecreaseAllowance(\\n        IERC20 token,\\n        address spender,\\n        uint256 value\\n    ) internal {\\n        uint256 newAllowance = token.allowance(address(this), spender).sub(\\n            value,\\n            \\\"SafeERC20: decreased allowance below zero\\\"\\n        );\\n        _callOptionalReturn(\\n            token,\\n            abi.encodeWithSelector(\\n                token.approve.selector,\\n                spender,\\n                newAllowance\\n            )\\n        );\\n    }\\n\\n    /**\\n     * @dev Imitates a Solidity high-level call (i.e. a regular function call to a contract), relaxing the requirement\\n     * on the return value: the return value is optional (but if data is returned, it must not be false).\\n     * @param token The token targeted by the call.\\n     * @param data The call data (encoded using abi.encode or one of its variants).\\n     */\\n    function _callOptionalReturn(IERC20 token, bytes memory data) private {\\n        // We need to perform a low level call here, to bypass Solidity's return data size checking mechanism, since\\n        // we're implementing it ourselves. We use {Address.functionCall} to perform this call, which verifies that\\n        // the target address contains contract code and also asserts for success in the low-level call.\\n\\n        bytes memory returndata = address(token).functionCall(\\n            data,\\n            \\\"SafeERC20: low-level call failed\\\"\\n        );\\n        if (returndata.length > 0) {\\n            // Return data is optional\\n            // solhint-disable-next-line max-line-length\\n            require(\\n                abi.decode(returndata, (bool)),\\n                \\\"SafeERC20: ERC20 operation did not succeed\\\"\\n            );\\n        }\\n    }\\n}\\n\\n// File: contracts/v1.1/Rescuable.sol\\n\\n/**\\n * Copyright (c) 2018-2020 CENTRE SECZ\\n *\\n * Permission is hereby granted, free of charge, to any person obtaining a copy\\n * of this software and associated documentation files (the \\\"Software\\\"), to deal\\n * in the Software without restriction, including without limitation the rights\\n * to use, copy, modify, merge, publish, distribute, sublicense, and/or sell\\n * copies of the Software, and to permit persons to whom the Software is\\n * furnished to do so, subject to the following conditions:\\n *\\n * The above copyright notice and this permission notice shall be included in\\n * copies or substantial portions of the Software.\\n *\\n * THE SOFTWARE IS PROVIDED \\\"AS IS\\\", WITHOUT WARRANTY OF ANY KIND, EXPRESS OR\\n * IMPLIED, INCLUDING BUT NOT LIMITED TO THE WARRANTIES OF MERCHANTABILITY,\\n * FITNESS FOR A PARTICULAR PURPOSE AND NONINFRINGEMENT. IN NO EVENT SHALL THE\\n * AUTHORS OR COPYRIGHT HOLDERS BE LIABLE FOR ANY CLAIM, DAMAGES OR OTHER\\n * LIABILITY, WHETHER IN AN ACTION OF CONTRACT, TORT OR OTHERWISE, ARISING FROM,\\n * OUT OF OR IN CONNECTION WITH THE SOFTWARE OR THE USE OR OTHER DEALINGS IN THE\\n * SOFTWARE.\\n */\\n\\npragma solidity 0.6.12;\\n\\ncontract Rescuable is Ownable {\\n    using SafeERC20 for IERC20;\\n\\n    address private _rescuer;\\n\\n    event RescuerChanged(address indexed newRescuer);\\n\\n    /**\\n     * @notice Returns current rescuer\\n     * @return Rescuer's address\\n     */\\n    function rescuer() external view returns (address) {\\n        return _rescuer;\\n    }\\n\\n    /**\\n     * @notice Revert if called by any account other than the rescuer.\\n     */\\n    modifier onlyRescuer() {\\n        require(msg.sender == _rescuer, \\\"Rescuable: caller is not the rescuer\\\");\\n        _;\\n    }\\n\\n    /**\\n     * @notice Rescue ERC20 tokens locked up in this contract.\\n     * @param tokenContract ERC20 token contract address\\n     * @param to        Recipient address\\n     * @param amount    Amount to withdraw\\n     */\\n    function rescueERC20(\\n        IERC20 tokenContract,\\n        address to,\\n        uint256 amount\\n    ) external onlyRescuer {\\n        tokenContract.safeTransfer(to, amount);\\n    }\\n\\n    /**\\n     * @notice Assign the rescuer role to a given address.\\n     * @param newRescuer New rescuer's address\\n     */\\n    function updateRescuer(address newRescuer) external onlyOwner {\\n        require(\\n            newRescuer != address(0),\\n            \\\"Rescuable: new rescuer is the zero address\\\"\\n        );\\n        _rescuer = newRescuer;\\n        emit RescuerChanged(newRescuer);\\n    }\\n}\\n\\n// File: contracts/v1.1/FiatTokenV1_1.sol\\n\\n/**\\n * Copyright (c) 2018-2020 CENTRE SECZ\\n *\\n * Permission is hereby granted, free of charge, to any person obtaining a copy\\n * of this software and associated documentation files (the \\\"Software\\\"), to deal\\n * in the Software without restriction, including without limitation the rights\\n * to use, copy, modify, merge, publish, distribute, sublicense, and/or sell\\n * copies of the Software, and to permit persons to whom the Software is\\n * furnished to do so, subject to the following conditions:\\n *\\n * The above copyright notice and this permission notice shall be included in\\n * copies or substantial portions of the Software.\\n *\\n * THE SOFTWARE IS PROVIDED \\\"AS IS\\\", WITHOUT WARRANTY OF ANY KIND, EXPRESS OR\\n * IMPLIED, INCLUDING BUT NOT LIMITED TO THE WARRANTIES OF MERCHANTABILITY,\\n * FITNESS FOR A PARTICULAR PURPOSE AND NONINFRINGEMENT. IN NO EVENT SHALL THE\\n * AUTHORS OR COPYRIGHT HOLDERS BE LIABLE FOR ANY CLAIM, DAMAGES OR OTHER\\n * LIABILITY, WHETHER IN AN ACTION OF CONTRACT, TORT OR OTHERWISE, ARISING FROM,\\n * OUT OF OR IN CONNECTION WITH THE SOFTWARE OR THE USE OR OTHER DEALINGS IN THE\\n * SOFTWARE.\\n */\\n\\npragma solidity 0.6.12;\\n\\n/**\\n * @title FiatTokenV1_1\\n * @dev ERC20 Token backed by fiat reserves\\n */\\ncontract FiatTokenV1_1 is FiatTokenV1, Rescuable {\\n\\n}\\n\\n// File: contracts/v2/AbstractFiatTokenV2.sol\\n\\n/**\\n * Copyright (c) 2018-2020 CENTRE SECZ\\n *\\n * Permission is hereby granted, free of charge, to any person obtaining a copy\\n * of this software and associated documentation files (the \\\"Software\\\"), to deal\\n * in the Software without restriction, including without limitation the rights\\n * to use, copy, modify, merge, publish, distribute, sublicense, and/or sell\\n * copies of the Software, and to permit persons to whom the Software is\\n * furnished to do so, subject to the following conditions:\\n *\\n * The above copyright notice and this permission notice shall be included in\\n * copies or substantial portions of the Software.\\n *\\n * THE SOFTWARE IS PROVIDED \\\"AS IS\\\", WITHOUT WARRANTY OF ANY KIND, EXPRESS OR\\n * IMPLIED, INCLUDING BUT NOT LIMITED TO THE WARRANTIES OF MERCHANTABILITY,\\n * FITNESS FOR A PARTICULAR PURPOSE AND NONINFRINGEMENT. IN NO EVENT SHALL THE\\n * AUTHORS OR COPYRIGHT HOLDERS BE LIABLE FOR ANY CLAIM, DAMAGES OR OTHER\\n * LIABILITY, WHETHER IN AN ACTION OF CONTRACT, TORT OR OTHERWISE, ARISING FROM,\\n * OUT OF OR IN CONNECTION WITH THE SOFTWARE OR THE USE OR OTHER DEALINGS IN THE\\n * SOFTWARE.\\n */\\n\\npragma solidity 0.6.12;\\n\\nabstract contract AbstractFiatTokenV2 is AbstractFiatTokenV1 {\\n    function _increaseAllowance(\\n        address owner,\\n        address spender,\\n        uint256 increment\\n    ) internal virtual;\\n\\n    function _decreaseAllowance(\\n        address owner,\\n        address spender,\\n        uint256 decrement\\n    ) internal virtual;\\n}\\n\\n// File: contracts/util/ECRecover.sol\\n\\n/**\\n * Copyright (c) 2016-2019 zOS Global Limited\\n * Copyright (c) 2018-2020 CENTRE SECZ\\n *\\n * Permission is hereby granted, free of charge, to any person obtaining a copy\\n * of this software and associated documentation files (the \\\"Software\\\"), to deal\\n * in the Software without restriction, including without limitation the rights\\n * to use, copy, modify, merge, publish, distribute, sublicense, and/or sell\\n * copies of the Software, and to permit persons to whom the Software is\\n * furnished to do so, subject to the following conditions:\\n *\\n * The above copyright notice and this permission notice shall be included in\\n * copies or substantial portions of the Software.\\n *\\n * THE SOFTWARE IS PROVIDED \\\"AS IS\\\", WITHOUT WARRANTY OF ANY KIND, EXPRESS OR\\n * IMPLIED, INCLUDING BUT NOT LIMITED TO THE WARRANTIES OF MERCHANTABILITY,\\n * FITNESS FOR A PARTICULAR PURPOSE AND NONINFRINGEMENT. IN NO EVENT SHALL THE\\n * AUTHORS OR COPYRIGHT HOLDERS BE LIABLE FOR ANY CLAIM, DAMAGES OR OTHER\\n * LIABILITY, WHETHER IN AN ACTION OF CONTRACT, TORT OR OTHERWISE, ARISING FROM,\\n * OUT OF OR IN CONNECTION WITH THE SOFTWARE OR THE USE OR OTHER DEALINGS IN THE\\n * SOFTWARE.\\n */\\n\\npragma solidity 0.6.12;\\n\\n/**\\n * @title ECRecover\\n * @notice A library that provides a safe ECDSA recovery function\\n */\\nlibrary ECRecover {\\n    /**\\n     * @notice Recover signer's address from a signed message\\n     * @dev Adapted from: https://github.com/OpenZeppelin/openzeppelin-contracts/blob/65e4ffde586ec89af3b7e9140bdc9235d1254853/contracts/cryptography/ECDSA.sol\\n     * Modifications: Accept v, r, and s as separate arguments\\n     * @param digest    Keccak-256 hash digest of the signed message\\n     * @param v         v of the signature\\n     * @param r         r of the signature\\n     * @param s         s of the signature\\n     * @return Signer address\\n     */\\n    function recover(\\n        bytes32 digest,\\n        uint8 v,\\n        bytes32 r,\\n        bytes32 s\\n    ) internal pure returns (address) {\\n        // EIP-2 still allows signature malleability for ecrecover(). Remove this possibility and make the signature\\n        // unique. Appendix F in the Ethereum Yellow paper (https://ethereum.github.io/yellowpaper/paper.pdf), defines\\n        // the valid range for s in (281): 0 < s < secp256k1n \\u00f7 2 + 1, and for v in (282): v \\u2208 {27, 28}. Most\\n        // signatures from current libraries generate a unique signature with an s-value in the lower half order.\\n        //\\n        // If your library generates malleable signatures, such as s-values in the upper range, calculate a new s-value\\n        // with 0xFFFFFFFFFFFFFFFFFFFFFFFFFFFFFFFEBAAEDCE6AF48A03BBFD25E8CD0364141 - s1 and flip v from 27 to 28 or\\n        // vice versa. If your library also generates signatures with 0/1 for v instead 27/28, add 27 to v to accept\\n        // these malleable signatures as well.\\n        if (\\n            uint256(s) >\\n            0x7FFFFFFFFFFFFFFFFFFFFFFFFFFFFFFF5D576E7357A4501DDFE92F46681B20A0\\n        ) {\\n            revert(\\\"ECRecover: invalid signature 's' value\\\");\\n        }\\n\\n        if (v != 27 && v != 28) {\\n            revert(\\\"ECRecover: invalid signature 'v' value\\\");\\n        }\\n\\n        // If the signature is valid (and not malleable), return the signer address\\n        address signer = ecrecover(digest, v, r, s);\\n        require(signer != address(0), \\\"ECRecover: invalid signature\\\");\\n\\n        return signer;\\n    }\\n}\\n\\n// File: contracts/util/EIP712.sol\\n\\n/**\\n * Copyright (c) 2018-2020 CENTRE SECZ\\n *\\n * Permission is hereby granted, free of charge, to any person obtaining a copy\\n * of this software and associated documentation files (the \\\"Software\\\"), to deal\\n * in the Software without restriction, including without limitation the rights\\n * to use, copy, modify, merge, publish, distribute, sublicense, and/or sell\\n * copies of the Software, and to permit persons to whom the Software is\\n * furnished to do so, subject to the following conditions:\\n *\\n * The above copyright notice and this permission notice shall be included in\\n * copies or substantial portions of the Software.\\n *\\n * THE SOFTWARE IS PROVIDED \\\"AS IS\\\", WITHOUT WARRANTY OF ANY KIND, EXPRESS OR\\n * IMPLIED, INCLUDING BUT NOT LIMITED TO THE WARRANTIES OF MERCHANTABILITY,\\n * FITNESS FOR A PARTICULAR PURPOSE AND NONINFRINGEMENT. IN NO EVENT SHALL THE\\n * AUTHORS OR COPYRIGHT HOLDERS BE LIABLE FOR ANY CLAIM, DAMAGES OR OTHER\\n * LIABILITY, WHETHER IN AN ACTION OF CONTRACT, TORT OR OTHERWISE, ARISING FROM,\\n * OUT OF OR IN CONNECTION WITH THE SOFTWARE OR THE USE OR OTHER DEALINGS IN THE\\n * SOFTWARE.\\n */\\n\\npragma solidity 0.6.12;\\n\\n/**\\n * @title EIP712\\n * @notice A library that provides EIP712 helper functions\\n */\\nlibrary EIP712 {\\n    /**\\n     * @notice Make EIP712 domain separator\\n     * @param name      Contract name\\n     * @param version   Contract version\\n     * @return Domain separator\\n     */\\n    function makeDomainSeparator(\\n        string memory name,\\n        string memory version\\n    ) internal view returns (bytes32) {\\n        uint256 chainId;\\n        assembly {\\n            chainId := chainid()\\n        }\\n        return\\n            keccak256(\\n                abi.encode(\\n                    // keccak256(\\\"EIP712Domain(string name,string version,uint256 chainId,address verifyingContract)\\\")\\n                    0x8b73c3c69bb8fe3d512ecc4cf759cc79239f7b179b0ffacaa9a75d522b39400f,\\n                    keccak256(bytes(name)),\\n                    keccak256(bytes(version)),\\n                    chainId,\\n                    address(this)\\n                )\\n            );\\n    }\\n\\n    /**\\n     * @notice Recover signer's address from a EIP712 signature\\n     * @param domainSeparator   Domain separator\\n     * @param v                 v of the signature\\n     * @param r                 r of the signature\\n     * @param s                 s of the signature\\n     * @param typeHashAndData   Type hash concatenated with data\\n     * @return Signer's address\\n     */\\n    function recover(\\n        bytes32 domainSeparator,\\n        uint8 v,\\n        bytes32 r,\\n        bytes32 s,\\n        bytes memory typeHashAndData\\n    ) internal pure returns (address) {\\n        bytes32 digest = keccak256(\\n            abi.encodePacked(\\n                \\\"\\\\x19\\\\x01\\\",\\n                domainSeparator,\\n                keccak256(typeHashAndData)\\n            )\\n        );\\n        return ECRecover.recover(digest, v, r, s);\\n    }\\n}\\n\\n// File: contracts/v2/EIP712Domain.sol\\n\\n/**\\n * Copyright (c) 2018-2020 CENTRE SECZ\\n *\\n * Permission is hereby granted, free of charge, to any person obtaining a copy\\n * of this software and associated documentation files (the \\\"Software\\\"), to deal\\n * in the Software without restriction, including without limitation the rights\\n * to use, copy, modify, merge, publish, distribute, sublicense, and/or sell\\n * copies of the Software, and to permit persons to whom the Software is\\n * furnished to do so, subject to the following conditions:\\n *\\n * The above copyright notice and this permission notice shall be included in\\n * copies or substantial portions of the Software.\\n *\\n * THE SOFTWARE IS PROVIDED \\\"AS IS\\\", WITHOUT WARRANTY OF ANY KIND, EXPRESS OR\\n * IMPLIED, INCLUDING BUT NOT LIMITED TO THE WARRANTIES OF MERCHANTABILITY,\\n * FITNESS FOR A PARTICULAR PURPOSE AND NONINFRINGEMENT. IN NO EVENT SHALL THE\\n * AUTHORS OR COPYRIGHT HOLDERS BE LIABLE FOR ANY CLAIM, DAMAGES OR OTHER\\n * LIABILITY, WHETHER IN AN ACTION OF CONTRACT, TORT OR OTHERWISE, ARISING FROM,\\n * OUT OF OR IN CONNECTION WITH THE SOFTWARE OR THE USE OR OTHER DEALINGS IN THE\\n * SOFTWARE.\\n */\\n\\npragma solidity 0.6.12;\\n\\n/**\\n * @title EIP712 Domain\\n */\\ncontract EIP712Domain {\\n    /**\\n     * @dev EIP712 Domain Separator\\n     */\\n    bytes32 public DOMAIN_SEPARATOR;\\n}\\n\\n// File: contracts/v2/EIP3009.sol\\n\\n/**\\n * Copyright (c) 2018-2020 CENTRE SECZ\\n *\\n * Permission is hereby granted, free of charge, to any person obtaining a copy\\n * of this software and associated documentation files (the \\\"Software\\\"), to deal\\n * in the Software without restriction, including without limitation the rights\\n * to use, copy, modify, merge, publish, distribute, sublicense, and/or sell\\n * copies of the Software, and to permit persons to whom the Software is\\n * furnished to do so, subject to the following conditions:\\n *\\n * The above copyright notice and this permission notice shall be included in\\n * copies or substantial portions of the Software.\\n *\\n * THE SOFTWARE IS PROVIDED \\\"AS IS\\\", WITHOUT WARRANTY OF ANY KIND, EXPRESS OR\\n * IMPLIED, INCLUDING BUT NOT LIMITED TO THE WARRANTIES OF MERCHANTABILITY,\\n * FITNESS FOR A PARTICULAR PURPOSE AND NONINFRINGEMENT. IN NO EVENT SHALL THE\\n * AUTHORS OR COPYRIGHT HOLDERS BE LIABLE FOR ANY CLAIM, DAMAGES OR OTHER\\n * LIABILITY, WHETHER IN AN ACTION OF CONTRACT, TORT OR OTHERWISE, ARISING FROM,\\n * OUT OF OR IN CONNECTION WITH THE SOFTWARE OR THE USE OR OTHER DEALINGS IN THE\\n * SOFTWARE.\\n */\\n\\npragma solidity 0.6.12;\\n\\n/**\\n * @title EIP-3009\\n * @notice Provide internal implementation for gas-abstracted transfers\\n * @dev Contracts that inherit from this must wrap these with publicly\\n * accessible functions, optionally adding modifiers where necessary\\n */\\nabstract contract EIP3009 is AbstractFiatTokenV2, EIP712Domain {\\n    // keccak256(\\\"TransferWithAuthorization(address from,address to,uint256 value,uint256 validAfter,uint256 validBefore,bytes32 nonce)\\\")\\n    bytes32 public constant TRANSFER_WITH_AUTHORIZATION_TYPEHASH =\\n        0x7c7c6cdb67a18743f49ec6fa9b35f50d52ed05cbed4cc592e13b44501c1a2267;\\n\\n    // keccak256(\\\"ReceiveWithAuthorization(address from,address to,uint256 value,uint256 validAfter,uint256 validBefore,bytes32 nonce)\\\")\\n    bytes32 public constant RECEIVE_WITH_AUTHORIZATION_TYPEHASH =\\n        0xd099cc98ef71107a616c4f0f941f04c322d8e254fe26b3c6668db87aae413de8;\\n\\n    // keccak256(\\\"CancelAuthorization(address authorizer,bytes32 nonce)\\\")\\n    bytes32 public constant CANCEL_AUTHORIZATION_TYPEHASH =\\n        0x158b0a9edf7a828aad02f63cd515c68ef2f50ba807396f6d12842833a1597429;\\n\\n    /**\\n     * @dev authorizer address => nonce => bool (true if nonce is used)\\n     */\\n    mapping(address => mapping(bytes32 => bool)) private _authorizationStates;\\n\\n    event AuthorizationUsed(address indexed authorizer, bytes32 indexed nonce);\\n    event AuthorizationCanceled(\\n        address indexed authorizer,\\n        bytes32 indexed nonce\\n    );\\n\\n    /**\\n     * @notice Returns the state of an authorization\\n     * @dev Nonces are randomly generated 32-byte data unique to the\\n     * authorizer's address\\n     * @param authorizer    Authorizer's address\\n     * @param nonce         Nonce of the authorization\\n     * @return True if the nonce is used\\n     */\\n    function authorizationState(\\n        address authorizer,\\n        bytes32 nonce\\n    ) external view returns (bool) {\\n        return _authorizationStates[authorizer][nonce];\\n    }\\n\\n    /**\\n     * @notice Execute a transfer with a signed authorization\\n     * @param from          Payer's address (Authorizer)\\n     * @param to            Payee's address\\n     * @param value         Amount to be transferred\\n     * @param validAfter    The time after which this is valid (unix time)\\n     * @param validBefore   The time before which this is valid (unix time)\\n     * @param nonce         Unique nonce\\n     * @param v             v of the signature\\n     * @param r             r of the signature\\n     * @param s             s of the signature\\n     */\\n    function _transferWithAuthorization(\\n        address from,\\n        address to,\\n        uint256 value,\\n        uint256 validAfter,\\n        uint256 validBefore,\\n        bytes32 nonce,\\n        uint8 v,\\n        bytes32 r,\\n        bytes32 s\\n    ) internal {\\n        _requireValidAuthorization(from, nonce, validAfter, validBefore);\\n\\n        bytes memory data = abi.encode(\\n            TRANSFER_WITH_AUTHORIZATION_TYPEHASH,\\n            from,\\n            to,\\n            value,\\n            validAfter,\\n            validBefore,\\n            nonce\\n        );\\n        require(\\n            EIP712.recover(DOMAIN_SEPARATOR, v, r, s, data) == from,\\n            \\\"FiatTokenV2: invalid signature\\\"\\n        );\\n\\n        _markAuthorizationAsUsed(from, nonce);\\n        _transfer(from, to, value);\\n    }\\n\\n    /**\\n     * @notice Receive a transfer with a signed authorization from the payer\\n     * @dev This has an additional check to ensure that the payee's address\\n     * matches the caller of this function to prevent front-running attacks.\\n     * @param from          Payer's address (Authorizer)\\n     * @param to            Payee's address\\n     * @param value         Amount to be transferred\\n     * @param validAfter    The time after which this is valid (unix time)\\n     * @param validBefore   The time before which this is valid (unix time)\\n     * @param nonce         Unique nonce\\n     * @param v             v of the signature\\n     * @param r             r of the signature\\n     * @param s             s of the signature\\n     */\\n    function _receiveWithAuthorization(\\n        address from,\\n        address to,\\n        uint256 value,\\n        uint256 validAfter,\\n        uint256 validBefore,\\n        bytes32 nonce,\\n        uint8 v,\\n        bytes32 r,\\n        bytes32 s\\n    ) internal {\\n        require(to == msg.sender, \\\"FiatTokenV2: caller must be the payee\\\");\\n        _requireValidAuthorization(from, nonce, validAfter, validBefore);\\n\\n        bytes memory data = abi.encode(\\n            RECEIVE_WITH_AUTHORIZATION_TYPEHASH,\\n            from,\\n            to,\\n            value,\\n            validAfter,\\n            validBefore,\\n            nonce\\n        );\\n        require(\\n            EIP712.recover(DOMAIN_SEPARATOR, v, r, s, data) == from,\\n            \\\"FiatTokenV2: invalid signature\\\"\\n        );\\n\\n        _markAuthorizationAsUsed(from, nonce);\\n        _transfer(from, to, value);\\n    }\\n\\n    /**\\n     * @notice Attempt to cancel an authorization\\n     * @param authorizer    Authorizer's address\\n     * @param nonce         Nonce of the authorization\\n     * @param v             v of the signature\\n     * @param r             r of the signature\\n     * @param s             s of the signature\\n     */\\n    function _cancelAuthorization(\\n        address authorizer,\\n        bytes32 nonce,\\n        uint8 v,\\n        bytes32 r,\\n        bytes32 s\\n    ) internal {\\n        _requireUnusedAuthorization(authorizer, nonce);\\n\\n        bytes memory data = abi.encode(\\n            CANCEL_AUTHORIZATION_TYPEHASH,\\n            authorizer,\\n            nonce\\n        );\\n        require(\\n            EIP712.recover(DOMAIN_SEPARATOR, v, r, s, data) == authorizer,\\n            \\\"FiatTokenV2: invalid signature\\\"\\n        );\\n\\n        _authorizationStates[authorizer][nonce] = true;\\n        emit AuthorizationCanceled(authorizer, nonce);\\n    }\\n\\n    /**\\n     * @notice Check that an authorization is unused\\n     * @param authorizer    Authorizer's address\\n     * @param nonce         Nonce of the authorization\\n     */\\n    function _requireUnusedAuthorization(\\n        address authorizer,\\n        bytes32 nonce\\n    ) private view {\\n        require(\\n            !_authorizationStates[authorizer][nonce],\\n            \\\"FiatTokenV2: authorization is used or canceled\\\"\\n        );\\n    }\\n\\n    /**\\n     * @notice Check that authorization is valid\\n     * @param authorizer    Authorizer's address\\n     * @param nonce         Nonce of the authorization\\n     * @param validAfter    The time after which this is valid (unix time)\\n     * @param validBefore   The time before which this is valid (unix time)\\n     */\\n    function _requireValidAuthorization(\\n        address authorizer,\\n        bytes32 nonce,\\n        uint256 validAfter,\\n        uint256 validBefore\\n    ) private view {\\n        require(\\n            now > validAfter,\\n            \\\"FiatTokenV2: authorization is not yet valid\\\"\\n        );\\n        require(now < validBefore, \\\"FiatTokenV2: authorization is expired\\\");\\n        _requireUnusedAuthorization(authorizer, nonce);\\n    }\\n\\n    /**\\n     * @notice Mark an authorization as used\\n     * @param authorizer    Authorizer's address\\n     * @param nonce         Nonce of the authorization\\n     */\\n    function _markAuthorizationAsUsed(\\n        address authorizer,\\n        bytes32 nonce\\n    ) private {\\n        _authorizationStates[authorizer][nonce] = true;\\n        emit AuthorizationUsed(authorizer, nonce);\\n    }\\n}\\n\\n// File: contracts/v2/EIP2612.sol\\n\\n/**\\n * Copyright (c) 2018-2020 CENTRE SECZ\\n *\\n * Permission is hereby granted, free of charge, to any person obtaining a copy\\n * of this software and associated documentation files (the \\\"Software\\\"), to deal\\n * in the Software without restriction, including without limitation the rights\\n * to use, copy, modify, merge, publish, distribute, sublicense, and/or sell\\n * copies of the Software, and to permit persons to whom the Software is\\n * furnished to do so, subject to the following conditions:\\n *\\n * The above copyright notice and this permission notice shall be included in\\n * copies or substantial portions of the Software.\\n *\\n * THE SOFTWARE IS PROVIDED \\\"AS IS\\\", WITHOUT WARRANTY OF ANY KIND, EXPRESS OR\\n * IMPLIED, INCLUDING BUT NOT LIMITED TO THE WARRANTIES OF MERCHANTABILITY,\\n * FITNESS FOR A PARTICULAR PURPOSE AND NONINFRINGEMENT. IN NO EVENT SHALL THE\\n * AUTHORS OR COPYRIGHT HOLDERS BE LIABLE FOR ANY CLAIM, DAMAGES OR OTHER\\n * LIABILITY, WHETHER IN AN ACTION OF CONTRACT, TORT OR OTHERWISE, ARISING FROM,\\n * OUT OF OR IN CONNECTION WITH THE SOFTWARE OR THE USE OR OTHER DEALINGS IN THE\\n * SOFTWARE.\\n */\\n\\npragma solidity 0.6.12;\\n\\n/**\\n * @title EIP-2612\\n * @notice Provide internal implementation for gas-abstracted approvals\\n */\\nabstract contract EIP2612 is AbstractFiatTokenV2, EIP712Domain {\\n    // keccak256(\\\"Permit(address owner,address spender,uint256 value,uint256 nonce,uint256 deadline)\\\")\\n    bytes32 public constant PERMIT_TYPEHASH =\\n        0x6e71edae12b1b97f4d1f60370fef10105fa2faae0126114a169c64845d6126c9;\\n\\n    mapping(address => uint256) private _permitNonces;\\n\\n    /**\\n     * @notice Nonces for permit\\n     * @param owner Token owner's address (Authorizer)\\n     * @return Next nonce\\n     */\\n    function nonces(address owner) external view returns (uint256) {\\n        return _permitNonces[owner];\\n    }\\n\\n    /**\\n     * @notice Verify a signed approval permit and execute if valid\\n     * @param owner     Token owner's address (Authorizer)\\n     * @param spender   Spender's address\\n     * @param value     Amount of allowance\\n     * @param deadline  The time at which this expires (unix time)\\n     * @param v         v of the signature\\n     * @param r         r of the signature\\n     * @param s         s of the signature\\n     */\\n    function _permit(\\n        address owner,\\n        address spender,\\n        uint256 value,\\n        uint256 deadline,\\n        uint8 v,\\n        bytes32 r,\\n        bytes32 s\\n    ) internal {\\n        require(deadline >= now, \\\"FiatTokenV2: permit is expired\\\");\\n\\n        bytes memory data = abi.encode(\\n            PERMIT_TYPEHASH,\\n            owner,\\n            spender,\\n            value,\\n            _permitNonces[owner]++,\\n            deadline\\n        );\\n        require(\\n            EIP712.recover(DOMAIN_SEPARATOR, v, r, s, data) == owner,\\n            \\\"EIP2612: invalid signature\\\"\\n        );\\n\\n        _approve(owner, spender, value);\\n    }\\n}\\n\\n// File: contracts/v2/FiatTokenV2.sol\\n\\n/**\\n * Copyright (c) 2018-2020 CENTRE SECZ\\n *\\n * Permission is hereby granted, free of charge, to any person obtaining a copy\\n * of this software and associated documentation files (the \\\"Software\\\"), to deal\\n * in the Software without restriction, including without limitation the rights\\n * to use, copy, modify, merge, publish, distribute, sublicense, and/or sell\\n * copies of the Software, and to permit persons to whom the Software is\\n * furnished to do so, subject to the following conditions:\\n *\\n * The above copyright notice and this permission notice shall be included in\\n * copies or substantial portions of the Software.\\n *\\n * THE SOFTWARE IS PROVIDED \\\"AS IS\\\", WITHOUT WARRANTY OF ANY KIND, EXPRESS OR\\n * IMPLIED, INCLUDING BUT NOT LIMITED TO THE WARRANTIES OF MERCHANTABILITY,\\n * FITNESS FOR A PARTICULAR PURPOSE AND NONINFRINGEMENT. IN NO EVENT SHALL THE\\n * AUTHORS OR COPYRIGHT HOLDERS BE LIABLE FOR ANY CLAIM, DAMAGES OR OTHER\\n * LIABILITY, WHETHER IN AN ACTION OF CONTRACT, TORT OR OTHERWISE, ARISING FROM,\\n * OUT OF OR IN CONNECTION WITH THE SOFTWARE OR THE USE OR OTHER DEALINGS IN THE\\n * SOFTWARE.\\n */\\n\\npragma solidity 0.6.12;\\n\\n/**\\n * @title FiatToken V2\\n * @notice ERC20 Token backed by fiat reserves, version 2\\n */\\ncontract FiatTokenV2 is FiatTokenV1_1, EIP3009, EIP2612 {\\n    uint8 internal _initializedVersion;\\n\\n    /**\\n     * @notice Initialize v2\\n     * @param newName   New token name\\n     */\\n    function initializeV2(string calldata newName) external {\\n        // solhint-disable-next-line reason-string\\n        require(initialized && _initializedVersion == 0);\\n        name = newName;\\n        DOMAIN_SEPARATOR = EIP712.makeDomainSeparator(newName, \\\"2\\\");\\n        _initializedVersion = 1;\\n    }\\n\\n    /**\\n     * @notice Increase the allowance by a given increment\\n     * @param spender   Spender's address\\n     * @param increment Amount of increase in allowance\\n     * @return True if successful\\n     */\\n    function increaseAllowance(\\n        address spender,\\n        uint256 increment\\n    )\\n        external\\n        whenNotPaused\\n        returns (\\n            // notBlacklisted(msg.sender)\\n            // notBlacklisted(spender)\\n            bool\\n        )\\n    {\\n        _increaseAllowance(msg.sender, spender, increment);\\n        return true;\\n    }\\n\\n    /**\\n     * @notice Decrease the allowance by a given decrement\\n     * @param spender   Spender's address\\n     * @param decrement Amount of decrease in allowance\\n     * @return True if successful\\n     */\\n    function decreaseAllowance(\\n        address spender,\\n        uint256 decrement\\n    )\\n        external\\n        whenNotPaused\\n        returns (\\n            // notBlacklisted(msg.sender)\\n            // notBlacklisted(spender)\\n            bool\\n        )\\n    {\\n        _decreaseAllowance(msg.sender, spender, decrement);\\n        return true;\\n    }\\n\\n    /**\\n     * @notice Execute a transfer with a signed authorization\\n     * @param from          Payer's address (Authorizer)\\n     * @param to            Payee's address\\n     * @param value         Amount to be transferred\\n     * @param validAfter    The time after which this is valid (unix time)\\n     * @param validBefore   The time before which this is valid (unix time)\\n     * @param nonce         Unique nonce\\n     * @param v             v of the signature\\n     * @param r             r of the signature\\n     * @param s             s of the signature\\n     */\\n    function transferWithAuthorization(\\n        address from,\\n        address to,\\n        uint256 value,\\n        uint256 validAfter,\\n        uint256 validBefore,\\n        bytes32 nonce,\\n        uint8 v,\\n        bytes32 r,\\n        bytes32 s\\n    )\\n        external\\n        whenNotPaused // notBlacklisted(from) notBlacklisted(to)\\n    {\\n        _transferWithAuthorization(\\n            from,\\n            to,\\n            value,\\n            validAfter,\\n            validBefore,\\n            nonce,\\n            v,\\n            r,\\n            s\\n        );\\n    }\\n\\n    /**\\n     * @notice Receive a transfer with a signed authorization from the payer\\n     * @dev This has an additional check to ensure that the payee's address\\n     * matches the caller of this function to prevent front-running attacks.\\n     * @param from          Payer's address (Authorizer)\\n     * @param to            Payee's address\\n     * @param value         Amount to be transferred\\n     * @param validAfter    The time after which this is valid (unix time)\\n     * @param validBefore   The time before which this is valid (unix time)\\n     * @param nonce         Unique nonce\\n     * @param v             v of the signature\\n     * @param r             r of the signature\\n     * @param s             s of the signature\\n     */\\n    function receiveWithAuthorization(\\n        address from,\\n        address to,\\n        uint256 value,\\n        uint256 validAfter,\\n        uint256 validBefore,\\n        bytes32 nonce,\\n        uint8 v,\\n        bytes32 r,\\n        bytes32 s\\n    )\\n        external\\n        whenNotPaused // notBlacklisted(from) notBlacklisted(to)\\n    {\\n        _receiveWithAuthorization(\\n            from,\\n            to,\\n            value,\\n            validAfter,\\n            validBefore,\\n            nonce,\\n            v,\\n            r,\\n            s\\n        );\\n    }\\n\\n    /**\\n     * @notice Attempt to cancel an authorization\\n     * @dev Works only if the authorization is not yet used.\\n     * @param authorizer    Authorizer's address\\n     * @param nonce         Nonce of the authorization\\n     * @param v             v of the signature\\n     * @param r             r of the signature\\n     * @param s             s of the signature\\n     */\\n    function cancelAuthorization(\\n        address authorizer,\\n        bytes32 nonce,\\n        uint8 v,\\n        bytes32 r,\\n        bytes32 s\\n    ) external whenNotPaused {\\n        _cancelAuthorization(authorizer, nonce, v, r, s);\\n    }\\n\\n    /**\\n     * @notice Update allowance with a signed permit\\n     * @param owner       Token owner's address (Authorizer)\\n     * @param spender     Spender's address\\n     * @param value       Amount of allowance\\n     * @param deadline    Expiration time, seconds since the epoch\\n     * @param v           v of the signature\\n     * @param r           r of the signature\\n     * @param s           s of the signature\\n     */\\n    function permit(\\n        address owner,\\n        address spender,\\n        uint256 value,\\n        uint256 deadline,\\n        uint8 v,\\n        bytes32 r,\\n        bytes32 s\\n    )\\n        external\\n        whenNotPaused //  notBlacklisted(owner) notBlacklisted(spender)\\n    {\\n        _permit(owner, spender, value, deadline, v, r, s);\\n    }\\n\\n    /**\\n     * @notice Internal function to increase the allowance by a given increment\\n     * @param owner     Token owner's address\\n     * @param spender   Spender's address\\n     * @param increment Amount of increase\\n     */\\n    function _increaseAllowance(\\n        address owner,\\n        address spender,\\n        uint256 increment\\n    ) internal override {\\n        _approve(owner, spender, allowed[owner][spender].add(increment));\\n    }\\n\\n    /**\\n     * @notice Internal function to decrease the allowance by a given decrement\\n     * @param owner     Token owner's address\\n     * @param spender   Spender's address\\n     * @param decrement Amount of decrease\\n     */\\n    function _decreaseAllowance(\\n        address owner,\\n        address spender,\\n        uint256 decrement\\n    ) internal override {\\n        _approve(\\n            owner,\\n            spender,\\n            allowed[owner][spender].sub(\\n                decrement,\\n                \\\"ERC20: decreased allowance below zero\\\"\\n            )\\n        );\\n    }\\n}\\n\\n// File: contracts/v2/FiatTokenV2_1.sol\\n\\n/**\\n * Copyright (c) 2018-2020 CENTRE SECZ\\n *\\n * Permission is hereby granted, free of charge, to any person obtaining a copy\\n * of this software and associated documentation files (the \\\"Software\\\"), to deal\\n * in the Software without restriction, including without limitation the rights\\n * to use, copy, modify, merge, publish, distribute, sublicense, and/or sell\\n * copies of the Software, and to permit persons to whom the Software is\\n * furnished to do so, subject to the following conditions:\\n *\\n * The above copyright notice and this permission notice shall be included in\\n * copies or substantial portions of the Software.\\n *\\n * THE SOFTWARE IS PROVIDED \\\"AS IS\\\", WITHOUT WARRANTY OF ANY KIND, EXPRESS OR\\n * IMPLIED, INCLUDING BUT NOT LIMITED TO THE WARRANTIES OF MERCHANTABILITY,\\n * FITNESS FOR A PARTICULAR PURPOSE AND NONINFRINGEMENT. IN NO EVENT SHALL THE\\n * AUTHORS OR COPYRIGHT HOLDERS BE LIABLE FOR ANY CLAIM, DAMAGES OR OTHER\\n * LIABILITY, WHETHER IN AN ACTION OF CONTRACT, TORT OR OTHERWISE, ARISING FROM,\\n * OUT OF OR IN CONNECTION WITH THE SOFTWARE OR THE USE OR OTHER DEALINGS IN THE\\n * SOFTWARE.\\n */\\n\\npragma solidity 0.6.12;\\n\\n// solhint-disable func-name-mixedcase\\n\\n/**\\n * @title FiatToken V2.1\\n * @notice ERC20 Token backed by fiat reserves, version 2.1\\n */\\ncontract FiatTokenV2_1 is FiatTokenV2 {\\n    /**\\n     * @notice Initialize v2.1\\n     * @param lostAndFound  The address to which the locked funds are sent\\n     */\\n    function initializeV2_1(address lostAndFound) external {\\n        // solhint-disable-next-line reason-string\\n        require(_initializedVersion == 1);\\n\\n        uint256 lockedAmount = balances[address(this)];\\n        if (lockedAmount > 0) {\\n            _transfer(address(this), lostAndFound, lockedAmount);\\n        }\\n        // blacklisted[address(this)] = true;\\n\\n        _initializedVersion = 2;\\n    }\\n\\n    /**\\n     * @notice Version string for the EIP712 domain separator\\n     * @return Version string\\n     */\\n    function version() external pure returns (string memory) {\\n        return \\\"2\\\";\\n    }\\n}\\n\",\"keccak256\":\"0x87cf3d2cb96b28bca2795e2367cd50e267f02a7fc18f6936e42bbbee749b5980\",\"license\":\"MIT\"}},\"version\":1}",
  "bytecode": "0x60806040526000600160146101000a81548160ff02191690831515021790555060006009553480156200003157600080fd5b5062000043336200004960201b60201c565b6200008c565b806000806101000a81548173ffffffffffffffffffffffffffffffffffffffff021916908373ffffffffffffffffffffffffffffffffffffffff16021790555050565b615a14806200009c6000396000f3fe608060405234801561001057600080fd5b506004361061027f5760003560e01c806370a082311161015c578063aa20e1e4116100ce578063dd62ed3e11610087578063dd62ed3e14611022578063e3ee160e1461109a578063e5a6b10f14611148578063e94a0102146111cb578063ef55bec61461122f578063f2fde38b146112dd5761027f565b8063aa20e1e414610de6578063aa271e1a14610e2a578063b2118a8d14610e84578063d505accf14610ef2578063d608ea6414610f8b578063d9169487146110045761027f565b80638da5cb5b116101205780638da5cb5b14610c1557806395d89b4114610c495780639fd0506d14610ccc578063a0cc6a6814610d00578063a457c2d714610d1e578063a9059cbb14610d825761027f565b806370a0823114610ae55780637ecebe0014610b3d5780637f2eecc314610b955780638456cb5914610bb35780638a6db9c314610bbd5761027f565b80633644e515116101f557806342966c68116101b957806342966c68146108fd5780634e44d9561461092b57806354fd4d501461098f578063554bab3c14610a125780635a049a7014610a565780635c975abb14610ac55761027f565b80633644e515146107d957806338a63183146107f7578063395093511461082b5780633f4ba83a1461088f57806340c10f19146108995761027f565b80632fc81e09116102475780632fc81e09146104515780633092afd51461049557806330adf81f146104ef578063313ce5671461050d5780633357162b1461052e57806335d99f35146107a55761027f565b806306fdde0314610284578063095ea7b31461030757806318160ddd1461036b57806323b872dd146103895780632ab600451461040d575b600080fd5b61028c611321565b6040518080602001828103825283818151815260200191508051906020019080838360005b838110156102cc5780820151818401526020810190506102b1565b50505050905090810190601f1680156102f95780820380516001836020036101000a031916815260200191505b509250505060405180910390f35b6103536004803603604081101561031d57600080fd5b81019080803573ffffffffffffffffffffffffffffffffffffffff169060200190929190803590602001909291905050506113bf565b60405180821515815260200191505060405180910390f35b610373611459565b6040518082815260200191505060405180910390f35b6103f56004803603606081101561039f57600080fd5b81019080803573ffffffffffffffffffffffffffffffffffffffff169060200190929190803573ffffffffffffffffffffffffffffffffffffffff16906020019092919080359060200190929190505050611463565b60405180821515815260200191505060405180910390f35b61044f6004803603602081101561042357600080fd5b81019080803573ffffffffffffffffffffffffffffffffffffffff1690602001909291905050506116e2565b005b6104936004803603602081101561046757600080fd5b81019080803573ffffffffffffffffffffffffffffffffffffffff1690602001909291905050506118b0565b005b6104d7600480360360208110156104ab57600080fd5b81019080803573ffffffffffffffffffffffffffffffffffffffff169060200190929190505050611948565b60405180821515815260200191505060405180910390f35b6104f7611ad9565b6040518082815260200191505060405180910390f35b610515611b00565b604051808260ff16815260200191505060405180910390f35b6107a3600480360361010081101561054557600080fd5b810190808035906020019064010000000081111561056257600080fd5b82018360208201111561057457600080fd5b8035906020019184600183028401116401000000008311171561059657600080fd5b91908080601f016020809104026020016040519081016040528093929190818152602001838380828437600081840152601f19601f820116905080830192505050505050509192919290803590602001906401000000008111156105f957600080fd5b82018360208201111561060b57600080fd5b8035906020019184600183028401116401000000008311171561062d57600080fd5b91908080601f016020809104026020016040519081016040528093929190818152602001838380828437600081840152601f19601f8201169050808301925050505050505091929192908035906020019064010000000081111561069057600080fd5b8201836020820111156106a257600080fd5b803590602001918460018302840111640100000000831117156106c457600080fd5b91908080601f016020809104026020016040519081016040528093929190818152602001838380828437600081840152601f19601f820116905080830192505050505050509192919290803560ff169060200190929190803573ffffffffffffffffffffffffffffffffffffffff169060200190929190803573ffffffffffffffffffffffffffffffffffffffff169060200190929190803573ffffffffffffffffffffffffffffffffffffffff169060200190929190803573ffffffffffffffffffffffffffffffffffffffff169060200190929190505050611b13565b005b6107ad611ea1565b604051808273ffffffffffffffffffffffffffffffffffffffff16815260200191505060405180910390f35b6107e1611ec7565b6040518082815260200191505060405180910390f35b6107ff611ecd565b604051808273ffffffffffffffffffffffffffffffffffffffff16815260200191505060405180910390f35b6108776004803603604081101561084157600080fd5b81019080803573ffffffffffffffffffffffffffffffffffffffff16906020019092919080359060200190929190505050611ef7565b60405180821515815260200191505060405180910390f35b610897611f91565b005b6108e5600480360360408110156108af57600080fd5b81019080803573ffffffffffffffffffffffffffffffffffffffff16906020019092919080359060200190929190505050612080565b60405180821515815260200191505060405180910390f35b6109296004803603602081101561091357600080fd5b81019080803590602001909291905050506124ff565b005b6109776004803603604081101561094157600080fd5b81019080803573ffffffffffffffffffffffffffffffffffffffff16906020019092919080359060200190929190505050612843565b60405180821515815260200191505060405180910390f35b610997612a62565b6040518080602001828103825283818151815260200191508051906020019080838360005b838110156109d75780820151818401526020810190506109bc565b50505050905090810190601f168015610a045780820380516001836020036101000a031916815260200191505b509250505060405180910390f35b610a5460048036036020811015610a2857600080fd5b81019080803573ffffffffffffffffffffffffffffffffffffffff169060200190929190505050612a9f565b005b610ac3600480360360a0811015610a6c57600080fd5b81019080803573ffffffffffffffffffffffffffffffffffffffff16906020019092919080359060200190929190803560ff1690602001909291908035906020019092919080359060200190929190505050612c8f565b005b610acd612d26565b60405180821515815260200191505060405180910390f35b610b2760048036036020811015610afb57600080fd5b81019080803573ffffffffffffffffffffffffffffffffffffffff169060200190929190505050612d39565b6040518082815260200191505060405180910390f35b610b7f60048036036020811015610b5357600080fd5b81019080803573ffffffffffffffffffffffffffffffffffffffff169060200190929190505050612d82565b6040518082815260200191505060405180910390f35b610b9d612dcb565b6040518082815260200191505060405180910390f35b610bbb612df2565b005b610bff60048036036020811015610bd357600080fd5b81019080803573ffffffffffffffffffffffffffffffffffffffff169060200190929190505050612ee0565b6040518082815260200191505060405180910390f35b610c1d612f29565b604051808273ffffffffffffffffffffffffffffffffffffffff16815260200191505060405180910390f35b610c51612f52565b6040518080602001828103825283818151815260200191508051906020019080838360005b83811015610c91578082015181840152602081019050610c76565b50505050905090810190601f168015610cbe5780820380516001836020036101000a031916815260200191505b509250505060405180910390f35b610cd4612ff0565b604051808273ffffffffffffffffffffffffffffffffffffffff16815260200191505060405180910390f35b610d08613016565b6040518082815260200191505060405180910390f35b610d6a60048036036040811015610d3457600080fd5b81019080803573ffffffffffffffffffffffffffffffffffffffff1690602001909291908035906020019092919050505061303d565b60405180821515815260200191505060405180910390f35b610dce60048036036040811015610d9857600080fd5b81019080803573ffffffffffffffffffffffffffffffffffffffff169060200190929190803590602001909291905050506130d7565b60405180821515815260200191505060405180910390f35b610e2860048036036020811015610dfc57600080fd5b81019080803573ffffffffffffffffffffffffffffffffffffffff169060200190929190505050613171565b005b610e6c60048036036020811015610e4057600080fd5b81019080803573ffffffffffffffffffffffffffffffffffffffff169060200190929190505050613361565b60405180821515815260200191505060405180910390f35b610ef060048036036060811015610e9a57600080fd5b81019080803573ffffffffffffffffffffffffffffffffffffffff169060200190929190803573ffffffffffffffffffffffffffffffffffffffff169060200190929190803590602001909291905050506133b7565b005b610f89600480360360e0811015610f0857600080fd5b81019080803573ffffffffffffffffffffffffffffffffffffffff169060200190929190803573ffffffffffffffffffffffffffffffffffffffff1690602001909291908035906020019092919080359060200190929190803560ff169060200190929190803590602001909291908035906020019092919050505061348d565b005b61100260048036036020811015610fa157600080fd5b8101908080359060200190640100000000811115610fbe57600080fd5b820183602082011115610fd057600080fd5b80359060200191846001830284011164010000000083111715610ff257600080fd5b9091929391929390505050613528565b005b61100c61361a565b6040518082815260200191505060405180910390f35b6110846004803603604081101561103857600080fd5b81019080803573ffffffffffffffffffffffffffffffffffffffff169060200190929190803573ffffffffffffffffffffffffffffffffffffffff169060200190929190505050613641565b6040518082815260200191505060405180910390f35b61114660048036036101208110156110b157600080fd5b81019080803573ffffffffffffffffffffffffffffffffffffffff169060200190929190803573ffffffffffffffffffffffffffffffffffffffff16906020019092919080359060200190929190803590602001909291908035906020019092919080359060200190929190803560ff16906020019092919080359060200190929190803590602001909291905050506136c8565b005b611150613767565b6040518080602001828103825283818151815260200191508051906020019080838360005b83811015611190578082015181840152602081019050611175565b50505050905090810190601f1680156111bd5780820380516001836020036101000a031916815260200191505b509250505060405180910390f35b611217600480360360408110156111e157600080fd5b81019080803573ffffffffffffffffffffffffffffffffffffffff16906020019092919080359060200190929190505050613805565b60405180821515815260200191505060405180910390f35b6112db600480360361012081101561124657600080fd5b81019080803573ffffffffffffffffffffffffffffffffffffffff169060200190929190803573ffffffffffffffffffffffffffffffffffffffff16906020019092919080359060200190929190803590602001909291908035906020019092919080359060200190929190803560ff169060200190929190803590602001909291908035906020019092919050505061386d565b005b61131f600480360360208110156112f357600080fd5b81019080803573ffffffffffffffffffffffffffffffffffffffff16906020019092919050505061390c565b005b60028054600181600116156101000203166002900480601f0160208091040260200160405190810160405280929190818152602001828054600181600116156101000203166002900480156113b75780601f1061138c576101008083540402835291602001916113b7565b820191906000526020600020905b81548152906001019060200180831161139a57829003601f168201915b505050505081565b6000600160149054906101000a900460ff1615611444576040517f08c379a00000000000000000000000000000000000000000000000000000000081526004018080602001828103825260108152602001807f5061757361626c653a207061757365640000000000000000000000000000000081525060200191505060405180910390fd5b61144f338484613aea565b6001905092915050565b6000600954905090565b6000600160149054906101000a900460ff16156114e8576040517f08c379a00000000000000000000000000000000000000000000000000000000081526004018080602001828103825260108152602001807f5061757361626c653a207061757365640000000000000000000000000000000081525060200191505060405180910390fd5b600860008573ffffffffffffffffffffffffffffffffffffffff1673ffffffffffffffffffffffffffffffffffffffff16815260200190815260200160002060003373ffffffffffffffffffffffffffffffffffffffff1673ffffffffffffffffffffffffffffffffffffffff168152602001908152602001600020548211156115bd576040517f08c379a00000000000000000000000000000000000000000000000000000000081526004018080602001828103825260288152602001806157b16028913960400191505060405180910390fd5b6115c8848484613ce1565b61165782600860008773ffffffffffffffffffffffffffffffffffffffff1673ffffffffffffffffffffffffffffffffffffffff16815260200190815260200160002060003373ffffffffffffffffffffffffffffffffffffffff1673ffffffffffffffffffffffffffffffffffffffff1681526020019081526020016000205461401990919063ffffffff16565b600860008673ffffffffffffffffffffffffffffffffffffffff1673ffffffffffffffffffffffffffffffffffffffff16815260200190815260200160002060003373ffffffffffffffffffffffffffffffffffffffff1673ffffffffffffffffffffffffffffffffffffffff16815260200190815260200160002081905550600190509392505050565b60008054906101000a900473ffffffffffffffffffffffffffffffffffffffff1673ffffffffffffffffffffffffffffffffffffffff163373ffffffffffffffffffffffffffffffffffffffff16146117a3576040517f08c379a00000000000000000000000000000000000000000000000000000000081526004018080602001828103825260208152602001807f4f776e61626c653a2063616c6c6572206973206e6f7420746865206f776e657281525060200191505060405180910390fd5b600073ffffffffffffffffffffffffffffffffffffffff168173ffffffffffffffffffffffffffffffffffffffff161415611829576040517f08c379a000000000000000000000000000000000000000000000000000000000815260040180806020018281038252602a815260200180615675602a913960400191505060405180910390fd5b80600c60006101000a81548173ffffffffffffffffffffffffffffffffffffffff021916908373ffffffffffffffffffffffffffffffffffffffff1602179055508073ffffffffffffffffffffffffffffffffffffffff167fe475e580d85111348e40d8ca33cfdd74c30fe1655c2d8537a13abc10065ffa5a60405160405180910390a250565b6001601060009054906101000a900460ff1660ff16146118cf57600080fd5b6000600760003073ffffffffffffffffffffffffffffffffffffffff1673ffffffffffffffffffffffffffffffffffffffff168152602001908152602001600020549050600081111561192857611927308383613ce1565b5b6002601060006101000a81548160ff021916908360ff1602179055505050565b6000600660009054906101000a900473ffffffffffffffffffffffffffffffffffffffff1673ffffffffffffffffffffffffffffffffffffffff163373ffffffffffffffffffffffffffffffffffffffff16146119f0576040517f08c379a00000000000000000000000000000000000000000000000000000000081526004018080602001828103825260298152602001806156ee6029913960400191505060405180910390fd5b6000600a60008473ffffffffffffffffffffffffffffffffffffffff1673ffffffffffffffffffffffffffffffffffffffff16815260200190815260200160002060006101000a81548160ff0219169083151502179055506000600b60008473ffffffffffffffffffffffffffffffffffffffff1673ffffffffffffffffffffffffffffffffffffffff168152602001908152602001600020819055508173ffffffffffffffffffffffffffffffffffffffff167fe94479a9f7e1952cc78f2d6baab678adc1b772d936c6583def489e524cb6669260405160405180910390a260019050919050565b7f6e71edae12b1b97f4d1f60370fef10105fa2faae0126114a169c64845d6126c960001b81565b600460009054906101000a900460ff1681565b600660149054906101000a900460ff1615611b79576040517f08c379a000000000000000000000000000000000000000000000000000000000815260040180806020018281038252602a81526020018061582c602a913960400191505060405180910390fd5b600073ffffffffffffffffffffffffffffffffffffffff168473ffffffffffffffffffffffffffffffffffffffff161415611bff576040517f08c379a000000000000000000000000000000000000000000000000000000000815260040180806020018281038252602f81526020018061575e602f913960400191505060405180910390fd5b600073ffffffffffffffffffffffffffffffffffffffff168373ffffffffffffffffffffffffffffffffffffffff161415611c85576040517f08c379a000000000000000000000000000000000000000000000000000000000815260040180806020018281038252602981526020018061564c6029913960400191505060405180910390fd5b600073ffffffffffffffffffffffffffffffffffffffff168273ffffffffffffffffffffffffffffffffffffffff161415611d0b576040517f08c379a000000000000000000000000000000000000000000000000000000000815260040180806020018281038252602e8152602001806157d9602e913960400191505060405180910390fd5b600073ffffffffffffffffffffffffffffffffffffffff168173ffffffffffffffffffffffffffffffffffffffff161415611d91576040517f08c379a000000000000000000000000000000000000000000000000000000000815260040180806020018281038252602881526020018061593f6028913960400191505060405180910390fd5b8760029080519060200190611da79291906153fe565b508660039080519060200190611dbe9291906153fe565b508560059080519060200190611dd59291906153fe565b5084600460006101000a81548160ff021916908360ff16021790555083600660006101000a81548173ffffffffffffffffffffffffffffffffffffffff021916908373ffffffffffffffffffffffffffffffffffffffff16021790555082600160006101000a81548173ffffffffffffffffffffffffffffffffffffffff021916908373ffffffffffffffffffffffffffffffffffffffff160217905550611e7c81614063565b6001600660146101000a81548160ff0219169083151502179055505050505050505050565b600660009054906101000a900473ffffffffffffffffffffffffffffffffffffffff1681565b600d5481565b6000600c60009054906101000a900473ffffffffffffffffffffffffffffffffffffffff16905090565b6000600160149054906101000a900460ff1615611f7c576040517f08c379a00000000000000000000000000000000000000000000000000000000081526004018080602001828103825260108152602001807f5061757361626c653a207061757365640000000000000000000000000000000081525060200191505060405180910390fd5b611f873384846140a6565b6001905092915050565b600160009054906101000a900473ffffffffffffffffffffffffffffffffffffffff1673ffffffffffffffffffffffffffffffffffffffff163373ffffffffffffffffffffffffffffffffffffffff1614612037576040517f08c379a00000000000000000000000000000000000000000000000000000000081526004018080602001828103825260228152602001806158cd6022913960400191505060405180910390fd5b6000600160146101000a81548160ff0219169083151502179055507f7805862f689e2f13df9f062ff482ad3ad112aca9e0847911ed832e158c525b3360405160405180910390a1565b6000600160149054906101000a900460ff1615612105576040517f08c379a00000000000000000000000000000000000000000000000000000000081526004018080602001828103825260108152602001807f5061757361626c653a207061757365640000000000000000000000000000000081525060200191505060405180910390fd5b600a60003373ffffffffffffffffffffffffffffffffffffffff1673ffffffffffffffffffffffffffffffffffffffff16815260200190815260200160002060009054906101000a900460ff166121a7576040517f08c379a000000000000000000000000000000000000000000000000000000000815260040180806020018281038252602181526020018061573d6021913960400191505060405180910390fd5b600073ffffffffffffffffffffffffffffffffffffffff168373ffffffffffffffffffffffffffffffffffffffff16141561222d576040517f08c379a00000000000000000000000000000000000000000000000000000000081526004018080602001828103825260238152602001806155bb6023913960400191505060405180910390fd5b60008211612286576040517f08c379a000000000000000000000000000000000000000000000000000000000815260040180806020018281038252602981526020018061569f6029913960400191505060405180910390fd5b6000600b60003373ffffffffffffffffffffffffffffffffffffffff1673ffffffffffffffffffffffffffffffffffffffff16815260200190815260200160002054905080831115612323576040517f08c379a000000000000000000000000000000000000000000000000000000000815260040180806020018281038252602e81526020018061589f602e913960400191505060405180910390fd5b6123388360095461414490919063ffffffff16565b60098190555061239083600760008773ffffffffffffffffffffffffffffffffffffffff1673ffffffffffffffffffffffffffffffffffffffff1681526020019081526020016000205461414490919063ffffffff16565b600760008673ffffffffffffffffffffffffffffffffffffffff1673ffffffffffffffffffffffffffffffffffffffff168152602001908152602001600020819055506123e6838261401990919063ffffffff16565b600b60003373ffffffffffffffffffffffffffffffffffffffff1673ffffffffffffffffffffffffffffffffffffffff168152602001908152602001600020819055508373ffffffffffffffffffffffffffffffffffffffff163373ffffffffffffffffffffffffffffffffffffffff167fab8530f87dc9b59234c4623bf917212bb2536d647574c8e7e5da92c2ede0c9f8856040518082815260200191505060405180910390a38373ffffffffffffffffffffffffffffffffffffffff16600073ffffffffffffffffffffffffffffffffffffffff167fddf252ad1be2c89b69c2b068fc378daa952ba7f163c4a11628f55a4df523b3ef856040518082815260200191505060405180910390a3600191505092915050565b600160149054906101000a900460ff1615612582576040517f08c379a00000000000000000000000000000000000000000000000000000000081526004018080602001828103825260108152602001807f5061757361626c653a207061757365640000000000000000000000000000000081525060200191505060405180910390fd5b600a60003373ffffffffffffffffffffffffffffffffffffffff1673ffffffffffffffffffffffffffffffffffffffff16815260200190815260200160002060009054906101000a900460ff16612624576040517f08c379a000000000000000000000000000000000000000000000000000000000815260040180806020018281038252602181526020018061573d6021913960400191505060405180910390fd5b6000600760003373ffffffffffffffffffffffffffffffffffffffff1673ffffffffffffffffffffffffffffffffffffffff168152602001908152602001600020549050600082116126c1576040517f08c379a00000000000000000000000000000000000000000000000000000000081526004018080602001828103825260298152602001806155926029913960400191505060405180910390fd5b8181101561271a576040517f08c379a00000000000000000000000000000000000000000000000000000000081526004018080602001828103825260268152602001806157176026913960400191505060405180910390fd5b61272f8260095461401990919063ffffffff16565b600981905550612748828261401990919063ffffffff16565b600760003373ffffffffffffffffffffffffffffffffffffffff1673ffffffffffffffffffffffffffffffffffffffff168152602001908152602001600020819055503373ffffffffffffffffffffffffffffffffffffffff167fcc16f5dbb4873280815c1ee09dbd06736cffcc184412cf7a71a0fdb75d397ca5836040518082815260200191505060405180910390a2600073ffffffffffffffffffffffffffffffffffffffff163373ffffffffffffffffffffffffffffffffffffffff167fddf252ad1be2c89b69c2b068fc378daa952ba7f163c4a11628f55a4df523b3ef846040518082815260200191505060405180910390a35050565b6000600160149054906101000a900460ff16156128c8576040517f08c379a00000000000000000000000000000000000000000000000000000000081526004018080602001828103825260108152602001807f5061757361626c653a207061757365640000000000000000000000000000000081525060200191505060405180910390fd5b600660009054906101000a900473ffffffffffffffffffffffffffffffffffffffff1673ffffffffffffffffffffffffffffffffffffffff163373ffffffffffffffffffffffffffffffffffffffff161461296e576040517f08c379a00000000000000000000000000000000000000000000000000000000081526004018080602001828103825260298152602001806156ee6029913960400191505060405180910390fd5b6001600a60008573ffffffffffffffffffffffffffffffffffffffff1673ffffffffffffffffffffffffffffffffffffffff16815260200190815260200160002060006101000a81548160ff02191690831515021790555081600b60008573ffffffffffffffffffffffffffffffffffffffff1673ffffffffffffffffffffffffffffffffffffffff168152602001908152602001600020819055508273ffffffffffffffffffffffffffffffffffffffff167f46980fca912ef9bcdbd36877427b6b90e860769f604e89c0e67720cece530d20836040518082815260200191505060405180910390a26001905092915050565b60606040518060400160405280600181526020017f3200000000000000000000000000000000000000000000000000000000000000815250905090565b60008054906101000a900473ffffffffffffffffffffffffffffffffffffffff1673ffffffffffffffffffffffffffffffffffffffff163373ffffffffffffffffffffffffffffffffffffffff1614612b60576040517f08c379a00000000000000000000000000000000000000000000000000000000081526004018080602001828103825260208152602001807f4f776e61626c653a2063616c6c6572206973206e6f7420746865206f776e657281525060200191505060405180910390fd5b600073ffffffffffffffffffffffffffffffffffffffff168173ffffffffffffffffffffffffffffffffffffffff161415612be6576040517f08c379a000000000000000000000000000000000000000000000000000000000815260040180806020018281038252602881526020018061553f6028913960400191505060405180910390fd5b80600160006101000a81548173ffffffffffffffffffffffffffffffffffffffff021916908373ffffffffffffffffffffffffffffffffffffffff160217905550600160009054906101000a900473ffffffffffffffffffffffffffffffffffffffff1673ffffffffffffffffffffffffffffffffffffffff167fb80482a293ca2e013eda8683c9bd7fc8347cfdaeea5ede58cba46df502c2a60460405160405180910390a250565b600160149054906101000a900460ff1615612d12576040517f08c379a00000000000000000000000000000000000000000000000000000000081526004018080602001828103825260108152602001807f5061757361626c653a207061757365640000000000000000000000000000000081525060200191505060405180910390fd5b612d1f85858585856141cc565b5050505050565b600160149054906101000a900460ff1681565b6000600760008373ffffffffffffffffffffffffffffffffffffffff1673ffffffffffffffffffffffffffffffffffffffff168152602001908152602001600020549050919050565b6000600f60008373ffffffffffffffffffffffffffffffffffffffff1673ffffffffffffffffffffffffffffffffffffffff168152602001908152602001600020549050919050565b7fd099cc98ef71107a616c4f0f941f04c322d8e254fe26b3c6668db87aae413de860001b81565b600160009054906101000a900473ffffffffffffffffffffffffffffffffffffffff1673ffffffffffffffffffffffffffffffffffffffff163373ffffffffffffffffffffffffffffffffffffffff1614612e98576040517f08c379a00000000000000000000000000000000000000000000000000000000081526004018080602001828103825260228152602001806158cd6022913960400191505060405180910390fd5b60018060146101000a81548160ff0219169083151502179055507f6985a02210a168e66602d3235cb6db0e70f92b3ba4d376a33c0f3d9434bff62560405160405180910390a1565b6000600b60008373ffffffffffffffffffffffffffffffffffffffff1673ffffffffffffffffffffffffffffffffffffffff168152602001908152602001600020549050919050565b60008060009054906101000a900473ffffffffffffffffffffffffffffffffffffffff16905090565b60038054600181600116156101000203166002900480601f016020809104026020016040519081016040528092919081815260200182805460018160011615610100020316600290048015612fe85780601f10612fbd57610100808354040283529160200191612fe8565b820191906000526020600020905b815481529060010190602001808311612fcb57829003601f168201915b505050505081565b600160009054906101000a900473ffffffffffffffffffffffffffffffffffffffff1681565b7f7c7c6cdb67a18743f49ec6fa9b35f50d52ed05cbed4cc592e13b44501c1a226760001b81565b6000600160149054906101000a900460ff16156130c2576040517f08c379a00000000000000000000000000000000000000000000000000000000081526004018080602001828103825260108152602001807f5061757361626c653a207061757365640000000000000000000000000000000081525060200191505060405180910390fd5b6130cd3384846143a7565b6001905092915050565b6000600160149054906101000a900460ff161561315c576040517f08c379a00000000000000000000000000000000000000000000000000000000081526004018080602001828103825260108152602001807f5061757361626c653a207061757365640000000000000000000000000000000081525060200191505060405180910390fd5b613167338484613ce1565b6001905092915050565b60008054906101000a900473ffffffffffffffffffffffffffffffffffffffff1673ffffffffffffffffffffffffffffffffffffffff163373ffffffffffffffffffffffffffffffffffffffff1614613232576040517f08c379a00000000000000000000000000000000000000000000000000000000081526004018080602001828103825260208152602001807f4f776e61626c653a2063616c6c6572206973206e6f7420746865206f776e657281525060200191505060405180910390fd5b600073ffffffffffffffffffffffffffffffffffffffff168173ffffffffffffffffffffffffffffffffffffffff1614156132b8576040517f08c379a000000000000000000000000000000000000000000000000000000000815260040180806020018281038252602f81526020018061575e602f913960400191505060405180910390fd5b80600660006101000a81548173ffffffffffffffffffffffffffffffffffffffff021916908373ffffffffffffffffffffffffffffffffffffffff160217905550600660009054906101000a900473ffffffffffffffffffffffffffffffffffffffff1673ffffffffffffffffffffffffffffffffffffffff167fdb66dfa9c6b8f5226fe9aac7e51897ae8ee94ac31dc70bb6c9900b2574b707e660405160405180910390a250565b6000600a60008373ffffffffffffffffffffffffffffffffffffffff1673ffffffffffffffffffffffffffffffffffffffff16815260200190815260200160002060009054906101000a900460ff169050919050565b600c60009054906101000a900473ffffffffffffffffffffffffffffffffffffffff1673ffffffffffffffffffffffffffffffffffffffff163373ffffffffffffffffffffffffffffffffffffffff161461345d576040517f08c379a000000000000000000000000000000000000000000000000000000000815260040180806020018281038252602481526020018061578d6024913960400191505060405180910390fd5b61348882828573ffffffffffffffffffffffffffffffffffffffff1661445f9092919063ffffffff16565b505050565b600160149054906101000a900460ff1615613510576040517f08c379a00000000000000000000000000000000000000000000000000000000081526004018080602001828103825260108152602001807f5061757361626c653a207061757365640000000000000000000000000000000081525060200191505060405180910390fd5b61351f87878787878787614501565b50505050505050565b600660149054906101000a900460ff16801561355657506000601060009054906101000a900460ff1660ff16145b61355f57600080fd5b81816002919061357092919061547e565b506135f482828080601f016020809104026020016040519081016040528093929190818152602001838380828437600081840152601f19601f820116905080830192505050505050506040518060400160405280600181526020017f3200000000000000000000000000000000000000000000000000000000000000815250614723565b600d819055506001601060006101000a81548160ff021916908360ff1602179055505050565b7f158b0a9edf7a828aad02f63cd515c68ef2f50ba807396f6d12842833a159742960001b81565b6000600860008473ffffffffffffffffffffffffffffffffffffffff1673ffffffffffffffffffffffffffffffffffffffff16815260200190815260200160002060008373ffffffffffffffffffffffffffffffffffffffff1673ffffffffffffffffffffffffffffffffffffffff16815260200190815260200160002054905092915050565b600160149054906101000a900460ff161561374b576040517f08c379a00000000000000000000000000000000000000000000000000000000081526004018080602001828103825260108152602001807f5061757361626c653a207061757365640000000000000000000000000000000081525060200191505060405180910390fd5b61375c8989898989898989896147bd565b505050505050505050565b60058054600181600116156101000203166002900480601f0160208091040260200160405190810160405280929190818152602001828054600181600116156101000203166002900480156137fd5780601f106137d2576101008083540402835291602001916137fd565b820191906000526020600020905b8154815290600101906020018083116137e057829003601f168201915b505050505081565b6000600e60008473ffffffffffffffffffffffffffffffffffffffff1673ffffffffffffffffffffffffffffffffffffffff168152602001908152602001600020600083815260200190815260200160002060009054906101000a900460ff16905092915050565b600160149054906101000a900460ff16156138f0576040517f08c379a00000000000000000000000000000000000000000000000000000000081526004018080602001828103825260108152602001807f5061757361626c653a207061757365640000000000000000000000000000000081525060200191505060405180910390fd5b61390189898989898989898961493c565b505050505050505050565b60008054906101000a900473ffffffffffffffffffffffffffffffffffffffff1673ffffffffffffffffffffffffffffffffffffffff163373ffffffffffffffffffffffffffffffffffffffff16146139cd576040517f08c379a00000000000000000000000000000000000000000000000000000000081526004018080602001828103825260208152602001807f4f776e61626c653a2063616c6c6572206973206e6f7420746865206f776e657281525060200191505060405180910390fd5b600073ffffffffffffffffffffffffffffffffffffffff168173ffffffffffffffffffffffffffffffffffffffff161415613a53576040517f08c379a00000000000000000000000000000000000000000000000000000000081526004018080602001828103825260268152602001806156046026913960400191505060405180910390fd5b7f8be0079c531659141344cd1fd0a4f28419497f9722a3daafe3b4186f6b6457e060008054906101000a900473ffffffffffffffffffffffffffffffffffffffff1682604051808373ffffffffffffffffffffffffffffffffffffffff1681526020018273ffffffffffffffffffffffffffffffffffffffff1681526020019250505060405180910390a1613ae781614063565b50565b600073ffffffffffffffffffffffffffffffffffffffff168373ffffffffffffffffffffffffffffffffffffffff161415613b70576040517f08c379a000000000000000000000000000000000000000000000000000000000815260040180806020018281038252602481526020018061587b6024913960400191505060405180910390fd5b600073ffffffffffffffffffffffffffffffffffffffff168273ffffffffffffffffffffffffffffffffffffffff161415613bf6576040517f08c379a000000000000000000000000000000000000000000000000000000000815260040180806020018281038252602281526020018061562a6022913960400191505060405180910390fd5b80600860008573ffffffffffffffffffffffffffffffffffffffff1673ffffffffffffffffffffffffffffffffffffffff16815260200190815260200160002060008473ffffffffffffffffffffffffffffffffffffffff1673ffffffffffffffffffffffffffffffffffffffff168152602001908152602001600020819055508173ffffffffffffffffffffffffffffffffffffffff168373ffffffffffffffffffffffffffffffffffffffff167f8c5be1e5ebec7d5bd14f71427d1e84f3dd0314c0f7b2291e5b200ac8c7c3b925836040518082815260200191505060405180910390a3505050565b600073ffffffffffffffffffffffffffffffffffffffff168373ffffffffffffffffffffffffffffffffffffffff161415613d67576040517f08c379a00000000000000000000000000000000000000000000000000000000081526004018080602001828103825260258152602001806158566025913960400191505060405180910390fd5b600073ffffffffffffffffffffffffffffffffffffffff168273ffffffffffffffffffffffffffffffffffffffff161415613ded576040517f08c379a000000000000000000000000000000000000000000000000000000000815260040180806020018281038252602381526020018061551c6023913960400191505060405180910390fd5b600760008473ffffffffffffffffffffffffffffffffffffffff1673ffffffffffffffffffffffffffffffffffffffff16815260200190815260200160002054811115613e85576040517f08c379a00000000000000000000000000000000000000000000000000000000081526004018080602001828103825260268152602001806156c86026913960400191505060405180910390fd5b613ed781600760008673ffffffffffffffffffffffffffffffffffffffff1673ffffffffffffffffffffffffffffffffffffffff1681526020019081526020016000205461401990919063ffffffff16565b600760008573ffffffffffffffffffffffffffffffffffffffff1673ffffffffffffffffffffffffffffffffffffffff16815260200190815260200160002081905550613f6c81600760008573ffffffffffffffffffffffffffffffffffffffff1673ffffffffffffffffffffffffffffffffffffffff1681526020019081526020016000205461414490919063ffffffff16565b600760008473ffffffffffffffffffffffffffffffffffffffff1673ffffffffffffffffffffffffffffffffffffffff168152602001908152602001600020819055508173ffffffffffffffffffffffffffffffffffffffff168373ffffffffffffffffffffffffffffffffffffffff167fddf252ad1be2c89b69c2b068fc378daa952ba7f163c4a11628f55a4df523b3ef836040518082815260200191505060405180910390a3505050565b600061405b83836040518060400160405280601e81526020017f536166654d6174683a207375627472616374696f6e206f766572666c6f770000815250614b3f565b905092915050565b806000806101000a81548173ffffffffffffffffffffffffffffffffffffffff021916908373ffffffffffffffffffffffffffffffffffffffff16021790555050565b61413f838361413a84600860008973ffffffffffffffffffffffffffffffffffffffff1673ffffffffffffffffffffffffffffffffffffffff16815260200190815260200160002060008873ffffffffffffffffffffffffffffffffffffffff1673ffffffffffffffffffffffffffffffffffffffff1681526020019081526020016000205461414490919063ffffffff16565b613aea565b505050565b6000808284019050838110156141c2576040517f08c379a000000000000000000000000000000000000000000000000000000000815260040180806020018281038252601b8152602001807f536166654d6174683a206164646974696f6e206f766572666c6f77000000000081525060200191505060405180910390fd5b8091505092915050565b6141d68585614bff565b60607f158b0a9edf7a828aad02f63cd515c68ef2f50ba807396f6d12842833a159742960001b8686604051602001808481526020018373ffffffffffffffffffffffffffffffffffffffff168152602001828152602001935050505060405160208183030381529060405290508573ffffffffffffffffffffffffffffffffffffffff16614269600d5486868686614cb7565b73ffffffffffffffffffffffffffffffffffffffff16146142f2576040517f08c379a000000000000000000000000000000000000000000000000000000000815260040180806020018281038252601e8152602001807f46696174546f6b656e56323a20696e76616c6964207369676e6174757265000081525060200191505060405180910390fd5b6001600e60008873ffffffffffffffffffffffffffffffffffffffff1673ffffffffffffffffffffffffffffffffffffffff168152602001908152602001600020600087815260200190815260200160002060006101000a81548160ff021916908315150217905550848673ffffffffffffffffffffffffffffffffffffffff167f1cdd46ff242716cdaa72d159d339a485b3438398348d68f09d7c8c0a59353d8160405160405180910390a3505050505050565b61445a8383614455846040518060600160405280602581526020016159ba60259139600860008a73ffffffffffffffffffffffffffffffffffffffff1673ffffffffffffffffffffffffffffffffffffffff16815260200190815260200160002060008973ffffffffffffffffffffffffffffffffffffffff1673ffffffffffffffffffffffffffffffffffffffff16815260200190815260200160002054614b3f9092919063ffffffff16565b613aea565b505050565b6144fc8363a9059cbb60e01b8484604051602401808373ffffffffffffffffffffffffffffffffffffffff16815260200182815260200192505050604051602081830303815290604052907bffffffffffffffffffffffffffffffffffffffffffffffffffffffff19166020820180517bffffffffffffffffffffffffffffffffffffffffffffffffffffffff8381831617835250505050614d32565b505050565b42841015614577576040517f08c379a000000000000000000000000000000000000000000000000000000000815260040180806020018281038252601e8152602001807f46696174546f6b656e56323a207065726d69742069732065787069726564000081525060200191505060405180910390fd5b60607f6e71edae12b1b97f4d1f60370fef10105fa2faae0126114a169c64845d6126c960001b888888600f60008d73ffffffffffffffffffffffffffffffffffffffff1673ffffffffffffffffffffffffffffffffffffffff16815260200190815260200160002060008154809291906001019190505589604051602001808781526020018673ffffffffffffffffffffffffffffffffffffffff1681526020018573ffffffffffffffffffffffffffffffffffffffff168152602001848152602001838152602001828152602001965050505050505060405160208183030381529060405290508773ffffffffffffffffffffffffffffffffffffffff16614685600d5486868686614cb7565b73ffffffffffffffffffffffffffffffffffffffff161461470e576040517f08c379a000000000000000000000000000000000000000000000000000000000815260040180806020018281038252601a8152602001807f454950323631323a20696e76616c6964207369676e617475726500000000000081525060200191505060405180910390fd5b614719888888613aea565b5050505050505050565b6000804690507f8b73c3c69bb8fe3d512ecc4cf759cc79239f7b179b0ffacaa9a75d522b39400f848051906020012084805190602001208330604051602001808681526020018581526020018481526020018381526020018273ffffffffffffffffffffffffffffffffffffffff168152602001955050505050506040516020818303038152906040528051906020012091505092915050565b6147c989858888614e21565b60607f7c7c6cdb67a18743f49ec6fa9b35f50d52ed05cbed4cc592e13b44501c1a226760001b8a8a8a8a8a8a604051602001808881526020018773ffffffffffffffffffffffffffffffffffffffff1681526020018673ffffffffffffffffffffffffffffffffffffffff16815260200185815260200184815260200183815260200182815260200197505050505050505060405160208183030381529060405290508973ffffffffffffffffffffffffffffffffffffffff16614892600d5486868686614cb7565b73ffffffffffffffffffffffffffffffffffffffff161461491b576040517f08c379a000000000000000000000000000000000000000000000000000000000815260040180806020018281038252601e8152602001807f46696174546f6b656e56323a20696e76616c6964207369676e6174757265000081525060200191505060405180910390fd5b6149258a86614ee1565b6149308a8a8a613ce1565b50505050505050505050565b3373ffffffffffffffffffffffffffffffffffffffff168873ffffffffffffffffffffffffffffffffffffffff16146149c0576040517f08c379a00000000000000000000000000000000000000000000000000000000081526004018080602001828103825260258152602001806158076025913960400191505060405180910390fd5b6149cc89858888614e21565b60607fd099cc98ef71107a616c4f0f941f04c322d8e254fe26b3c6668db87aae413de860001b8a8a8a8a8a8a604051602001808881526020018773ffffffffffffffffffffffffffffffffffffffff1681526020018673ffffffffffffffffffffffffffffffffffffffff16815260200185815260200184815260200183815260200182815260200197505050505050505060405160208183030381529060405290508973ffffffffffffffffffffffffffffffffffffffff16614a95600d5486868686614cb7565b73ffffffffffffffffffffffffffffffffffffffff1614614b1e576040517f08c379a000000000000000000000000000000000000000000000000000000000815260040180806020018281038252601e8152602001807f46696174546f6b656e56323a20696e76616c6964207369676e6174757265000081525060200191505060405180910390fd5b614b288a86614ee1565b614b338a8a8a613ce1565b50505050505050505050565b6000838311158290614bec576040517f08c379a00000000000000000000000000000000000000000000000000000000081526004018080602001828103825283818151815260200191508051906020019080838360005b83811015614bb1578082015181840152602081019050614b96565b50505050905090810190601f168015614bde5780820380516001836020036101000a031916815260200191505b509250505060405180910390fd5b5060008385039050809150509392505050565b600e60008373ffffffffffffffffffffffffffffffffffffffff1673ffffffffffffffffffffffffffffffffffffffff168152602001908152602001600020600082815260200190815260200160002060009054906101000a900460ff1615614cb3576040517f08c379a000000000000000000000000000000000000000000000000000000000815260040180806020018281038252602e815260200180615967602e913960400191505060405180910390fd5b5050565b60008086838051906020012060405160200180807f190100000000000000000000000000000000000000000000000000000000000081525060020183815260200182815260200192505050604051602081830303815290604052805190602001209050614d2681878787614f92565b91505095945050505050565b6060614d94826040518060400160405280602081526020017f5361666545524332303a206c6f772d6c6576656c2063616c6c206661696c65648152508573ffffffffffffffffffffffffffffffffffffffff166151959092919063ffffffff16565b9050600081511115614e1c57808060200190516020811015614db557600080fd5b8101908080519060200190929190505050614e1b576040517f08c379a000000000000000000000000000000000000000000000000000000000815260040180806020018281038252602a815260200180615915602a913960400191505060405180910390fd5b5b505050565b814211614e79576040517f08c379a000000000000000000000000000000000000000000000000000000000815260040180806020018281038252602b815260200180615567602b913960400191505060405180910390fd5b804210614ed1576040517f08c379a00000000000000000000000000000000000000000000000000000000081526004018080602001828103825260258152602001806159956025913960400191505060405180910390fd5b614edb8484614bff565b50505050565b6001600e60008473ffffffffffffffffffffffffffffffffffffffff1673ffffffffffffffffffffffffffffffffffffffff168152602001908152602001600020600083815260200190815260200160002060006101000a81548160ff021916908315150217905550808273ffffffffffffffffffffffffffffffffffffffff167f98de503528ee59b575ef0c0a2576a82497bfc029a5685b209e9ec333479b10a560405160405180910390a35050565b60007f7fffffffffffffffffffffffffffffff5d576e7357a4501ddfe92f46681b20a08260001c1115615010576040517f08c379a00000000000000000000000000000000000000000000000000000000081526004018080602001828103825260268152602001806158ef6026913960400191505060405180910390fd5b601b8460ff16141580156150285750601c8460ff1614155b1561507e576040517f08c379a00000000000000000000000000000000000000000000000000000000081526004018080602001828103825260268152602001806155de6026913960400191505060405180910390fd5b600060018686868660405160008152602001604052604051808581526020018460ff1681526020018381526020018281526020019450505050506020604051602081039080840390855afa1580156150da573d6000803e3d6000fd5b505050602060405103519050600073ffffffffffffffffffffffffffffffffffffffff168173ffffffffffffffffffffffffffffffffffffffff161415615189576040517f08c379a000000000000000000000000000000000000000000000000000000000815260040180806020018281038252601c8152602001807f45435265636f7665723a20696e76616c6964207369676e61747572650000000081525060200191505060405180910390fd5b80915050949350505050565b60606151a484846000856151ad565b90509392505050565b60606151b8856153b3565b61522a576040517f08c379a000000000000000000000000000000000000000000000000000000000815260040180806020018281038252601d8152602001807f416464726573733a2063616c6c20746f206e6f6e2d636f6e747261637400000081525060200191505060405180910390fd5b600060608673ffffffffffffffffffffffffffffffffffffffff1685876040518082805190602001908083835b6020831061527a5780518252602082019150602081019050602083039250615257565b6001836020036101000a03801982511681845116808217855250505050505090500191505060006040518083038185875af1925050503d80600081146152dc576040519150601f19603f3d011682016040523d82523d6000602084013e6152e1565b606091505b509150915081156152f65780925050506153ab565b6000815111156153095780518082602001fd5b836040517f08c379a00000000000000000000000000000000000000000000000000000000081526004018080602001828103825283818151815260200191508051906020019080838360005b83811015615370578082015181840152602081019050615355565b50505050905090810190601f16801561539d5780820380516001836020036101000a031916815260200191505b509250505060405180910390fd5b949350505050565b60008060007fc5d2460186f7233c927e7db2dcc703c0e500b653ca82273b7bfad8045d85a47060001b9050833f91508082141580156153f557506000801b8214155b92505050919050565b828054600181600116156101000203166002900490600052602060002090601f016020900481019282601f1061543f57805160ff191683800117855561546d565b8280016001018555821561546d579182015b8281111561546c578251825591602001919060010190615451565b5b50905061547a91906154fe565b5090565b828054600181600116156101000203166002900490600052602060002090601f016020900481019282601f106154bf57803560ff19168380011785556154ed565b828001600101855582156154ed579182015b828111156154ec5782358255916020019190600101906154d1565b5b5090506154fa91906154fe565b5090565b5b808211156155175760008160009055506001016154ff565b509056fe45524332303a207472616e7366657220746f20746865207a65726f20616464726573735061757361626c653a206e65772070617573657220697320746865207a65726f206164647265737346696174546f6b656e56323a20617574686f72697a6174696f6e206973206e6f74207965742076616c696446696174546f6b656e3a206275726e20616d6f756e74206e6f742067726561746572207468616e203046696174546f6b656e3a206d696e7420746f20746865207a65726f206164647265737345435265636f7665723a20696e76616c6964207369676e6174757265202776272076616c75654f776e61626c653a206e6577206f776e657220697320746865207a65726f206164647265737345524332303a20617070726f766520746f20746865207a65726f206164647265737346696174546f6b656e3a206e65772070617573657220697320746865207a65726f2061646472657373526573637561626c653a206e6577207265736375657220697320746865207a65726f206164647265737346696174546f6b656e3a206d696e7420616d6f756e74206e6f742067726561746572207468616e203045524332303a207472616e7366657220616d6f756e7420657863656564732062616c616e636546696174546f6b656e3a2063616c6c6572206973206e6f7420746865206d61737465724d696e74657246696174546f6b656e3a206275726e20616d6f756e7420657863656564732062616c616e636546696174546f6b656e3a2063616c6c6572206973206e6f742061206d696e74657246696174546f6b656e3a206e6577206d61737465724d696e74657220697320746865207a65726f2061646472657373526573637561626c653a2063616c6c6572206973206e6f7420746865207265736375657245524332303a207472616e7366657220616d6f756e74206578636565647320616c6c6f77616e636546696174546f6b656e3a206e657720626c61636b6c697374657220697320746865207a65726f206164647265737346696174546f6b656e56323a2063616c6c6572206d7573742062652074686520706179656546696174546f6b656e3a20636f6e747261637420697320616c726561647920696e697469616c697a656445524332303a207472616e736665722066726f6d20746865207a65726f206164647265737345524332303a20617070726f76652066726f6d20746865207a65726f206164647265737346696174546f6b656e3a206d696e7420616d6f756e742065786365656473206d696e746572416c6c6f77616e63655061757361626c653a2063616c6c6572206973206e6f74207468652070617573657245435265636f7665723a20696e76616c6964207369676e6174757265202773272076616c75655361666545524332303a204552433230206f7065726174696f6e20646964206e6f74207375636365656446696174546f6b656e3a206e6577206f776e657220697320746865207a65726f206164647265737346696174546f6b656e56323a20617574686f72697a6174696f6e2069732075736564206f722063616e63656c656446696174546f6b656e56323a20617574686f72697a6174696f6e206973206578706972656445524332303a2064656372656173656420616c6c6f77616e63652062656c6f77207a65726fa26469706673582212201d252768463a79e2c9112789abf532ba21e9c65683d907ad66973f50a4f693e764736f6c634300060c0033",
  "deployedBytecode": "0x608060405234801561001057600080fd5b506004361061027f5760003560e01c806370a082311161015c578063aa20e1e4116100ce578063dd62ed3e11610087578063dd62ed3e14611022578063e3ee160e1461109a578063e5a6b10f14611148578063e94a0102146111cb578063ef55bec61461122f578063f2fde38b146112dd5761027f565b8063aa20e1e414610de6578063aa271e1a14610e2a578063b2118a8d14610e84578063d505accf14610ef2578063d608ea6414610f8b578063d9169487146110045761027f565b80638da5cb5b116101205780638da5cb5b14610c1557806395d89b4114610c495780639fd0506d14610ccc578063a0cc6a6814610d00578063a457c2d714610d1e578063a9059cbb14610d825761027f565b806370a0823114610ae55780637ecebe0014610b3d5780637f2eecc314610b955780638456cb5914610bb35780638a6db9c314610bbd5761027f565b80633644e515116101f557806342966c68116101b957806342966c68146108fd5780634e44d9561461092b57806354fd4d501461098f578063554bab3c14610a125780635a049a7014610a565780635c975abb14610ac55761027f565b80633644e515146107d957806338a63183146107f7578063395093511461082b5780633f4ba83a1461088f57806340c10f19146108995761027f565b80632fc81e09116102475780632fc81e09146104515780633092afd51461049557806330adf81f146104ef578063313ce5671461050d5780633357162b1461052e57806335d99f35146107a55761027f565b806306fdde0314610284578063095ea7b31461030757806318160ddd1461036b57806323b872dd146103895780632ab600451461040d575b600080fd5b61028c611321565b6040518080602001828103825283818151815260200191508051906020019080838360005b838110156102cc5780820151818401526020810190506102b1565b50505050905090810190601f1680156102f95780820380516001836020036101000a031916815260200191505b509250505060405180910390f35b6103536004803603604081101561031d57600080fd5b81019080803573ffffffffffffffffffffffffffffffffffffffff169060200190929190803590602001909291905050506113bf565b60405180821515815260200191505060405180910390f35b610373611459565b6040518082815260200191505060405180910390f35b6103f56004803603606081101561039f57600080fd5b81019080803573ffffffffffffffffffffffffffffffffffffffff169060200190929190803573ffffffffffffffffffffffffffffffffffffffff16906020019092919080359060200190929190505050611463565b60405180821515815260200191505060405180910390f35b61044f6004803603602081101561042357600080fd5b81019080803573ffffffffffffffffffffffffffffffffffffffff1690602001909291905050506116e2565b005b6104936004803603602081101561046757600080fd5b81019080803573ffffffffffffffffffffffffffffffffffffffff1690602001909291905050506118b0565b005b6104d7600480360360208110156104ab57600080fd5b81019080803573ffffffffffffffffffffffffffffffffffffffff169060200190929190505050611948565b60405180821515815260200191505060405180910390f35b6104f7611ad9565b6040518082815260200191505060405180910390f35b610515611b00565b604051808260ff16815260200191505060405180910390f35b6107a3600480360361010081101561054557600080fd5b810190808035906020019064010000000081111561056257600080fd5b82018360208201111561057457600080fd5b8035906020019184600183028401116401000000008311171561059657600080fd5b91908080601f016020809104026020016040519081016040528093929190818152602001838380828437600081840152601f19601f820116905080830192505050505050509192919290803590602001906401000000008111156105f957600080fd5b82018360208201111561060b57600080fd5b8035906020019184600183028401116401000000008311171561062d57600080fd5b91908080601f016020809104026020016040519081016040528093929190818152602001838380828437600081840152601f19601f8201169050808301925050505050505091929192908035906020019064010000000081111561069057600080fd5b8201836020820111156106a257600080fd5b803590602001918460018302840111640100000000831117156106c457600080fd5b91908080601f016020809104026020016040519081016040528093929190818152602001838380828437600081840152601f19601f820116905080830192505050505050509192919290803560ff169060200190929190803573ffffffffffffffffffffffffffffffffffffffff169060200190929190803573ffffffffffffffffffffffffffffffffffffffff169060200190929190803573ffffffffffffffffffffffffffffffffffffffff169060200190929190803573ffffffffffffffffffffffffffffffffffffffff169060200190929190505050611b13565b005b6107ad611ea1565b604051808273ffffffffffffffffffffffffffffffffffffffff16815260200191505060405180910390f35b6107e1611ec7565b6040518082815260200191505060405180910390f35b6107ff611ecd565b604051808273ffffffffffffffffffffffffffffffffffffffff16815260200191505060405180910390f35b6108776004803603604081101561084157600080fd5b81019080803573ffffffffffffffffffffffffffffffffffffffff16906020019092919080359060200190929190505050611ef7565b60405180821515815260200191505060405180910390f35b610897611f91565b005b6108e5600480360360408110156108af57600080fd5b81019080803573ffffffffffffffffffffffffffffffffffffffff16906020019092919080359060200190929190505050612080565b60405180821515815260200191505060405180910390f35b6109296004803603602081101561091357600080fd5b81019080803590602001909291905050506124ff565b005b6109776004803603604081101561094157600080fd5b81019080803573ffffffffffffffffffffffffffffffffffffffff16906020019092919080359060200190929190505050612843565b60405180821515815260200191505060405180910390f35b610997612a62565b6040518080602001828103825283818151815260200191508051906020019080838360005b838110156109d75780820151818401526020810190506109bc565b50505050905090810190601f168015610a045780820380516001836020036101000a031916815260200191505b509250505060405180910390f35b610a5460048036036020811015610a2857600080fd5b81019080803573ffffffffffffffffffffffffffffffffffffffff169060200190929190505050612a9f565b005b610ac3600480360360a0811015610a6c57600080fd5b81019080803573ffffffffffffffffffffffffffffffffffffffff16906020019092919080359060200190929190803560ff1690602001909291908035906020019092919080359060200190929190505050612c8f565b005b610acd612d26565b60405180821515815260200191505060405180910390f35b610b2760048036036020811015610afb57600080fd5b81019080803573ffffffffffffffffffffffffffffffffffffffff169060200190929190505050612d39565b6040518082815260200191505060405180910390f35b610b7f60048036036020811015610b5357600080fd5b81019080803573ffffffffffffffffffffffffffffffffffffffff169060200190929190505050612d82565b6040518082815260200191505060405180910390f35b610b9d612dcb565b6040518082815260200191505060405180910390f35b610bbb612df2565b005b610bff60048036036020811015610bd357600080fd5b81019080803573ffffffffffffffffffffffffffffffffffffffff169060200190929190505050612ee0565b6040518082815260200191505060405180910390f35b610c1d612f29565b604051808273ffffffffffffffffffffffffffffffffffffffff16815260200191505060405180910390f35b610c51612f52565b6040518080602001828103825283818151815260200191508051906020019080838360005b83811015610c91578082015181840152602081019050610c76565b50505050905090810190601f168015610cbe5780820380516001836020036101000a031916815260200191505b509250505060405180910390f35b610cd4612ff0565b604051808273ffffffffffffffffffffffffffffffffffffffff16815260200191505060405180910390f35b610d08613016565b6040518082815260200191505060405180910390f35b610d6a60048036036040811015610d3457600080fd5b81019080803573ffffffffffffffffffffffffffffffffffffffff1690602001909291908035906020019092919050505061303d565b60405180821515815260200191505060405180910390f35b610dce60048036036040811015610d9857600080fd5b81019080803573ffffffffffffffffffffffffffffffffffffffff169060200190929190803590602001909291905050506130d7565b60405180821515815260200191505060405180910390f35b610e2860048036036020811015610dfc57600080fd5b81019080803573ffffffffffffffffffffffffffffffffffffffff169060200190929190505050613171565b005b610e6c60048036036020811015610e4057600080fd5b81019080803573ffffffffffffffffffffffffffffffffffffffff169060200190929190505050613361565b60405180821515815260200191505060405180910390f35b610ef060048036036060811015610e9a57600080fd5b81019080803573ffffffffffffffffffffffffffffffffffffffff169060200190929190803573ffffffffffffffffffffffffffffffffffffffff169060200190929190803590602001909291905050506133b7565b005b610f89600480360360e0811015610f0857600080fd5b81019080803573ffffffffffffffffffffffffffffffffffffffff169060200190929190803573ffffffffffffffffffffffffffffffffffffffff1690602001909291908035906020019092919080359060200190929190803560ff169060200190929190803590602001909291908035906020019092919050505061348d565b005b61100260048036036020811015610fa157600080fd5b8101908080359060200190640100000000811115610fbe57600080fd5b820183602082011115610fd057600080fd5b80359060200191846001830284011164010000000083111715610ff257600080fd5b9091929391929390505050613528565b005b61100c61361a565b6040518082815260200191505060405180910390f35b6110846004803603604081101561103857600080fd5b81019080803573ffffffffffffffffffffffffffffffffffffffff169060200190929190803573ffffffffffffffffffffffffffffffffffffffff169060200190929190505050613641565b6040518082815260200191505060405180910390f35b61114660048036036101208110156110b157600080fd5b81019080803573ffffffffffffffffffffffffffffffffffffffff169060200190929190803573ffffffffffffffffffffffffffffffffffffffff16906020019092919080359060200190929190803590602001909291908035906020019092919080359060200190929190803560ff16906020019092919080359060200190929190803590602001909291905050506136c8565b005b611150613767565b6040518080602001828103825283818151815260200191508051906020019080838360005b83811015611190578082015181840152602081019050611175565b50505050905090810190601f1680156111bd5780820380516001836020036101000a031916815260200191505b509250505060405180910390f35b611217600480360360408110156111e157600080fd5b81019080803573ffffffffffffffffffffffffffffffffffffffff16906020019092919080359060200190929190505050613805565b60405180821515815260200191505060405180910390f35b6112db600480360361012081101561124657600080fd5b81019080803573ffffffffffffffffffffffffffffffffffffffff169060200190929190803573ffffffffffffffffffffffffffffffffffffffff16906020019092919080359060200190929190803590602001909291908035906020019092919080359060200190929190803560ff169060200190929190803590602001909291908035906020019092919050505061386d565b005b61131f600480360360208110156112f357600080fd5b81019080803573ffffffffffffffffffffffffffffffffffffffff16906020019092919050505061390c565b005b60028054600181600116156101000203166002900480601f0160208091040260200160405190810160405280929190818152602001828054600181600116156101000203166002900480156113b75780601f1061138c576101008083540402835291602001916113b7565b820191906000526020600020905b81548152906001019060200180831161139a57829003601f168201915b505050505081565b6000600160149054906101000a900460ff1615611444576040517f08c379a00000000000000000000000000000000000000000000000000000000081526004018080602001828103825260108152602001807f5061757361626c653a207061757365640000000000000000000000000000000081525060200191505060405180910390fd5b61144f338484613aea565b6001905092915050565b6000600954905090565b6000600160149054906101000a900460ff16156114e8576040517f08c379a00000000000000000000000000000000000000000000000000000000081526004018080602001828103825260108152602001807f5061757361626c653a207061757365640000000000000000000000000000000081525060200191505060405180910390fd5b600860008573ffffffffffffffffffffffffffffffffffffffff1673ffffffffffffffffffffffffffffffffffffffff16815260200190815260200160002060003373ffffffffffffffffffffffffffffffffffffffff1673ffffffffffffffffffffffffffffffffffffffff168152602001908152602001600020548211156115bd576040517f08c379a00000000000000000000000000000000000000000000000000000000081526004018080602001828103825260288152602001806157b16028913960400191505060405180910390fd5b6115c8848484613ce1565b61165782600860008773ffffffffffffffffffffffffffffffffffffffff1673ffffffffffffffffffffffffffffffffffffffff16815260200190815260200160002060003373ffffffffffffffffffffffffffffffffffffffff1673ffffffffffffffffffffffffffffffffffffffff1681526020019081526020016000205461401990919063ffffffff16565b600860008673ffffffffffffffffffffffffffffffffffffffff1673ffffffffffffffffffffffffffffffffffffffff16815260200190815260200160002060003373ffffffffffffffffffffffffffffffffffffffff1673ffffffffffffffffffffffffffffffffffffffff16815260200190815260200160002081905550600190509392505050565b60008054906101000a900473ffffffffffffffffffffffffffffffffffffffff1673ffffffffffffffffffffffffffffffffffffffff163373ffffffffffffffffffffffffffffffffffffffff16146117a3576040517f08c379a00000000000000000000000000000000000000000000000000000000081526004018080602001828103825260208152602001807f4f776e61626c653a2063616c6c6572206973206e6f7420746865206f776e657281525060200191505060405180910390fd5b600073ffffffffffffffffffffffffffffffffffffffff168173ffffffffffffffffffffffffffffffffffffffff161415611829576040517f08c379a000000000000000000000000000000000000000000000000000000000815260040180806020018281038252602a815260200180615675602a913960400191505060405180910390fd5b80600c60006101000a81548173ffffffffffffffffffffffffffffffffffffffff021916908373ffffffffffffffffffffffffffffffffffffffff1602179055508073ffffffffffffffffffffffffffffffffffffffff167fe475e580d85111348e40d8ca33cfdd74c30fe1655c2d8537a13abc10065ffa5a60405160405180910390a250565b6001601060009054906101000a900460ff1660ff16146118cf57600080fd5b6000600760003073ffffffffffffffffffffffffffffffffffffffff1673ffffffffffffffffffffffffffffffffffffffff168152602001908152602001600020549050600081111561192857611927308383613ce1565b5b6002601060006101000a81548160ff021916908360ff1602179055505050565b6000600660009054906101000a900473ffffffffffffffffffffffffffffffffffffffff1673ffffffffffffffffffffffffffffffffffffffff163373ffffffffffffffffffffffffffffffffffffffff16146119f0576040517f08c379a00000000000000000000000000000000000000000000000000000000081526004018080602001828103825260298152602001806156ee6029913960400191505060405180910390fd5b6000600a60008473ffffffffffffffffffffffffffffffffffffffff1673ffffffffffffffffffffffffffffffffffffffff16815260200190815260200160002060006101000a81548160ff0219169083151502179055506000600b60008473ffffffffffffffffffffffffffffffffffffffff1673ffffffffffffffffffffffffffffffffffffffff168152602001908152602001600020819055508173ffffffffffffffffffffffffffffffffffffffff167fe94479a9f7e1952cc78f2d6baab678adc1b772d936c6583def489e524cb6669260405160405180910390a260019050919050565b7f6e71edae12b1b97f4d1f60370fef10105fa2faae0126114a169c64845d6126c960001b81565b600460009054906101000a900460ff1681565b600660149054906101000a900460ff1615611b79576040517f08c379a000000000000000000000000000000000000000000000000000000000815260040180806020018281038252602a81526020018061582c602a913960400191505060405180910390fd5b600073ffffffffffffffffffffffffffffffffffffffff168473ffffffffffffffffffffffffffffffffffffffff161415611bff576040517f08c379a000000000000000000000000000000000000000000000000000000000815260040180806020018281038252602f81526020018061575e602f913960400191505060405180910390fd5b600073ffffffffffffffffffffffffffffffffffffffff168373ffffffffffffffffffffffffffffffffffffffff161415611c85576040517f08c379a000000000000000000000000000000000000000000000000000000000815260040180806020018281038252602981526020018061564c6029913960400191505060405180910390fd5b600073ffffffffffffffffffffffffffffffffffffffff168273ffffffffffffffffffffffffffffffffffffffff161415611d0b576040517f08c379a000000000000000000000000000000000000000000000000000000000815260040180806020018281038252602e8152602001806157d9602e913960400191505060405180910390fd5b600073ffffffffffffffffffffffffffffffffffffffff168173ffffffffffffffffffffffffffffffffffffffff161415611d91576040517f08c379a000000000000000000000000000000000000000000000000000000000815260040180806020018281038252602881526020018061593f6028913960400191505060405180910390fd5b8760029080519060200190611da79291906153fe565b508660039080519060200190611dbe9291906153fe565b508560059080519060200190611dd59291906153fe565b5084600460006101000a81548160ff021916908360ff16021790555083600660006101000a81548173ffffffffffffffffffffffffffffffffffffffff021916908373ffffffffffffffffffffffffffffffffffffffff16021790555082600160006101000a81548173ffffffffffffffffffffffffffffffffffffffff021916908373ffffffffffffffffffffffffffffffffffffffff160217905550611e7c81614063565b6001600660146101000a81548160ff0219169083151502179055505050505050505050565b600660009054906101000a900473ffffffffffffffffffffffffffffffffffffffff1681565b600d5481565b6000600c60009054906101000a900473ffffffffffffffffffffffffffffffffffffffff16905090565b6000600160149054906101000a900460ff1615611f7c576040517f08c379a00000000000000000000000000000000000000000000000000000000081526004018080602001828103825260108152602001807f5061757361626c653a207061757365640000000000000000000000000000000081525060200191505060405180910390fd5b611f873384846140a6565b6001905092915050565b600160009054906101000a900473ffffffffffffffffffffffffffffffffffffffff1673ffffffffffffffffffffffffffffffffffffffff163373ffffffffffffffffffffffffffffffffffffffff1614612037576040517f08c379a00000000000000000000000000000000000000000000000000000000081526004018080602001828103825260228152602001806158cd6022913960400191505060405180910390fd5b6000600160146101000a81548160ff0219169083151502179055507f7805862f689e2f13df9f062ff482ad3ad112aca9e0847911ed832e158c525b3360405160405180910390a1565b6000600160149054906101000a900460ff1615612105576040517f08c379a00000000000000000000000000000000000000000000000000000000081526004018080602001828103825260108152602001807f5061757361626c653a207061757365640000000000000000000000000000000081525060200191505060405180910390fd5b600a60003373ffffffffffffffffffffffffffffffffffffffff1673ffffffffffffffffffffffffffffffffffffffff16815260200190815260200160002060009054906101000a900460ff166121a7576040517f08c379a000000000000000000000000000000000000000000000000000000000815260040180806020018281038252602181526020018061573d6021913960400191505060405180910390fd5b600073ffffffffffffffffffffffffffffffffffffffff168373ffffffffffffffffffffffffffffffffffffffff16141561222d576040517f08c379a00000000000000000000000000000000000000000000000000000000081526004018080602001828103825260238152602001806155bb6023913960400191505060405180910390fd5b60008211612286576040517f08c379a000000000000000000000000000000000000000000000000000000000815260040180806020018281038252602981526020018061569f6029913960400191505060405180910390fd5b6000600b60003373ffffffffffffffffffffffffffffffffffffffff1673ffffffffffffffffffffffffffffffffffffffff16815260200190815260200160002054905080831115612323576040517f08c379a000000000000000000000000000000000000000000000000000000000815260040180806020018281038252602e81526020018061589f602e913960400191505060405180910390fd5b6123388360095461414490919063ffffffff16565b60098190555061239083600760008773ffffffffffffffffffffffffffffffffffffffff1673ffffffffffffffffffffffffffffffffffffffff1681526020019081526020016000205461414490919063ffffffff16565b600760008673ffffffffffffffffffffffffffffffffffffffff1673ffffffffffffffffffffffffffffffffffffffff168152602001908152602001600020819055506123e6838261401990919063ffffffff16565b600b60003373ffffffffffffffffffffffffffffffffffffffff1673ffffffffffffffffffffffffffffffffffffffff168152602001908152602001600020819055508373ffffffffffffffffffffffffffffffffffffffff163373ffffffffffffffffffffffffffffffffffffffff167fab8530f87dc9b59234c4623bf917212bb2536d647574c8e7e5da92c2ede0c9f8856040518082815260200191505060405180910390a38373ffffffffffffffffffffffffffffffffffffffff16600073ffffffffffffffffffffffffffffffffffffffff167fddf252ad1be2c89b69c2b068fc378daa952ba7f163c4a11628f55a4df523b3ef856040518082815260200191505060405180910390a3600191505092915050565b600160149054906101000a900460ff1615612582576040517f08c379a00000000000000000000000000000000000000000000000000000000081526004018080602001828103825260108152602001807f5061757361626c653a207061757365640000000000000000000000000000000081525060200191505060405180910390fd5b600a60003373ffffffffffffffffffffffffffffffffffffffff1673ffffffffffffffffffffffffffffffffffffffff16815260200190815260200160002060009054906101000a900460ff16612624576040517f08c379a000000000000000000000000000000000000000000000000000000000815260040180806020018281038252602181526020018061573d6021913960400191505060405180910390fd5b6000600760003373ffffffffffffffffffffffffffffffffffffffff1673ffffffffffffffffffffffffffffffffffffffff168152602001908152602001600020549050600082116126c1576040517f08c379a00000000000000000000000000000000000000000000000000000000081526004018080602001828103825260298152602001806155926029913960400191505060405180910390fd5b8181101561271a576040517f08c379a00000000000000000000000000000000000000000000000000000000081526004018080602001828103825260268152602001806157176026913960400191505060405180910390fd5b61272f8260095461401990919063ffffffff16565b600981905550612748828261401990919063ffffffff16565b600760003373ffffffffffffffffffffffffffffffffffffffff1673ffffffffffffffffffffffffffffffffffffffff168152602001908152602001600020819055503373ffffffffffffffffffffffffffffffffffffffff167fcc16f5dbb4873280815c1ee09dbd06736cffcc184412cf7a71a0fdb75d397ca5836040518082815260200191505060405180910390a2600073ffffffffffffffffffffffffffffffffffffffff163373ffffffffffffffffffffffffffffffffffffffff167fddf252ad1be2c89b69c2b068fc378daa952ba7f163c4a11628f55a4df523b3ef846040518082815260200191505060405180910390a35050565b6000600160149054906101000a900460ff16156128c8576040517f08c379a00000000000000000000000000000000000000000000000000000000081526004018080602001828103825260108152602001807f5061757361626c653a207061757365640000000000000000000000000000000081525060200191505060405180910390fd5b600660009054906101000a900473ffffffffffffffffffffffffffffffffffffffff1673ffffffffffffffffffffffffffffffffffffffff163373ffffffffffffffffffffffffffffffffffffffff161461296e576040517f08c379a00000000000000000000000000000000000000000000000000000000081526004018080602001828103825260298152602001806156ee6029913960400191505060405180910390fd5b6001600a60008573ffffffffffffffffffffffffffffffffffffffff1673ffffffffffffffffffffffffffffffffffffffff16815260200190815260200160002060006101000a81548160ff02191690831515021790555081600b60008573ffffffffffffffffffffffffffffffffffffffff1673ffffffffffffffffffffffffffffffffffffffff168152602001908152602001600020819055508273ffffffffffffffffffffffffffffffffffffffff167f46980fca912ef9bcdbd36877427b6b90e860769f604e89c0e67720cece530d20836040518082815260200191505060405180910390a26001905092915050565b60606040518060400160405280600181526020017f3200000000000000000000000000000000000000000000000000000000000000815250905090565b60008054906101000a900473ffffffffffffffffffffffffffffffffffffffff1673ffffffffffffffffffffffffffffffffffffffff163373ffffffffffffffffffffffffffffffffffffffff1614612b60576040517f08c379a00000000000000000000000000000000000000000000000000000000081526004018080602001828103825260208152602001807f4f776e61626c653a2063616c6c6572206973206e6f7420746865206f776e657281525060200191505060405180910390fd5b600073ffffffffffffffffffffffffffffffffffffffff168173ffffffffffffffffffffffffffffffffffffffff161415612be6576040517f08c379a000000000000000000000000000000000000000000000000000000000815260040180806020018281038252602881526020018061553f6028913960400191505060405180910390fd5b80600160006101000a81548173ffffffffffffffffffffffffffffffffffffffff021916908373ffffffffffffffffffffffffffffffffffffffff160217905550600160009054906101000a900473ffffffffffffffffffffffffffffffffffffffff1673ffffffffffffffffffffffffffffffffffffffff167fb80482a293ca2e013eda8683c9bd7fc8347cfdaeea5ede58cba46df502c2a60460405160405180910390a250565b600160149054906101000a900460ff1615612d12576040517f08c379a00000000000000000000000000000000000000000000000000000000081526004018080602001828103825260108152602001807f5061757361626c653a207061757365640000000000000000000000000000000081525060200191505060405180910390fd5b612d1f85858585856141cc565b5050505050565b600160149054906101000a900460ff1681565b6000600760008373ffffffffffffffffffffffffffffffffffffffff1673ffffffffffffffffffffffffffffffffffffffff168152602001908152602001600020549050919050565b6000600f60008373ffffffffffffffffffffffffffffffffffffffff1673ffffffffffffffffffffffffffffffffffffffff168152602001908152602001600020549050919050565b7fd099cc98ef71107a616c4f0f941f04c322d8e254fe26b3c6668db87aae413de860001b81565b600160009054906101000a900473ffffffffffffffffffffffffffffffffffffffff1673ffffffffffffffffffffffffffffffffffffffff163373ffffffffffffffffffffffffffffffffffffffff1614612e98576040517f08c379a00000000000000000000000000000000000000000000000000000000081526004018080602001828103825260228152602001806158cd6022913960400191505060405180910390fd5b60018060146101000a81548160ff0219169083151502179055507f6985a02210a168e66602d3235cb6db0e70f92b3ba4d376a33c0f3d9434bff62560405160405180910390a1565b6000600b60008373ffffffffffffffffffffffffffffffffffffffff1673ffffffffffffffffffffffffffffffffffffffff168152602001908152602001600020549050919050565b60008060009054906101000a900473ffffffffffffffffffffffffffffffffffffffff16905090565b60038054600181600116156101000203166002900480601f016020809104026020016040519081016040528092919081815260200182805460018160011615610100020316600290048015612fe85780601f10612fbd57610100808354040283529160200191612fe8565b820191906000526020600020905b815481529060010190602001808311612fcb57829003601f168201915b505050505081565b600160009054906101000a900473ffffffffffffffffffffffffffffffffffffffff1681565b7f7c7c6cdb67a18743f49ec6fa9b35f50d52ed05cbed4cc592e13b44501c1a226760001b81565b6000600160149054906101000a900460ff16156130c2576040517f08c379a00000000000000000000000000000000000000000000000000000000081526004018080602001828103825260108152602001807f5061757361626c653a207061757365640000000000000000000000000000000081525060200191505060405180910390fd5b6130cd3384846143a7565b6001905092915050565b6000600160149054906101000a900460ff161561315c576040517f08c379a00000000000000000000000000000000000000000000000000000000081526004018080602001828103825260108152602001807f5061757361626c653a207061757365640000000000000000000000000000000081525060200191505060405180910390fd5b613167338484613ce1565b6001905092915050565b60008054906101000a900473ffffffffffffffffffffffffffffffffffffffff1673ffffffffffffffffffffffffffffffffffffffff163373ffffffffffffffffffffffffffffffffffffffff1614613232576040517f08c379a00000000000000000000000000000000000000000000000000000000081526004018080602001828103825260208152602001807f4f776e61626c653a2063616c6c6572206973206e6f7420746865206f776e657281525060200191505060405180910390fd5b600073ffffffffffffffffffffffffffffffffffffffff168173ffffffffffffffffffffffffffffffffffffffff1614156132b8576040517f08c379a000000000000000000000000000000000000000000000000000000000815260040180806020018281038252602f81526020018061575e602f913960400191505060405180910390fd5b80600660006101000a81548173ffffffffffffffffffffffffffffffffffffffff021916908373ffffffffffffffffffffffffffffffffffffffff160217905550600660009054906101000a900473ffffffffffffffffffffffffffffffffffffffff1673ffffffffffffffffffffffffffffffffffffffff167fdb66dfa9c6b8f5226fe9aac7e51897ae8ee94ac31dc70bb6c9900b2574b707e660405160405180910390a250565b6000600a60008373ffffffffffffffffffffffffffffffffffffffff1673ffffffffffffffffffffffffffffffffffffffff16815260200190815260200160002060009054906101000a900460ff169050919050565b600c60009054906101000a900473ffffffffffffffffffffffffffffffffffffffff1673ffffffffffffffffffffffffffffffffffffffff163373ffffffffffffffffffffffffffffffffffffffff161461345d576040517f08c379a000000000000000000000000000000000000000000000000000000000815260040180806020018281038252602481526020018061578d6024913960400191505060405180910390fd5b61348882828573ffffffffffffffffffffffffffffffffffffffff1661445f9092919063ffffffff16565b505050565b600160149054906101000a900460ff1615613510576040517f08c379a00000000000000000000000000000000000000000000000000000000081526004018080602001828103825260108152602001807f5061757361626c653a207061757365640000000000000000000000000000000081525060200191505060405180910390fd5b61351f87878787878787614501565b50505050505050565b600660149054906101000a900460ff16801561355657506000601060009054906101000a900460ff1660ff16145b61355f57600080fd5b81816002919061357092919061547e565b506135f482828080601f016020809104026020016040519081016040528093929190818152602001838380828437600081840152601f19601f820116905080830192505050505050506040518060400160405280600181526020017f3200000000000000000000000000000000000000000000000000000000000000815250614723565b600d819055506001601060006101000a81548160ff021916908360ff1602179055505050565b7f158b0a9edf7a828aad02f63cd515c68ef2f50ba807396f6d12842833a159742960001b81565b6000600860008473ffffffffffffffffffffffffffffffffffffffff1673ffffffffffffffffffffffffffffffffffffffff16815260200190815260200160002060008373ffffffffffffffffffffffffffffffffffffffff1673ffffffffffffffffffffffffffffffffffffffff16815260200190815260200160002054905092915050565b600160149054906101000a900460ff161561374b576040517f08c379a00000000000000000000000000000000000000000000000000000000081526004018080602001828103825260108152602001807f5061757361626c653a207061757365640000000000000000000000000000000081525060200191505060405180910390fd5b61375c8989898989898989896147bd565b505050505050505050565b60058054600181600116156101000203166002900480601f0160208091040260200160405190810160405280929190818152602001828054600181600116156101000203166002900480156137fd5780601f106137d2576101008083540402835291602001916137fd565b820191906000526020600020905b8154815290600101906020018083116137e057829003601f168201915b505050505081565b6000600e60008473ffffffffffffffffffffffffffffffffffffffff1673ffffffffffffffffffffffffffffffffffffffff168152602001908152602001600020600083815260200190815260200160002060009054906101000a900460ff16905092915050565b600160149054906101000a900460ff16156138f0576040517f08c379a00000000000000000000000000000000000000000000000000000000081526004018080602001828103825260108152602001807f5061757361626c653a207061757365640000000000000000000000000000000081525060200191505060405180910390fd5b61390189898989898989898961493c565b505050505050505050565b60008054906101000a900473ffffffffffffffffffffffffffffffffffffffff1673ffffffffffffffffffffffffffffffffffffffff163373ffffffffffffffffffffffffffffffffffffffff16146139cd576040517f08c379a00000000000000000000000000000000000000000000000000000000081526004018080602001828103825260208152602001807f4f776e61626c653a2063616c6c6572206973206e6f7420746865206f776e657281525060200191505060405180910390fd5b600073ffffffffffffffffffffffffffffffffffffffff168173ffffffffffffffffffffffffffffffffffffffff161415613a53576040517f08c379a00000000000000000000000000000000000000000000000000000000081526004018080602001828103825260268152602001806156046026913960400191505060405180910390fd5b7f8be0079c531659141344cd1fd0a4f28419497f9722a3daafe3b4186f6b6457e060008054906101000a900473ffffffffffffffffffffffffffffffffffffffff1682604051808373ffffffffffffffffffffffffffffffffffffffff1681526020018273ffffffffffffffffffffffffffffffffffffffff1681526020019250505060405180910390a1613ae781614063565b50565b600073ffffffffffffffffffffffffffffffffffffffff168373ffffffffffffffffffffffffffffffffffffffff161415613b70576040517f08c379a000000000000000000000000000000000000000000000000000000000815260040180806020018281038252602481526020018061587b6024913960400191505060405180910390fd5b600073ffffffffffffffffffffffffffffffffffffffff168273ffffffffffffffffffffffffffffffffffffffff161415613bf6576040517f08c379a000000000000000000000000000000000000000000000000000000000815260040180806020018281038252602281526020018061562a6022913960400191505060405180910390fd5b80600860008573ffffffffffffffffffffffffffffffffffffffff1673ffffffffffffffffffffffffffffffffffffffff16815260200190815260200160002060008473ffffffffffffffffffffffffffffffffffffffff1673ffffffffffffffffffffffffffffffffffffffff168152602001908152602001600020819055508173ffffffffffffffffffffffffffffffffffffffff168373ffffffffffffffffffffffffffffffffffffffff167f8c5be1e5ebec7d5bd14f71427d1e84f3dd0314c0f7b2291e5b200ac8c7c3b925836040518082815260200191505060405180910390a3505050565b600073ffffffffffffffffffffffffffffffffffffffff168373ffffffffffffffffffffffffffffffffffffffff161415613d67576040517f08c379a00000000000000000000000000000000000000000000000000000000081526004018080602001828103825260258152602001806158566025913960400191505060405180910390fd5b600073ffffffffffffffffffffffffffffffffffffffff168273ffffffffffffffffffffffffffffffffffffffff161415613ded576040517f08c379a000000000000000000000000000000000000000000000000000000000815260040180806020018281038252602381526020018061551c6023913960400191505060405180910390fd5b600760008473ffffffffffffffffffffffffffffffffffffffff1673ffffffffffffffffffffffffffffffffffffffff16815260200190815260200160002054811115613e85576040517f08c379a00000000000000000000000000000000000000000000000000000000081526004018080602001828103825260268152602001806156c86026913960400191505060405180910390fd5b613ed781600760008673ffffffffffffffffffffffffffffffffffffffff1673ffffffffffffffffffffffffffffffffffffffff1681526020019081526020016000205461401990919063ffffffff16565b600760008573ffffffffffffffffffffffffffffffffffffffff1673ffffffffffffffffffffffffffffffffffffffff16815260200190815260200160002081905550613f6c81600760008573ffffffffffffffffffffffffffffffffffffffff1673ffffffffffffffffffffffffffffffffffffffff1681526020019081526020016000205461414490919063ffffffff16565b600760008473ffffffffffffffffffffffffffffffffffffffff1673ffffffffffffffffffffffffffffffffffffffff168152602001908152602001600020819055508173ffffffffffffffffffffffffffffffffffffffff168373ffffffffffffffffffffffffffffffffffffffff167fddf252ad1be2c89b69c2b068fc378daa952ba7f163c4a11628f55a4df523b3ef836040518082815260200191505060405180910390a3505050565b600061405b83836040518060400160405280601e81526020017f536166654d6174683a207375627472616374696f6e206f766572666c6f770000815250614b3f565b905092915050565b806000806101000a81548173ffffffffffffffffffffffffffffffffffffffff021916908373ffffffffffffffffffffffffffffffffffffffff16021790555050565b61413f838361413a84600860008973ffffffffffffffffffffffffffffffffffffffff1673ffffffffffffffffffffffffffffffffffffffff16815260200190815260200160002060008873ffffffffffffffffffffffffffffffffffffffff1673ffffffffffffffffffffffffffffffffffffffff1681526020019081526020016000205461414490919063ffffffff16565b613aea565b505050565b6000808284019050838110156141c2576040517f08c379a000000000000000000000000000000000000000000000000000000000815260040180806020018281038252601b8152602001807f536166654d6174683a206164646974696f6e206f766572666c6f77000000000081525060200191505060405180910390fd5b8091505092915050565b6141d68585614bff565b60607f158b0a9edf7a828aad02f63cd515c68ef2f50ba807396f6d12842833a159742960001b8686604051602001808481526020018373ffffffffffffffffffffffffffffffffffffffff168152602001828152602001935050505060405160208183030381529060405290508573ffffffffffffffffffffffffffffffffffffffff16614269600d5486868686614cb7565b73ffffffffffffffffffffffffffffffffffffffff16146142f2576040517f08c379a000000000000000000000000000000000000000000000000000000000815260040180806020018281038252601e8152602001807f46696174546f6b656e56323a20696e76616c6964207369676e6174757265000081525060200191505060405180910390fd5b6001600e60008873ffffffffffffffffffffffffffffffffffffffff1673ffffffffffffffffffffffffffffffffffffffff168152602001908152602001600020600087815260200190815260200160002060006101000a81548160ff021916908315150217905550848673ffffffffffffffffffffffffffffffffffffffff167f1cdd46ff242716cdaa72d159d339a485b3438398348d68f09d7c8c0a59353d8160405160405180910390a3505050505050565b61445a8383614455846040518060600160405280602581526020016159ba60259139600860008a73ffffffffffffffffffffffffffffffffffffffff1673ffffffffffffffffffffffffffffffffffffffff16815260200190815260200160002060008973ffffffffffffffffffffffffffffffffffffffff1673ffffffffffffffffffffffffffffffffffffffff16815260200190815260200160002054614b3f9092919063ffffffff16565b613aea565b505050565b6144fc8363a9059cbb60e01b8484604051602401808373ffffffffffffffffffffffffffffffffffffffff16815260200182815260200192505050604051602081830303815290604052907bffffffffffffffffffffffffffffffffffffffffffffffffffffffff19166020820180517bffffffffffffffffffffffffffffffffffffffffffffffffffffffff8381831617835250505050614d32565b505050565b42841015614577576040517f08c379a000000000000000000000000000000000000000000000000000000000815260040180806020018281038252601e8152602001807f46696174546f6b656e56323a207065726d69742069732065787069726564000081525060200191505060405180910390fd5b60607f6e71edae12b1b97f4d1f60370fef10105fa2faae0126114a169c64845d6126c960001b888888600f60008d73ffffffffffffffffffffffffffffffffffffffff1673ffffffffffffffffffffffffffffffffffffffff16815260200190815260200160002060008154809291906001019190505589604051602001808781526020018673ffffffffffffffffffffffffffffffffffffffff1681526020018573ffffffffffffffffffffffffffffffffffffffff168152602001848152602001838152602001828152602001965050505050505060405160208183030381529060405290508773ffffffffffffffffffffffffffffffffffffffff16614685600d5486868686614cb7565b73ffffffffffffffffffffffffffffffffffffffff161461470e576040517f08c379a000000000000000000000000000000000000000000000000000000000815260040180806020018281038252601a8152602001807f454950323631323a20696e76616c6964207369676e617475726500000000000081525060200191505060405180910390fd5b614719888888613aea565b5050505050505050565b6000804690507f8b73c3c69bb8fe3d512ecc4cf759cc79239f7b179b0ffacaa9a75d522b39400f848051906020012084805190602001208330604051602001808681526020018581526020018481526020018381526020018273ffffffffffffffffffffffffffffffffffffffff168152602001955050505050506040516020818303038152906040528051906020012091505092915050565b6147c989858888614e21565b60607f7c7c6cdb67a18743f49ec6fa9b35f50d52ed05cbed4cc592e13b44501c1a226760001b8a8a8a8a8a8a604051602001808881526020018773ffffffffffffffffffffffffffffffffffffffff1681526020018673ffffffffffffffffffffffffffffffffffffffff16815260200185815260200184815260200183815260200182815260200197505050505050505060405160208183030381529060405290508973ffffffffffffffffffffffffffffffffffffffff16614892600d5486868686614cb7565b73ffffffffffffffffffffffffffffffffffffffff161461491b576040517f08c379a000000000000000000000000000000000000000000000000000000000815260040180806020018281038252601e8152602001807f46696174546f6b656e56323a20696e76616c6964207369676e6174757265000081525060200191505060405180910390fd5b6149258a86614ee1565b6149308a8a8a613ce1565b50505050505050505050565b3373ffffffffffffffffffffffffffffffffffffffff168873ffffffffffffffffffffffffffffffffffffffff16146149c0576040517f08c379a00000000000000000000000000000000000000000000000000000000081526004018080602001828103825260258152602001806158076025913960400191505060405180910390fd5b6149cc89858888614e21565b60607fd099cc98ef71107a616c4f0f941f04c322d8e254fe26b3c6668db87aae413de860001b8a8a8a8a8a8a604051602001808881526020018773ffffffffffffffffffffffffffffffffffffffff1681526020018673ffffffffffffffffffffffffffffffffffffffff16815260200185815260200184815260200183815260200182815260200197505050505050505060405160208183030381529060405290508973ffffffffffffffffffffffffffffffffffffffff16614a95600d5486868686614cb7565b73ffffffffffffffffffffffffffffffffffffffff1614614b1e576040517f08c379a000000000000000000000000000000000000000000000000000000000815260040180806020018281038252601e8152602001807f46696174546f6b656e56323a20696e76616c6964207369676e6174757265000081525060200191505060405180910390fd5b614b288a86614ee1565b614b338a8a8a613ce1565b50505050505050505050565b6000838311158290614bec576040517f08c379a00000000000000000000000000000000000000000000000000000000081526004018080602001828103825283818151815260200191508051906020019080838360005b83811015614bb1578082015181840152602081019050614b96565b50505050905090810190601f168015614bde5780820380516001836020036101000a031916815260200191505b509250505060405180910390fd5b5060008385039050809150509392505050565b600e60008373ffffffffffffffffffffffffffffffffffffffff1673ffffffffffffffffffffffffffffffffffffffff168152602001908152602001600020600082815260200190815260200160002060009054906101000a900460ff1615614cb3576040517f08c379a000000000000000000000000000000000000000000000000000000000815260040180806020018281038252602e815260200180615967602e913960400191505060405180910390fd5b5050565b60008086838051906020012060405160200180807f190100000000000000000000000000000000000000000000000000000000000081525060020183815260200182815260200192505050604051602081830303815290604052805190602001209050614d2681878787614f92565b91505095945050505050565b6060614d94826040518060400160405280602081526020017f5361666545524332303a206c6f772d6c6576656c2063616c6c206661696c65648152508573ffffffffffffffffffffffffffffffffffffffff166151959092919063ffffffff16565b9050600081511115614e1c57808060200190516020811015614db557600080fd5b8101908080519060200190929190505050614e1b576040517f08c379a000000000000000000000000000000000000000000000000000000000815260040180806020018281038252602a815260200180615915602a913960400191505060405180910390fd5b5b505050565b814211614e79576040517f08c379a000000000000000000000000000000000000000000000000000000000815260040180806020018281038252602b815260200180615567602b913960400191505060405180910390fd5b804210614ed1576040517f08c379a00000000000000000000000000000000000000000000000000000000081526004018080602001828103825260258152602001806159956025913960400191505060405180910390fd5b614edb8484614bff565b50505050565b6001600e60008473ffffffffffffffffffffffffffffffffffffffff1673ffffffffffffffffffffffffffffffffffffffff168152602001908152602001600020600083815260200190815260200160002060006101000a81548160ff021916908315150217905550808273ffffffffffffffffffffffffffffffffffffffff167f98de503528ee59b575ef0c0a2576a82497bfc029a5685b209e9ec333479b10a560405160405180910390a35050565b60007f7fffffffffffffffffffffffffffffff5d576e7357a4501ddfe92f46681b20a08260001c1115615010576040517f08c379a00000000000000000000000000000000000000000000000000000000081526004018080602001828103825260268152602001806158ef6026913960400191505060405180910390fd5b601b8460ff16141580156150285750601c8460ff1614155b1561507e576040517f08c379a00000000000000000000000000000000000000000000000000000000081526004018080602001828103825260268152602001806155de6026913960400191505060405180910390fd5b600060018686868660405160008152602001604052604051808581526020018460ff1681526020018381526020018281526020019450505050506020604051602081039080840390855afa1580156150da573d6000803e3d6000fd5b505050602060405103519050600073ffffffffffffffffffffffffffffffffffffffff168173ffffffffffffffffffffffffffffffffffffffff161415615189576040517f08c379a000000000000000000000000000000000000000000000000000000000815260040180806020018281038252601c8152602001807f45435265636f7665723a20696e76616c6964207369676e61747572650000000081525060200191505060405180910390fd5b80915050949350505050565b60606151a484846000856151ad565b90509392505050565b60606151b8856153b3565b61522a576040517f08c379a000000000000000000000000000000000000000000000000000000000815260040180806020018281038252601d8152602001807f416464726573733a2063616c6c20746f206e6f6e2d636f6e747261637400000081525060200191505060405180910390fd5b600060608673ffffffffffffffffffffffffffffffffffffffff1685876040518082805190602001908083835b6020831061527a5780518252602082019150602081019050602083039250615257565b6001836020036101000a03801982511681845116808217855250505050505090500191505060006040518083038185875af1925050503d80600081146152dc576040519150601f19603f3d011682016040523d82523d6000602084013e6152e1565b606091505b509150915081156152f65780925050506153ab565b6000815111156153095780518082602001fd5b836040517f08c379a00000000000000000000000000000000000000000000000000000000081526004018080602001828103825283818151815260200191508051906020019080838360005b83811015615370578082015181840152602081019050615355565b50505050905090810190601f16801561539d5780820380516001836020036101000a031916815260200191505b509250505060405180910390fd5b949350505050565b60008060007fc5d2460186f7233c927e7db2dcc703c0e500b653ca82273b7bfad8045d85a47060001b9050833f91508082141580156153f557506000801b8214155b92505050919050565b828054600181600116156101000203166002900490600052602060002090601f016020900481019282601f1061543f57805160ff191683800117855561546d565b8280016001018555821561546d579182015b8281111561546c578251825591602001919060010190615451565b5b50905061547a91906154fe565b5090565b828054600181600116156101000203166002900490600052602060002090601f016020900481019282601f106154bf57803560ff19168380011785556154ed565b828001600101855582156154ed579182015b828111156154ec5782358255916020019190600101906154d1565b5b5090506154fa91906154fe565b5090565b5b808211156155175760008160009055506001016154ff565b509056fe45524332303a207472616e7366657220746f20746865207a65726f20616464726573735061757361626c653a206e65772070617573657220697320746865207a65726f206164647265737346696174546f6b656e56323a20617574686f72697a6174696f6e206973206e6f74207965742076616c696446696174546f6b656e3a206275726e20616d6f756e74206e6f742067726561746572207468616e203046696174546f6b656e3a206d696e7420746f20746865207a65726f206164647265737345435265636f7665723a20696e76616c6964207369676e6174757265202776272076616c75654f776e61626c653a206e6577206f776e657220697320746865207a65726f206164647265737345524332303a20617070726f766520746f20746865207a65726f206164647265737346696174546f6b656e3a206e65772070617573657220697320746865207a65726f2061646472657373526573637561626c653a206e6577207265736375657220697320746865207a65726f206164647265737346696174546f6b656e3a206d696e7420616d6f756e74206e6f742067726561746572207468616e203045524332303a207472616e7366657220616d6f756e7420657863656564732062616c616e636546696174546f6b656e3a2063616c6c6572206973206e6f7420746865206d61737465724d696e74657246696174546f6b656e3a206275726e20616d6f756e7420657863656564732062616c616e636546696174546f6b656e3a2063616c6c6572206973206e6f742061206d696e74657246696174546f6b656e3a206e6577206d61737465724d696e74657220697320746865207a65726f2061646472657373526573637561626c653a2063616c6c6572206973206e6f7420746865207265736375657245524332303a207472616e7366657220616d6f756e74206578636565647320616c6c6f77616e636546696174546f6b656e3a206e657720626c61636b6c697374657220697320746865207a65726f206164647265737346696174546f6b656e56323a2063616c6c6572206d7573742062652074686520706179656546696174546f6b656e3a20636f6e747261637420697320616c726561647920696e697469616c697a656445524332303a207472616e736665722066726f6d20746865207a65726f206164647265737345524332303a20617070726f76652066726f6d20746865207a65726f206164647265737346696174546f6b656e3a206d696e7420616d6f756e742065786365656473206d696e746572416c6c6f77616e63655061757361626c653a2063616c6c6572206973206e6f74207468652070617573657245435265636f7665723a20696e76616c6964207369676e6174757265202773272076616c75655361666545524332303a204552433230206f7065726174696f6e20646964206e6f74207375636365656446696174546f6b656e3a206e6577206f776e657220697320746865207a65726f206164647265737346696174546f6b656e56323a20617574686f72697a6174696f6e2069732075736564206f722063616e63656c656446696174546f6b656e56323a20617574686f72697a6174696f6e206973206578706972656445524332303a2064656372656173656420616c6c6f77616e63652062656c6f77207a65726fa26469706673582212201d252768463a79e2c9112789abf532ba21e9c65683d907ad66973f50a4f693e764736f6c634300060c0033",
  "devdoc": {
    "kind": "dev",
    "methods": {
      "allowance(address,address)": {
        "params": {
          "owner": "Token owner's address",
          "spender": "Spender's address"
        },
        "returns": {
          "_0": "Allowance amount"
        }
      },
      "approve(address,uint256)": {
        "params": {
          "spender": "Spender's address",
          "value": "Allowance amount"
        },
        "returns": {
          "_0": "True if successful"
        }
      },
      "authorizationState(address,bytes32)": {
        "details": "Nonces are randomly generated 32-byte data unique to the authorizer's address",
        "params": {
          "authorizer": "Authorizer's address",
          "nonce": "Nonce of the authorization"
        },
        "returns": {
          "_0": "True if the nonce is used"
        }
      },
      "balanceOf(address)": {
        "details": "Get token balance of an account",
        "params": {
          "account": "address The account"
        }
      },
      "burn(uint256)": {
        "details": "allows a minter to burn some of its own tokens Validates that caller is a minter and that sender is not blacklisted amount is less than or equal to the minter's account balance",
        "params": {
          "_amount": "uint256 the amount of tokens to be burned"
        }
      },
      "cancelAuthorization(address,bytes32,uint8,bytes32,bytes32)": {
        "details": "Works only if the authorization is not yet used.",
        "params": {
          "authorizer": "Authorizer's address",
          "nonce": "Nonce of the authorization",
          "r": "r of the signature",
          "s": "s of the signature",
          "v": "v of the signature"
        }
      },
      "configureMinter(address,uint256)": {
        "details": "Function to add/update a new minter",
        "params": {
          "minter": "The address of the minter",
          "minterAllowedAmount": "The minting amount allowed for the minter"
        },
        "returns": {
          "_0": "True if the operation was successful."
        }
      },
      "decreaseAllowance(address,uint256)": {
        "params": {
          "decrement": "Amount of decrease in allowance",
          "spender": "Spender's address"
        },
        "returns": {
          "_0": "True if successful"
        }
      },
      "increaseAllowance(address,uint256)": {
        "params": {
          "increment": "Amount of increase in allowance",
          "spender": "Spender's address"
        },
        "returns": {
          "_0": "True if successful"
        }
      },
      "initializeV2(string)": {
        "params": {
          "newName": "New token name"
        }
      },
      "initializeV2_1(address)": {
        "params": {
          "lostAndFound": "The address to which the locked funds are sent"
        }
      },
      "isMinter(address)": {
        "details": "Checks if account is a minter",
        "params": {
          "account": "The address to check"
        }
      },
      "mint(address,uint256)": {
        "details": "Function to mint tokens",
        "params": {
          "_amount": "The amount of tokens to mint. Must be less than or equal to the minterAllowance of the caller.",
          "_to": "The address that will receive the minted tokens."
        },
        "returns": {
          "_0": "A boolean that indicates if the operation was successful."
        }
      },
      "minterAllowance(address)": {
        "details": "Get minter allowance for an account",
        "params": {
          "minter": "The address of the minter"
        }
      },
      "nonces(address)": {
        "params": {
          "owner": "Token owner's address (Authorizer)"
        },
        "returns": {
          "_0": "Next nonce"
        }
      },
      "owner()": {
        "details": "Tells the address of the owner",
        "returns": {
          "_0": "the address of the owner"
        }
      },
      "pause()": {
        "details": "called by the owner to pause, triggers stopped state"
      },
      "permit(address,address,uint256,uint256,uint8,bytes32,bytes32)": {
        "params": {
          "deadline": "Expiration time, seconds since the epoch",
          "owner": "Token owner's address (Authorizer)",
          "r": "r of the signature",
          "s": "s of the signature",
          "spender": "Spender's address",
          "v": "v of the signature",
          "value": "Amount of allowance"
        }
      },
      "receiveWithAuthorization(address,address,uint256,uint256,uint256,bytes32,uint8,bytes32,bytes32)": {
        "details": "This has an additional check to ensure that the payee's address matches the caller of this function to prevent front-running attacks.",
        "params": {
          "from": "Payer's address (Authorizer)",
          "nonce": "Unique nonce",
          "r": "r of the signature",
          "s": "s of the signature",
          "to": "Payee's address",
          "v": "v of the signature",
          "validAfter": "The time after which this is valid (unix time)",
          "validBefore": "The time before which this is valid (unix time)",
          "value": "Amount to be transferred"
        }
      },
      "removeMinter(address)": {
        "details": "Function to remove a minter",
        "params": {
          "minter": "The address of the minter to remove"
        },
        "returns": {
          "_0": "True if the operation was successful."
        }
      },
      "rescueERC20(address,address,uint256)": {
        "params": {
          "amount": "Amount to withdraw",
          "to": "Recipient address",
          "tokenContract": "ERC20 token contract address"
        }
      },
      "rescuer()": {
        "returns": {
          "_0": "Rescuer's address"
        }
      },
      "totalSupply()": {
        "details": "Get totalSupply of token"
      },
      "transfer(address,uint256)": {
        "params": {
          "to": "Payee's address",
          "value": "Transfer amount"
        },
        "returns": {
          "_0": "True if successful"
        }
      },
      "transferFrom(address,address,uint256)": {
        "params": {
          "from": "Payer's address",
          "to": "Payee's address",
          "value": "Transfer amount"
        },
        "returns": {
          "_0": "True if successful"
        }
      },
      "transferOwnership(address)": {
        "details": "Allows the current owner to transfer control of the contract to a newOwner.",
        "params": {
          "newOwner": "The address to transfer ownership to."
        }
      },
      "transferWithAuthorization(address,address,uint256,uint256,uint256,bytes32,uint8,bytes32,bytes32)": {
        "params": {
          "from": "Payer's address (Authorizer)",
          "nonce": "Unique nonce",
          "r": "r of the signature",
          "s": "s of the signature",
          "to": "Payee's address",
          "v": "v of the signature",
          "validAfter": "The time after which this is valid (unix time)",
          "validBefore": "The time before which this is valid (unix time)",
          "value": "Amount to be transferred"
        }
      },
      "unpause()": {
        "details": "called by the owner to unpause, returns to normal state"
      },
      "updatePauser(address)": {
        "details": "update the pauser role"
      },
      "updateRescuer(address)": {
        "params": {
          "newRescuer": "New rescuer's address"
        }
      },
      "version()": {
        "returns": {
          "_0": "Version string"
        }
      }
    },
    "title": "FiatToken V2.1",
    "version": 1
  },
  "userdoc": {
    "kind": "user",
    "methods": {
      "allowance(address,address)": {
        "notice": "Amount of remaining tokens spender is allowed to transfer on behalf of the token owner"
      },
      "approve(address,uint256)": {
        "notice": "Set spender's allowance over the caller's tokens to be a given value."
      },
      "authorizationState(address,bytes32)": {
        "notice": "Returns the state of an authorization"
      },
      "cancelAuthorization(address,bytes32,uint8,bytes32,bytes32)": {
        "notice": "Attempt to cancel an authorization"
      },
      "decreaseAllowance(address,uint256)": {
        "notice": "Decrease the allowance by a given decrement"
      },
      "increaseAllowance(address,uint256)": {
        "notice": "Increase the allowance by a given increment"
      },
      "initializeV2(string)": {
        "notice": "Initialize v2"
      },
      "initializeV2_1(address)": {
        "notice": "Initialize v2.1"
      },
      "nonces(address)": {
        "notice": "Nonces for permit"
      },
      "permit(address,address,uint256,uint256,uint8,bytes32,bytes32)": {
        "notice": "Update allowance with a signed permit"
      },
      "receiveWithAuthorization(address,address,uint256,uint256,uint256,bytes32,uint8,bytes32,bytes32)": {
        "notice": "Receive a transfer with a signed authorization from the payer"
      },
      "rescueERC20(address,address,uint256)": {
        "notice": "Rescue ERC20 tokens locked up in this contract."
      },
      "rescuer()": {
        "notice": "Returns current rescuer"
      },
      "transfer(address,uint256)": {
        "notice": "Transfer tokens from the caller"
      },
      "transferFrom(address,address,uint256)": {
        "notice": "Transfer tokens by spending allowance"
      },
      "transferWithAuthorization(address,address,uint256,uint256,uint256,bytes32,uint8,bytes32,bytes32)": {
        "notice": "Execute a transfer with a signed authorization"
      },
      "updateRescuer(address)": {
        "notice": "Assign the rescuer role to a given address."
      },
      "version()": {
        "notice": "Version string for the EIP712 domain separator"
      }
    },
    "notice": "ERC20 Token backed by fiat reserves, version 2.1",
    "version": 1
  },
  "storageLayout": {
    "storage": [
      {
        "astId": 298,
        "contract": "contracts/test/USDC_ETH.sol:FiatTokenV2_1",
        "label": "_owner",
        "offset": 0,
        "slot": "0",
        "type": "t_address"
      },
      {
        "astId": 391,
        "contract": "contracts/test/USDC_ETH.sol:FiatTokenV2_1",
        "label": "pauser",
        "offset": 0,
        "slot": "1",
        "type": "t_address"
      },
      {
        "astId": 394,
        "contract": "contracts/test/USDC_ETH.sol:FiatTokenV2_1",
        "label": "paused",
        "offset": 20,
        "slot": "1",
        "type": "t_bool"
      },
      {
        "astId": 488,
        "contract": "contracts/test/USDC_ETH.sol:FiatTokenV2_1",
        "label": "name",
        "offset": 0,
        "slot": "2",
        "type": "t_string_storage"
      },
      {
        "astId": 490,
        "contract": "contracts/test/USDC_ETH.sol:FiatTokenV2_1",
        "label": "symbol",
        "offset": 0,
        "slot": "3",
        "type": "t_string_storage"
      },
      {
        "astId": 492,
        "contract": "contracts/test/USDC_ETH.sol:FiatTokenV2_1",
        "label": "decimals",
        "offset": 0,
        "slot": "4",
        "type": "t_uint8"
      },
      {
        "astId": 494,
        "contract": "contracts/test/USDC_ETH.sol:FiatTokenV2_1",
        "label": "currency",
        "offset": 0,
        "slot": "5",
        "type": "t_string_storage"
      },
      {
        "astId": 496,
        "contract": "contracts/test/USDC_ETH.sol:FiatTokenV2_1",
        "label": "masterMinter",
        "offset": 0,
        "slot": "6",
        "type": "t_address"
      },
      {
        "astId": 498,
        "contract": "contracts/test/USDC_ETH.sol:FiatTokenV2_1",
        "label": "initialized",
        "offset": 20,
        "slot": "6",
        "type": "t_bool"
      },
      {
        "astId": 502,
        "contract": "contracts/test/USDC_ETH.sol:FiatTokenV2_1",
        "label": "balances",
        "offset": 0,
        "slot": "7",
        "type": "t_mapping(t_address,t_uint256)"
      },
      {
        "astId": 508,
        "contract": "contracts/test/USDC_ETH.sol:FiatTokenV2_1",
        "label": "allowed",
        "offset": 0,
        "slot": "8",
        "type": "t_mapping(t_address,t_mapping(t_address,t_uint256))"
      },
      {
        "astId": 511,
        "contract": "contracts/test/USDC_ETH.sol:FiatTokenV2_1",
        "label": "totalSupply_",
        "offset": 0,
        "slot": "9",
        "type": "t_uint256"
      },
      {
        "astId": 515,
        "contract": "contracts/test/USDC_ETH.sol:FiatTokenV2_1",
        "label": "minters",
        "offset": 0,
        "slot": "10",
        "type": "t_mapping(t_address,t_bool)"
      },
      {
        "astId": 519,
        "contract": "contracts/test/USDC_ETH.sol:FiatTokenV2_1",
        "label": "minterAllowed",
        "offset": 0,
        "slot": "11",
        "type": "t_mapping(t_address,t_uint256)"
      },
      {
        "astId": 1620,
        "contract": "contracts/test/USDC_ETH.sol:FiatTokenV2_1",
        "label": "_rescuer",
        "offset": 0,
        "slot": "12",
        "type": "t_address"
      },
      {
        "astId": 1872,
        "contract": "contracts/test/USDC_ETH.sol:FiatTokenV2_1",
        "label": "DOMAIN_SEPARATOR",
        "offset": 0,
        "slot": "13",
        "type": "t_bytes32"
      },
      {
        "astId": 1895,
        "contract": "contracts/test/USDC_ETH.sol:FiatTokenV2_1",
        "label": "_authorizationStates",
        "offset": 0,
        "slot": "14",
        "type": "t_mapping(t_address,t_mapping(t_bytes32,t_bool))"
      },
      {
        "astId": 2211,
        "contract": "contracts/test/USDC_ETH.sol:FiatTokenV2_1",
        "label": "_permitNonces",
        "offset": 0,
        "slot": "15",
        "type": "t_mapping(t_address,t_uint256)"
      },
      {
        "astId": 2296,
        "contract": "contracts/test/USDC_ETH.sol:FiatTokenV2_1",
        "label": "_initializedVersion",
        "offset": 0,
        "slot": "16",
        "type": "t_uint8"
      }
    ],
    "types": {
      "t_address": {
        "encoding": "inplace",
        "label": "address",
        "numberOfBytes": "20"
      },
      "t_bool": {
        "encoding": "inplace",
        "label": "bool",
        "numberOfBytes": "1"
      },
      "t_bytes32": {
        "encoding": "inplace",
        "label": "bytes32",
        "numberOfBytes": "32"
      },
      "t_mapping(t_address,t_bool)": {
        "encoding": "mapping",
        "key": "t_address",
        "label": "mapping(address => bool)",
        "numberOfBytes": "32",
        "value": "t_bool"
      },
      "t_mapping(t_address,t_mapping(t_address,t_uint256))": {
        "encoding": "mapping",
        "key": "t_address",
        "label": "mapping(address => mapping(address => uint256))",
        "numberOfBytes": "32",
        "value": "t_mapping(t_address,t_uint256)"
      },
      "t_mapping(t_address,t_mapping(t_bytes32,t_bool))": {
        "encoding": "mapping",
        "key": "t_address",
        "label": "mapping(address => mapping(bytes32 => bool))",
        "numberOfBytes": "32",
        "value": "t_mapping(t_bytes32,t_bool)"
      },
      "t_mapping(t_address,t_uint256)": {
        "encoding": "mapping",
        "key": "t_address",
        "label": "mapping(address => uint256)",
        "numberOfBytes": "32",
        "value": "t_uint256"
      },
      "t_mapping(t_bytes32,t_bool)": {
        "encoding": "mapping",
        "key": "t_bytes32",
        "label": "mapping(bytes32 => bool)",
        "numberOfBytes": "32",
        "value": "t_bool"
      },
      "t_string_storage": {
        "encoding": "bytes",
        "label": "string",
        "numberOfBytes": "32"
      },
      "t_uint256": {
        "encoding": "inplace",
        "label": "uint256",
        "numberOfBytes": "32"
      },
      "t_uint8": {
        "encoding": "inplace",
        "label": "uint8",
        "numberOfBytes": "1"
      }
    }
  }
}